Female,Female,27,Single,Heterosexual,British,United Kingdom,Greater London,London,Urban,Apartment,3 years,Master,No,International Relations,Non-Profit Organisations,35000£,Full-time,Renting,Caucasian,"English, French",Agnostic,Western European,Citizen,"Reading, Yoga, Traveling, Podcasts","Ethical sourcing, Quality over quantity","Bi-monthly, Budget-conscious, Eclectic",Primary online,Monthly,Vegetarian,Moderate (weekly yoga and jogging),"Daily (Instagram, Twitter)","Several short trips in a year, one long-haul",Social occasions,Non-smoker,"Highly proficient, early adopter of new technologies",Eldest child with one sibling,2,None,Yes,One cat,In a relationship,Occasional care for a family member,Good,None,Generally well,Covered by national health service and private insurance,Easy access to both primary care and specialized services,Liberal,"Regular voter, local and national elections",Moderately engaged; follows debates and currents affairs,"Being budget-conscious and considering the features of the smartphone, I would probably start to find it expensive at around £600-£700 GBP.","Considering the features and quality standards I look for in products, if this smartphone were priced below £200 GBP, I would start to question its quality and reliability.","Considering my budget-conscious approach and the value I place on quality, I would start finding this smartphone relatively expensive but still worth considering at a price range of £400-£500 GBP.","Given the features, specifications, and my value for quality and technology, I would consider this smartphone to be a bargain if priced between £300-£400 GBP."
Female,Female,25,Single,Heterosexual,British,United Kingdom,Greater London,London,Urban,Apartment,2 years,Master,No,Marketing,Digital Marketing,£34000,Employed,Renting,White British,English,Agnostic,None specific,Citizen,"Blogging, Yoga, Traveling",Quality over quantity,Planned purchases,Primary online,Monthly,Pescatarian,Moderate (3 times a week),Daily,International traveler (once a year),Social Drinking,Non-smoker,High (tech-savvy),Oldest of two siblings,2 (Flatmate),0,No,0,In a relationship,None,Good,None,Stable,Insured through employer,Good,Liberal/Democratic,Regular voter,"Occasionally active, mainly during elections","As a consumer who values quality over quantity, I would consider a price point above £700 to be too expensive for this product.","Considering the features and quality expectations I have, I would perceive a price below £250 as being too low for this product, potentially indicating lower quality.","For a product with the described features and considering my shopping motivations, I would start to consider the product expensive at around £500. At this price point, I would need to carefully evaluate if the features justify the cost before making a purchase decision.","As a consumer who values quality and considering the features of this smartphone, I would consider a price point around £400 to be a bargain for this product. At this price, the value offered by the device aligns well with my quality-oriented shopping approach."
Male,Male,25,Single,Heterosexual,British,United Kingdom,Greater London,London,Urban,Apartment,1 year,Bachelor,"No, but a recent graduate",Economics,Finance,£40000,Employed,Rented,White British,English,Agnostic,Primarily Western/European practices with some interests in global cultures,Citizen,"Guitar playing, video gaming, indoor rock climbing",Quality and brand conscious,"Mindful of deals, prefers to shop during sales",Primary online,Monthly,"No restrictions, occasionally organic",Moderately active,"High, particularly fond of Twitter and Reddit",Enjoys short city-break trips a couple of times a year,Social drinker,Non-smoker,Very high with considerable usage of the latest gadgets and Personal Computer,Only child,Lives with roommate,None,No pets,None,In a relationship,None,"Good, no known health conditions",None,Generally good with occasional stress,Youth cover under family's private health insurance plan,Full access to both NHS and private healthcare,"Moderately liberal, no strict party affiliation",Votes regularly in major elections,"Occasionally follows political news, not actively involved in campaigns","As a recent graduate with an annual income of £40,000, I would consider a smartphone with the described features to be too expensive if it exceeds £600 GBP.","As someone who is quality and brand conscious, I would consider a smartphone with the described features to have questionable quality if it is priced below £200 GBP.","Given my annual income of £40,000 and my shopping motivations, I would start to consider the smartphone to be getting expensive when it reaches around £400 GBP. At this price point, I would need to carefully weigh the features and value it offers before making a purchase decision.","As someone who is quality and brand conscious, and considering the described features of the smartphone, I would consider the product to be a bargain if it is priced around £300 GBP. At this price point, I would feel like I'm getting a good deal for the quality and features offered."
Male,Male,27,Single,Heterosexual,British,United Kingdom,Greater London,London,Urban,Apartment,2 years,Master,Part-time student,Computer Science,IT Sector,£32000,Employed,Renting,White British,"English, Spanish",Agnostic,Western Culture,Citizen,"Programming, Video Gaming, Traveling",Quality and convenience,Regular online purchases for technology and clothing,Primarily online,Biweekly,"Omnivore, enjoys trying international cuisines",Moderate - occasional jogging and gym workouts,"Daily user, active on platforms like Twitter and Reddit","Annual international vacation, frequent weekend city breaks",Social drinker - primarily on weekends,Non-smoker,Highly engaged with consumer tech and gadgets,Oldest child with one younger sibling,2 - Living with a roommate,None,No Pets,0,In a relationship,None,Good,None,Stable,Covered by NHS,Good - living in a city with accessible healthcare facilities,Progressive,Votes regularly in local and national elections,Occasionally participates in political discussions and activism,"As the product is a smartphone with premium features such as a high-quality display, 5G connectivity, and a powerful processor, I would consider a price of £800 to be the limit where I would find it too expensive to purchase.","Considering the product's high-end specifications such as a 6.5-inch Super AMOLED display, 5G connectivity, and a quad-camera setup, I would expect the quality of the smartphone to be reflected in its price. Therefore, I would consider a price below £300 to be so low that I would question the quality of the product.","Considering the features and specifications of the smartphone, such as the 6.5-inch Super AMOLED display, 5G connectivity, and the MediaTek Dimensity 720 processor, I would start to find the product expensive at around £500. At this price point, although it would still be within consideration, I would need to give some thought before making the purchase.","Considering the smartphone's premium features like the 6.5-inch Super AMOLED display, 5G connectivity, quad-camera setup, and MediaTek Dimensity 720 processor, I would consider a price around £400 to be a bargain. At this price point, given the specifications offered, it would represent excellent value for the quality of the product."
Male,Male,26,Single,Heterosexual,British,United Kingdom,England,Bristol,Urban,Apartment,2 years,Master,Part-time,Computer Science,Software Development,£32000,Full-time,Rented,Caucasian,"English, Spanish",Agnostic,N/A,Citizen,"Coding, Gaming, Reading",Quality over quantity,"Budget-conscious, Infrequent splurges",Primary online,Monthly,Flexitarian,Moderate (2 times a week),Daily,"Annual international trips, frequent local excursions",Socially,Never,High (Tech savvy),"Oldest sibling, living with flatmates",3,None,No pets,0,In a relationship,None,Good,None,Stable,Covered under NHS,Good,Liberal-Democrat,Votes regularly in major elections,"Moderately informed, minimally active","As a budget-conscious shopper, I would consider the product too expensive if it exceeded £500.","Considering the features and quality expected, I would feel the product might not be of good quality if it were priced below £200.","Considering my budget-conscious approach and the value I place on quality, I would start to consider the product expensive if it were priced around £400.","Given my shopping habits and value for quality, I would consider the product to be a bargain if it were priced around £300 or lower, considering the features and specifications it offers."
Female,Female,26,Single,Heterosexual,British,United Kingdom,Greater London,London,Urban,Apartment,2 years,Master,No,Marketing,Digital Marketing,£33000,Full-time,Renter,Caucasian,"English, Spanish",Agnostic,Celebrates local British holidays,Citizen,"Traveling, yoga, blogging","Convenience, brand loyalty",Researches products before buying,Primary online,Twice a month,Vegetarian,Moderately active,"Daily, especially Instagram and Twitter","International travel once a year, domestic travel quarterly",Social drinker,Non-smoker,Early adopter,Only child,1,0,One cat,1,In a Relationship,None,Good,None,Occasional anxiety,Covered by employer,Regular access to healthcare services,Labour Party,Votes in most elections,Low to medium,Around £600 to £700,Around £150 to £200,Around £400 to £500,Around £300 to £350
Male,Male,27,Single,Heterosexual,British,United Kingdom,London,London,Urban,Apartment,2 years,Bachelor,No,Computer Science,Information Technology,35000£,Employed,Renting,Caucasian,"English, Spanish",Agnostic,Primarily British customs,Citizen,"Gaming, Reading, Traveling",Convenience,Monthly large purchases with weekly essentials,Primary online with occasional in-store,Weekly,Omnivore,Moderate – exercises 3-4 times a week,Daily,"International travel once a year, domestic several times",Social drinking,Non-smoker,High – involved in technology field and uses tech frequently for personal and professional life,"Single, no children",1,0,None,0,Single,None,Good,None,Good,Covered by national health service,Good,Liberal,Regular voter,Occasionally follows political news,450£,100£,300£,200£
Female,Female,25,Single,Heterosexual,British,United Kingdom,Greater London,London,Urban,Apartment,2 years,Master,No,Economics,Finance,35000£,Full-time employed,Renting,White British,English,Agnostic,Christmas and traditional holidays,Citizen,"Running, reading, cooking","Convenience, quality, price",Planned and budgeted purchases,Primary online,Monthly,Omnivorous with a focus on organic products,Moderately active (exercises 3-4 times a week),"Daily usage of Instagram, LinkedIn, and Twitter","Annual international travel, frequent domestic excursions",Socially (2-3 times a month),Non-smoker,High proficiency and usage for both personal and professional purposes,Oldest child with one younger sibling,2 (shared apartment with a flatmate),0,No,0,In a relationship,None,Good,None,Good,Covered by the National Health Service (NHS),Good access to local GP and medical facilities,Liberal,Regular voter,Moderately engaged,350,150,250,200
Male,Male,27,Single,Heterosexual,British,United Kingdom,Greater London,London,Urban,Apartment,2 years,Master,Part-time,Computer Science,IT,35000£,Employed,Renting,Caucasian,"English, Spanish",Agnostic,British cultural events,Citizen,"Music, coding, gaming","Convenience, deals",Researches products online before purchasing,Primary online,Monthly,Omnivorous,Moderately active,Daily,Travels for vacation once a year,Social drinker,Occasional,High tech affinity,Only child,1,0,No,0,Single,None,Good,None,Stable,Covered by working company,Good,Liberal,Regular voter,Moderately engaged,"As an individual with an annual income level of £35,000, I would consider the product to be too expensive if it exceeds £600.","As a consumer interested in tech products and with an understanding of market prices, I would consider the product to have questionable quality if it is priced below £200.","Considering my annual income level and interest in tech products, I would start considering the product to be expensive but still within consideration if it is priced around £400.","As someone who values both quality and features in tech products, I would consider the smartphone to be a bargain if it is priced under £300 given its specifications and my interest in such devices."
Female,Woman,27,Single,Heterosexual,British,United Kingdom,Greater London,London,Urban,Apartment,2 years,Master,Part-time,International Relations,Non-profit sector,"£32,000",Employed,Renting,White British,"English, French",Agnostic,None specific,Citizen,"Travel, reading, yoga","Convenience, quality","Eco-conscious, budget-aware",Primary online,Weekly,Vegetarian,Moderate,Daily,International travel 2-3 times a year,Socially,Non-smoker,Highly engaged in tech and new devices,"Oldest child, close to family",2 persons,0,One Cat,1,In a relationship,None,Good,None,"Generally well, with occasional stress",National Health Service (NHS) user,Good,Liberal,Always votes in major elections,Moderately informed and occasionally participates in local movements,"As an eco-conscious and budget-aware shopper with an annual income of £32,000, I would generally consider a smartphone with the described features to be too expensive if it exceeds £500 GBP.","Considering my preference for quality products and the specifications of the smartphone, if the price dropped below £200 GBP, I would start questioning the quality of the product.","Given my annual income of £32,000, eco-conscious shopping habits, and preference for quality, I would start to consider the smartphone expensive when it reaches around £400 GBP. At this price point, I would need to carefully evaluate if the features and value justify the cost before deciding to make a purchase.","Considering my budget-aware approach and the specifications of the smartphone, I would regard the product as a bargain if it were priced around £300 GBP. At this price point, I would perceive the smartphone as offering good value for money given its features and quality, making it a favourable purchase option for me."
Male,Male,27,Single,Heterosexual,British,United Kingdom,Greater London,London,Urban,Apartment,2 years,Master,No,Computer Science,IT - Software Development,£35000,Employed,Renting,White British,"English, Spanish",Atheist,None,Natural-born citizen,"Gaming, programming, cycling","Convenience, quality, price","Economical, brand-conscious",Primary online,Monthly,No specific preference,Moderate (several times a week),Daily,Occasionally (once or twice a year),Socially,Never,High (for work and leisure),"Single, no children",1 (living alone),0,No,0,Single,None,Good,None,Stable,Covered by National Health Service (NHS),Good,Liberal/Left-wing,Regular voter,"Moderately engaged (reads news, discusses politics occasionally)","As a price-sensitive shopper, I would consider the product to be too expensive if it exceeds £600 GBP.","Considering the features and specifications of the product, I would think the quality might not be very good if the price is below £200 GBP.","Based on my budget and shopping habits, I would start to consider the product as getting expensive if it reaches around £400 GBP. This price point would make me pause and carefully evaluate the value of the smartphone compared to its cost.","Considering the features and specifications of the smartphone, along with my budget and shopping preferences, I would perceive the product as a bargain if it is priced around £300 GBP. At this price point, the smartphone would offer a good balance of quality and value that aligns well with my shopping motivations and habits."
Female,Female,27,Single,Heterosexual,British,United Kingdom,Greater London,London,Urban,Apartment,2 years,Master,Non-student,Marketing,Advertising and Marketing,£32000,Full-time,Rents,Caucasian,English,Secular/Non-religious,None,Citizen,"Reading, Running, Podcasts","Convenience, Brand Loyalty",Budget-conscious,Primary online,Once a week,Omnivore,Moderate (3 times a week),Frequently (4-6 hours a day),1 international trip per year,Socially (occasional),Never,Tech-savvy,Eldest of 3 siblings,2 (living with a flatmate),None,Yes,1 (cat),In a relationship,No,Good,None,Generally well,"Covered by NHS, no private insurance",Easy access,Liberal,Regular voter,Occasionally attends local gatherings,"Being budget-conscious, I would hesitate if the price exceeded £500, considering the features and specifications of the smartphone.","Given my understanding of the market for smartphones with similar specifications, I may question the quality if the price is below £200 GBP, as this could potentially signal compromises in the components and build quality.","Considering my budget-conscious approach and the value I place on technology, I would start finding the product expensive if it approaches the £400 GBP mark. At this price point, I would weigh the features and benefits against the cost before making a decision.","Considering the features, specifications, and my budget-conscious attitude, I would perceive the product as a bargain if it were priced around £300 GBP. This price point would align well with the value I expect from a smartphone of this caliber without exceeding my perceived threshold for affordability."
Male,Male,27,Single,Heterosexual,British,United Kingdom,Greater London,London,Urban,Apartment,2 years,Master,No,Computer Science,IT consultant,35000£,Employed,Rents,Caucasian,English,Agnostic,None specific,Citizen,"Cycling, Travel, Technology","Convenience, Quality","Budget-Conscious, Brand-Aware",Primary online,Bi-weekly,No specific diet,Moderate,"Daily, for personal purposes","Annual international travel, frequent domestic weekend trips",Social drinking,Non-smoker,Heavy user,Oldest of three siblings,2,None,No,0,In a relationship,Occasional help with elderly grandparents,Good,None,Generally positive,Covered by the NHS,Good - regular GP access,Centrist,Occasional voter,Minimal,"As a budget-conscious shopper, I would consider the smartphone to be too expensive if it exceeds £600 GBP.","Based on my preferences for quality products and being brand-aware, I would consider the smartphone to have questionable quality if it is priced below £300 GBP.","As a budget-conscious shopper who values quality, I would start to consider the smartphone as getting expensive when it reaches around £400 GBP.","Considering my budget-conscious shopping habits and appreciation for quality, I would view the smartphone as a bargain if it is priced under £450 GBP."
Female,Female,27,Single,Heterosexual,British,United Kingdom,Greater London,London,Urban,Apartment,2 years,Master,No,Marketing,Digital Advertising,35000£,Full-time,Renting,Caucasian,English,Agnostic,Celebrates national holidays,Citizen,"Photography, traveling",Quality and convenience,Prefers ethical brands,Primary online,Bi-weekly,Vegetarian,Moderately active,Daily,International travel once a year,Social drinker,Non-smoker,Highly engaged,Oldest of two siblings,1-person household,None,One dog,1,In a relationship,None,Very good,None,Occasional stress but generally healthy,Private health insurance,Good,Liberal/Left-wing,Regular voter,Occasionally engages in online political discussions,"As a consumer with an annual income level of £35,000, I would consider the smartphone to be too expensive if it exceeds £600 GBP.","As a consumer with an interest in quality and value, I would consider the smartphone to be priced too low if it falls below £200 GBP.","As a consumer with an annual income level of £35,000, I would consider the smartphone to be starting to get expensive if it reaches around £450 GBP. At this price point, I would have to carefully evaluate the features and benefits to justify the purchase.","As a consumer who values quality and convenience, and considering my annual income level of £35,000, I would consider the smartphone to be a bargain if it is priced around £300 GBP. At this price point, I would see it as a great value for the features it offers."
Female,Female,27,Single,Heterosexual,British,United Kingdom,West Yorkshire,Leeds,Urban,Apartment,4 years,Master,Not a student,Business Administration,Marketing,35000£,Full-time employed,Rents,White British,"English, Spanish",Agnostic,None,Citizen,"Yoga, travel, reading",Quality and convenience,Eco-conscious and brand shopper,Primary online,Bi-weekly,Vegetarian,Moderate,Daily,"International once a year, local bi-monthly",Socially,Never,Early adopter,Single adult with supportive parents,1-person,None,Yes,1 cat,Single,None,Good,None,Good,Not applicable (UK Resident with NHS access),Good,Labour Party,Consistently votes,Moderately engaged,"As a consumer, I would consider the smartphone to be too expensive if it exceeds £600 GBP.","As a consumer, I would consider the smartphone to be priced too low if it were below £250 GBP.","As a consumer, I would consider the smartphone starting to get expensive if it is priced around £500 GBP.","As a consumer, I would consider the smartphone to be a bargain if it is priced below £400 GBP."
Male,Male,27,Single,Heterosexual,British,United Kingdom,Greater London,London,Urban,Apartment,2 years,Master,No,Computer Science,Software Development,£35000,Full-time,Renting,Caucasian,English,Agnostic,None,Citizen,"Coding, Video Games, Hiking","Convenience, Price, Quality","Occasional splurges, Budget-conscious",Primary online,"Bi-weekly for essentials, monthly for non-essentials",No specific restrictions,Moderately active (exercises 2-3 times a week),"Daily, mostly LinkedIn and Twitter","Occasional traveler, prefers vacations abroad once a year",Social drinker,Non-user,"High, early adopter of new gadgets and tech",Oldest child with younger siblings,1-Person Household,0,No,0,Single,None,Good,None,"Stable, with occasional stress",Covered through work,Good access to healthcare facilities nearby,Independent,Votes regularly in major elections,Minimal; stays informed but not actively involved,£600,£200,£450,£300
Female,Female,27,Single,Heterosexual,British,United Kingdom,Greater London,London,Urban,Apartment,2 years,Master,Non-student,Business Management,Marketing,£35000,Employed full-time,Rented,Caucasian,English,Agnostic,None specific,Citizen,"Yoga, reading, travel",Convenience,Budget-conscious,Primary online,Monthly,Flexitarian,Moderately active,Daily,2-3 times a year for leisure,Social drinking,Non-smoker,Technophile,Oldest child,2,0,No,0,Single,None,Good,None,Stable,Covered by NHS,Good,Central,Votes regularly,Occasionally follows politics,"As a budget-conscious shopper, I would consider the smartphone to be too expensive if it costs more than £500 GBP.","Considering my shopping habits and general perception, I would view the smartphone as having questionable quality if it is priced below £200 GBP.","For a budget-conscious shopper with my preferences, I would start to consider the smartphone as getting expensive when it reaches around £300 GBP.","Given my budget-conscious shopping habits and price sensitivity, I would consider the smartphone to be a bargain if it is priced around £250 GBP or less."
Male,Male,26,Single,Heterosexual,British,United Kingdom,Greater London,London,Urban,Apartment,2 years,Bachelor,No,Computer Science,Information Technology,£35000,Employed,Renting,White British,English,Atheist,N/A,Citizen,"Programming, participating in hackathons, video gaming",Convenience and quality,Prefers to research thoroughly before purchasing,Primary online,Twice a month,No specific preferences,Moderate (jogs regularly 3 times a week),Frequently (uses social platforms multiple times a day),Occasional (once or twice a year for vacation),Socially (only on special occasions),None,"Extensive (early adopter, keeps up with the latest trends)",Eldest sibling,1,None,Yes,1 (a dog),In a relationship,None,Good,None,"Fairly stable, minor stress related to work",Privately insured,"Good, with all needed services available nearby",Liberal/Democrat,Regular voter,"Occasionally engaged (reads news, signs petitions)","As a consumer with an annual income of £35,000 and particular shopping habits characterized by thorough research and a preference for quality, I would consider the smartphone to be too expensive if it exceeds the range of £500-£600. At this price point, I would expect the device to offer exceptional value for the features provided.","Given my background in technology, particular interest in smartphones, and preference for quality products, I would consider a price range below £200 for this smartphone to signal potentially low quality. Smartphones with the features listed, especially with emerging technologies like 5G and a large AMOLED display, generally come at a higher price point due to the components and build quality required to deliver such performance.","Considering my annual income, shopping habits, and the features of the smartphone, I would start to find the product relatively expensive in the range of £400-£500. At this price point, the purchase would require more consideration, weighing the value offered by the device against other potential alternatives in the market.","Given my income, preferences, and the features of the smartphone, I would consider the product to be a bargain in the price range of £300-£400. Within this range, I would perceive the device as offering excellent value for money, aligning with my shopping motivations for quality and convenience."
