Sex at Birth,Gender Identity,Age,Marital Status,Sexual Orientation,Nationality,Country of Residence,State/Province,City,Rural or Urban,Type of Residence,Length of Residence,Level of Education,Student Status,Field of Study,Occupational Area,Annual Income Level,Employment Status,Home Ownership,Ethnicity,Language(s) Spoken,Religion,Cultural Practices,Immigration Status,Hobbies and Interests,Shopping Motivations,Shopping Habits,Shopping Channels,Shopping Frequency,Dietary Preferences,Physical Activity Levels,Social Media Usage,Travel Habits,Alcohol Use,Tobacco and Vape Use,Technology Usage,Family Structure,Household Size,Number of Children,Pet Ownership,Number of Pets,Relationship Status,Caregiving Responsibilities,General Health Status,Disabilities or Chronic Illnesses,Mental Health Status,Health Insurance Status,Access to Healthcare,Political Affiliation,Voting Behavior,Political Engagement,At what price in GBP would you consider the product to be so expensive that you would not consider buying it?,At what price in GBP would you consider the product to be priced so low that you would feel the quality couldn’t be very good?,"At what price in GBP would you consider the product starting to get expensive, so that it is not out of the question, but you would have to give some thought to buying it?",At what price in GBP would you consider the product to be a bargain?
Male,Male,27,Single,Heterosexual,British,United Kingdom,Greater London,London,Urban,Apartment,2 years,Master,No,Computer Science,Software Development,£35000,Employed full-time,Renter,Caucasian,English,Atheist,N/A,Citizen,"Videogames, Reading, Hiking",Convenience,Prefers quality over quantity,Primary online,Bi-weekly,Omnivore,Moderately active,Daily,"Infrequent, international travel","Moderate, socially",Non-smoker,Advanced user,"Single, has siblings",1,0,No,0,Single,None,Good,None,Stable,Covered by NHS,Good,Liberal,Regular voter,Moderately informed,"Based on my income and shopping habits, I would consider the smartphone to be too expensive if it costs more than £600 GBP.","Based on my income, shopping motivations, and preferences for quality, I would consider the smartphone's quality to be questionable if it is priced below £200 GBP.","Based on my income and shopping habits, I would start to consider the smartphone expensive but still under consideration if it is priced around £400 to £500 GBP.","Considering my income, shopping habits, and preferences for quality products, I would consider the smartphone to be a bargain if it is priced around £300 to £350 GBP."
Male,Male,26,Single,Heterosexual,British,United Kingdom,Greater London,London,Urban,Apartment,3 years,Bachelor,No,Computer Science,Information Technology,£35000,Employed full-time,Renting,White British,English,Atheist,None,Citizen,"Video games, running, and reading science fiction",Convenience and quality,"Monthly budgeting, rarely impulsive buying",Primary online,Every few weeks,Omnivorous with a focus on healthy foods,Moderately active (exercise 3-4 times a week),"Daily, primarily for news and communication","Domestic travel a couple of times a year, international travel once a year",Social drinker,None,High (uses latest gadgets anx technology extensively for work and personal life),"Single, eldest of two siblings",Shares a 2 bedroom apartment with one housemate,None,No,None,Single,None,Good,None,Stable,Covered by employer's health scheme,Good (lives near good health facilities),Liberal,Regular voter,"Moderately engaged (keeps up with news, debates policies with friends)","As a consumer with an annual income of £35000 and a monthly budgeting habit, I would consider a smartphone with the features described to be too expensive if it exceeds £500 GBP.","As a consumer with an interest in both quality and technology, I would consider a smartphone with the described features to potentially have lower quality if priced below £200 GBP.","As a consumer with an annual income of £35000, a monthly budgeting habit, and an interest in technology, I would consider the smartphone described to start being expensive around £400 GBP. At this price point, I would need to carefully evaluate the features and benefits of the product before making a decision.","As a consumer with an annual income of £35000, a monthly budgeting habit, and a keen interest in technology, I would consider the smartphone with the described features to be a bargain if priced around £300 GBP. At this price point, I would see it as offering good value for the features and specifications it provides."
Male,Male,27,Single,Heterosexual,British,United Kingdom,Greater London,London,Urban,Apartment,2 years,Master,No,Computer Science,Technology,£35000,Full-time,Renting,White British,English,Atheist,None,Citizen,"Programming, Gaming, Reading","Convenience, Price, Quality","Budget-conscious, Prefers quality over quantity",Primary online,Once a month,No restrictions,Moderate,Daily,"Annual international trips, frequent local excursions",Socially,Non-user,"High-tech enthusiast, early adopter ","Single, youngest sibling",One-person household,None,Yes,One dog,Dating,None,Good,None,Stable,Private healthcare coverage,Good,Liberal,Regular voter,Occasionally involved in local political discussions,£700,£150,£500,£400
Female,Female,26,Single,Heterosexual,Italian,United Kingdom,Greater London,London,Urban,Apartment,2 years,Master,No,International Relations,NGO Sector,32000£,Full-time,Renting,White European,"Italian, English, Spanish",Agnostic,"International Cooking, European Film Festivals",Work Visa,"Volunteering, Travelling, Reading",Quality over Quantity,"Bi-monthly clothing purchases, weekly groceries",Primary Online,Monthly,Vegetarian,Moderate (Gym 3 times a week),Daily,International Travel 2-3 times a year,Social Drinker,Non-smoker,"High (Smartphone, Laptop, Smart Watch)",Oldest of Three Siblings,2 (Self and One Flatmate),0,No,0,In a Relationship,None,Good,None,Stable,Private Medical Insurance coverage,Good (GP and Specialist available within 3 miles),Liberal,Regular Voter (National Elections),Minor (Occasional petitions and demonstrations),"Being mindful of my annual income level of £32,000, I would find the smartphone to be too expensive if it exceeded £600 in price.","Considering the features and quality expected, if the smartphone were priced below £200, I would be concerned about the quality being compromised.","Considering my budget and the value I place on a smartphone, I would start finding the product expensive when it reaches around £400. At this price point, while I may still consider it, I would need to carefully weigh the features and benefits against the cost.","Given the features and specifications of the smartphone, along with my preferences and budget, I would consider the product to be a bargain if it were priced around £300. At this price point, I would feel that I am getting good value for the quality and functionalities offered."
Male,Male,27,Single,Straight,Italian,United Kingdom,Surrey,Guildford,Urban,Apartment,3 years,Master,No,Computer Science,IT and Services,£35000,Full-time,Renting,Caucasian,"English, Italian",Atheist,Occasional culinary recipes from home country and seasonal festive celebrations.,Permanent Resident,"Gaming, Hiking, Programming","Convenience, Quality, Value for money","Prefer to bulk buy essentials, tends to look for deals online.",Primary online,Monthly for essentials and occasionally for others,No specific restrictions,Moderate (exercises 2-3 times a week),Daily (active on platforms like Twitter and LinkedIn),"Enjoys occasional travel, approximately 2-3 trips a year, both domestic and international",Social (drinks occasionally during social gatherings),Non-smoker,High (uses technology for both personal and professional life),Single without dependents,1 (lives alone),0,No,0,Single,None,Good,None,"Generally positive, with some stress at times",Covered by employer,Good (has access to necessary medical facilities and services),Centrist,Regularly votes in major elections,Moderately informed and occasionally engages in political discussions,"As an individual with an annual income of £35,000, I would likely consider the smartphone to be too expensive if it were priced above £500 GBP.","Given the specifications of the smartphone and my understanding of the market, I would likely question the quality if the price of the product is below £200 GBP.","Considering my annual income of £35,000 and the features of the smartphone, I would start to find it expensive but still within consideration around the £350 to £400 GBP range.","Given my shopping motivations for value for money and the specifications of the smartphone, I would consider the product to be a bargain if it is priced around £300 GBP."
Male,Male,25,Single,Heterosexual,British,United Kingdom,Greater Manchester,Manchester,Urban,Apartment,2 years,Bachelor,Part-time,Computer Science,IT Services,£32000,Employed,Renting,White British,English,Atheist,Not Applicable,Citizen,"Gaming, Running, Reading","Convenience, Price","Budget-conscious, infrequent large purchases",Primary online,Weekly,No dietary restrictions,Moderate (exercises 3 times a week),Regular (daily use of major platforms),Occasional domestic and international travel,Socially,Non-user,High (frequent use of various devices and software for personal and professional needs),"Single, no children",One-person,None,No,None,Dating,None,Good,None,Stable,Covered by National Health Service (NHS),Good access to local healthcare services,Liberal,Regular voter in both local and national elections,"Occasional (keeps informed on political news, sometimes attends local community meetings)","As a budget-conscious shopper with an annual income of £32,000 and considering my preferences and spending habits, I would consider a price point above £500 to be too expensive for me to consider buying this smartphone.","Given my knowledge of smartphones and their typical price ranges, as well as the specifications of this particular product, I believe that if this smartphone were priced below £200 in GBP, I would perceive the quality to be questionable and likely not very good.","Considering my budget-conscious approach and annual income of £32,000, along with the features and specifications of the smartphone, I would start to find the product expensive when it reaches a price point around £400 in GBP. At this price, I would need to carefully consider the value and benefits it offers before making a decision to purchase.","Based on my budget-conscious shopping habits, annual income of £32,000, and the specifications of this smartphone, I would consider a price point of around £300 in GBP to be a bargain for this product. At this price, I would see the smartphone as offering excellent value for its features and quality, making it a compelling purchase."
Female,Female,27,Single,Heterosexual,British,United Kingdom,Greater London,London,Urban,Apartment,2 years,Master,No,Marketing,Digital Marketing,"£35,000",Employed full-time,Rents,White,English,Atheist,None,Citizen,"Reading, Cooking, Yoga","Quality over price, eco-conscious products",Regular purchaser of health and lifestyle products,Primary online,Weekly,Vegetarian,Moderately active,Daily - multiple platforms,"Occasional international traveller, frequent domestic trips",Social drinker,Non-smoker,High-tech inclusive lifestyle with smart devices usage,Eldest child with younger siblings,Shared with 2 roommates,None,No,0,In a relationship,None,Good,None,"Generally well, occasional stress","Enrolled in NHS, no private insurance",Good - nearby clinics and hospital,Liberal/Left-leaning,Always votes in major elections,Casually involved -  follows news and partakes in discussions,"Being a quality-conscious shopper, the price point that would make me consider the product too expensive to purchase would be around £800 GBP. This is based on my current income level, shopping motivations, and lifestyle preferences.","Given my preferences for quality over price and being an eco-conscious shopper, I would consider a price point below £250 GBP to raise concerns about the quality of the product. This is because products priced significantly lower may compromise on materials, manufacturing standards, and overall longevity, which are important factors for me when making purchasing decisions.","For a product like the described smartphone with its features and my preferences for quality over price, I would start to find it expensive but still worth considering at a price point around £500 GBP. At this price range, I would weigh the value the device offers against my budget and other spending priorities before making a decision.","Considering the features of the smartphone, my shopping motivations, and preference for quality products, I would consider the product to be a bargain at a price point around £350 GBP. At this price, I would see the smartphone as offering good value for money based on its specifications and my usage needs."
Female,Female,27,Single,Heterosexual,British,United Kingdom,Greater London,London,Urban,Apartment,2 years,Master,No,Business Administration,Marketing,35000£,Full-time,Rents,White British,English,Agnostic,Occasionally participates in local festivals,Citizen,"Traveling, reading, yoga","Quality over price, convenience","Research-based purchases, eco-friendly products",Primary online,Bi-weekly,Omnivore,Moderate (exercises 3-4 times a week),Daily (primarily Instagram and LinkedIn),"International trips once a year, domestic trips several times a year",Socially,Never,High (multiple devices on a regular basis),"Single, no children",One-person household,0,None,0,Dating,None,Good,None,Stable and generally positive,Covered by the National Health Service (NHS),Good (easily accessible and close to healthcare facilities),Liberal,Regular voter,"Moderately engaged (keeps up with current affairs, occasionally attends local town hall meetings)","As a consumer who values quality over price and conducts research before making purchases, I would consider the smartphone too expensive if it exceeded £800 GBP.","As a consumer who values quality and is willing to pay for it, I would consider the smartphone's quality to be questionable if it were priced below £200 GBP.","As a consumer who values quality over price and typically conducts research before making purchases, I would start considering the smartphone expensive if it were priced around £500 GBP. At this price point, I would find it necessary to carefully evaluate the features and benefits to justify the cost before making a decision.","As a consumer who values quality over price and prioritizes research before making purchases, I would consider the smartphone to be a bargain if it were priced below £400 GBP. At this price point, considering the features and specifications provided, it would represent a good value for the investment."
Male,Male,27,Single,Heterosexual,British,United Kingdom,Greater London,London,Urban,Apartment,3 years,Master,Part-time,Computer Science,Information Technology,£32000,Employed,Renting,Caucasian,English,Agnostic,Secular,Citizen,"Video gaming, Coding, Running",Convenience and price,Monthly bulk shopping,Primary online,Monthly,No restrictions,Moderately active,"Daily, primarily for entertainment and staying in touch with friends","1 international trip per year, occasional weekend trips within the UK",Social drinker,Non-user,"Highly proficient, early adopter of new technologies","Parents alive, one younger sibling",1-person household,None,None,None,In a relationship,None,Good,None,Good,Covered by employer,Has regular access to healthcare services,Liberal/Democratic,Regular voter in national and local elections,Occasional activism and attendance at political rallies,"For the smartphone described, I would consider it too expensive if it were priced above £500 GBP.","For the smartphone described, I would consider it to be of questionable quality if it were priced below £200 GBP.","For the smartphone described, I would start considering it expensive but still think about buying it if it were priced around £400 GBP.","For the smartphone described, I would consider it to be a bargain if it were priced at around £300 GBP."
Male,Male,25,Single,Heterosexual,British,United Kingdom,Greater London,London,Urban,Apartment,2 years,Bachelor,No,Computer Science,IT and Software Development,35000£,Full-time,Renter,White British,English,Agnostic,None,Citizen,"Video games, Reading, Coding",Convenience,Budget-conscious,Primary online,Monthly,Omnivore,Moderately active,Daily,Domestic holidays once a year,Socially,None,Advanced user,Oldest child with younger siblings,1 (Living alone),0,No,0,In a relationship,None,Good,None,Stable,Covered by NHS,Easy access,None,Occasionally votes,Low,"Given my budget-conscious shopping habits and income level of £35,000 per year, I would consider the smartphone to be too expensive if it goes over £500. Beyond that, it might be out of my budget.","Considering my occupation in IT and software development and my familiarity with technology as an advanced user, I would be cautious if the smartphone is priced below £200. At that price point, I might question the quality and durability of the device.","Given my budget-conscious shopping habits and income level of £35,000 per year, I would start to consider the smartphone as getting expensive around £300. At that price point, I would need to carefully evaluate its features and value for money before making a purchasing decision.","Considering my budget-conscious shopping habits and income level of £35,000 per year, I would consider the smartphone to be a bargain if it is priced at around £250. At this price point, with the features offered and within my budget range, it would present great value for money."
Female,Female,27,Single,Bisexual,British,United Kingdom,Greater London,London,Urban,Apartment,3 years,Master,Non-student,Environmental Science,Research and Development,35000£,Full-time,Renting,White,"English, Spanish",Agnostic,None,Citizen,"Rock climbing, Reading, Sustainable living practices","Quality, Ethical sourcing, Sale","Budget-conscious with occasional splurges, Prefers local stores and sustainable products",Primary online,Monthly,Vegetarian,Active (3-4 times per week),Moderate (2 hours daily),Domestic and international travel 1-2 times per year,Socially (1-2 drinks weekly),Never,"High (Frequent usage of smartphone, laptop for personal and professional work)","Single, No dependants",1,None,Yes,1 Cat,In a relationship,None,"Excellent, No known conditions",None,Good,Covered by employment,Good,Liberal/Democrat,Regular Voter,Occasionally attend local town-hall meetings,"As a budget-conscious shopper who values quality and ethical sourcing, I would consider a smartphone with the described features to be too expensive if it exceeds £500 GBP.","As someone who values quality and is willing to pay for it, I would feel that the quality of the described smartphone may be compromised if it is priced below £250 GBP.","Considering my budget-conscious shopping habits and value for quality, I would start to find the described smartphone to be getting expensive around £400 GBP. At this price point, I would need to carefully evaluate if the features and value align with my preferences before making a purchase decision.","Considering my preference for quality, ethical sourcing, and value, I would perceive the described smartphone as a bargain if priced around £300 GBP. At this price point, I believe the features offered align well with my needs and shopping motivations, making it a great deal for a smartphone with these specifications."
Female,Female,26,Single,Heterosexual,British,United Kingdom,Greater London,London,Urban,Apartment,2 years,Master,No,Marketing,Advertising,£32000,Employed,Renting,White British,English,Atheist,None,Citizen,"Yoga, Reading, Blogging","Convenience, Quality, Price","Budget-conscious, Brand-aware",Primary online,Weekly,No specific diet,Moderately active,Daily,Biannual International Travel,Socially,Non-user,High user of smartphone and laptop,Oldest of three siblings,2,0,None,0,In a relationship,None,Good,None,Good,Covered by the National Health Service (NHS),Easy access,Liberal,Always votes,Moderately engaged,"As a budget-conscious shopper, I would consider the product to be too expensive if it exceeds £500 GBP.","As a brand-aware shopper, I would consider the product to have questionable quality if it is priced below £200 GBP.","As a budget-conscious but quality-oriented shopper, I would start to consider the product expensive if it is priced around £400 GBP.","As a budget-conscious and quality-oriented shopper, I would consider the product to be a bargain if it is priced at around £300 GBP or lower."
Male,Male,25,Single,Heterosexual,British,United Kingdom,England,London,Urban,Apartment,2 years,Bachelor,No,Computer Science,Technology,"£35,000",Employed,Renting,Caucasian,English,Agnostic,None,Citizen,"Video gaming, traveling, programming","Convenience, price","Infrequent, bulk purchases",Primary online,Monthly,No specific diet,Moderate,Daily - multiple platforms,International travel once a year,Social drinker,Non-smoker,Heavy user of smartphones and computers,"Oldest child, living independently",1,0,No pets,0,Dating,None,Good,None,Generally stable,Covered by employer,Good,Liberal/Democratic,Votes in major elections,Regularly follows political news,"As an individual with an annual income of £35,000 and considering my shopping motivations and habits, I would likely find the product too expensive if it exceeds £500 GBP.","Given my knowledge of smartphone prices and quality, I would consider the product to potentially have lower quality if it were priced below £200 GBP.","Considering my annual income, shopping motivations, and habits, I would start to consider the product expensive but still manageable if it falls within the range of £300 to £400 GBP.","Given my income level, shopping preferences, and the features of the smartphone, I would consider the product to be a bargain if it is priced around £250 GBP."
Female,Female,26,Single,Heterosexual,British,United Kingdom,West Yorkshire,Leeds,Urban,Apartment,2 years,Master,No,Computer Science,IT Services,"£32,000",Employed full-time,Renting,White British,English,Atheist,None,Citizen,"Cycling, Reading, Traveling","Convenience, Quality",Regular but budget-conscious,Primary online,Weekly,Omnivore,Moderately active,Daily,Several trips within Europe per year,Socially,Non-smoker,Highly engaged,Only child,Two-person household,None,Yes,One cat,In a relationship,None,Good,None,Generally good with occasional anxiety,Covered by NHS,Good,Liberal,Votes regularly in major elections,Somewhat engaged,"As a budget-conscious shopper, I would consider the product to be too expensive if it were priced at over £500 GBP.","Considering the features and specifications of the product, I would feel the quality might be compromised if it were priced below £200 GBP.","Considering my budget-conscious approach, I would start to consider the product more carefully if it were priced around £400 GBP.","Based on my shopping habits and budget-conscious mindset, I would consider the product to be a bargain if it were priced at around £300 GBP or lower given its features and specifications."
Male,Male,27,Single,Heterosexual,British,United Kingdom,Greater London,London,Urban,Apartment,2 years,Master,No,Computer Science,Technology,£35000,Employed Full-Time,Rents,White British,English,Atheist,None,Citizen,"Coding, Gaming, Hiking",Convenience,Budget-conscious,Primary online,Monthly,No Dietary Restrictions,Moderate (exercises weekly),Daily,Occasional traveller,Social drinker,Non-smoker,Heavily dependent,"Single, No dependents",1,0,No pets,0,Single,None,Good,None,Stable,Covered by National Health Service,Good,Liberal,Always votes,"Moderately engaged (discusses politics with friends, follows news)","As someone with a budget-conscious shopping habit and an annual income of £35,000, I would consider the smartphone to be too expensive if it exceeds £450 in GBP.","Considering the features of the smartphone, such as 5G connectivity, MediaTek Dimensity 720 processor, 48MP main camera, and 6GB/8GB RAM, I would think that if the smartphone is priced below £250 in GBP, I might perceive the quality to be subpar.","Considering my budget-conscious shopping habits and annual income, I would start to find the smartphone relatively expensive but still worth considering if it is priced around £350 to £400 in GBP.","Given my shopping motivations and budget-conscious approach, I would consider the smartphone to be a bargain if it is priced below £300 in GBP. At this price point, considering the features it offers, it would align well with my shopping habits and provide value for the money spent."
