Female,Female,25,Single,Straight,British,United Kingdom,Greater London,London,Urban,Apartment,3 years,Bachelor,No,Graphic Design,Design and Creative,£35000,Employed,Renting,Caucasian,English,None,Occasional participation in local festivals,Citizen,"Photography, reading, yoga",Quality and sustainability,Researches products extensively before purchasing,Primary online,Monthly,Pescatarian,Moderately active,Daily on Instagram and Twitter,"Enjoys one big international trip yearly, coupled with multiple weekend getaways within the UK","Casual, socially",Non-smoker,"Very familiar and constant user of smartphones, laptops, and hi-tech devices","Single, No children",1,0,Yes,1 cat,Single,None,Good,None,Good with occasional anxiety,"Covered by NHS, no private insurance",Regular access to healthcare services,Liberal,Votes in all major elections and referendums,Occasionally attends rallies and signs petitions,"As a conscious consumer who values quality and sustainability, I would consider the product to be too expensive for me if it exceeds £600 GBP.","As someone who values quality and sustainability, I would be cautious if the product is priced below £250 GBP as it may indicate compromised quality.","For a product with the features and specifications described, I would start considering it expensive around £400 GBP. While it's not out of the question, I would definitely need to carefully evaluate the value it offers at that price point.","Considering the specifications and features of the smartphone, I would perceive it as a bargain if it were priced at around £300 GBP. At this price point, given the quality, sustainability, and functionality it offers, it would represent a great value for me."
Female,Female,25,Single,Heterosexual,British,United Kingdom,Greater London,London,Urban,Apartment,2 years,Master,No,International Relations,Non-Governmental Organization Worker,£32000,Employed full-time,Renting,Caucasian,English and French,Agnostic,Occasional cultural festivals attendee,Citizen,"Reading, blogging, and yoga",Quality over quantity,Budget-conscious and environment-aware,Primary online,Monthly,Vegetarian,Moderate - exercises weekly,"Regularly uses Facebook, Instagram, and Twitter",Enjoys annual international travel for leisure,Socially,Never,High - utilizes technology for both work and leisure,Oldest of 3 siblings,Lives with one roommate,None,No,None,Dating,None,Good,None,Generally well,Covered through National Health Service,Easy access to local clinics and hospitals,Centre-left,Always votes in national and local elections,Occasionally volunteers for political campaigns,"As a budget-conscious shopper, I would consider the smartphone to be too expensive if it exceeded £600 GBP.","As a shopper who values quality, I would consider the smartphone to have questionable quality if it were priced below £200 GBP.","As a budget-conscious shopper who values quality, I would start considering the smartphone to be getting expensive at around £400 GBP.","As someone who values quality and is budget-conscious, I would consider the smartphone to be a bargain if it were priced around £300 GBP."
Female,Woman,27,Single,Bisexual,Canadian,United Kingdom,Greater London,London,Urban,Apartment,2 years,Master,Non-student,Environmental Science,Research and Development,£32000,Full-time,Rents,White,"English, French",Agnostic,Recycling and sustainability,Work Visa,"Hiking, Painting, Podcasts","Ethical practices, necessity, quality",Month-end bulk purchases,Primary online,Monthly,Vegetarian,High,2 hours daily,"Annual international travel, frequent regional trips",Occasionally,Non-smoker,"Proficient, regularly updates to new technology","Close with siblings, parents live abroad",2 (includes a roommate),None,None,0,Dating,None,Good,None,Generally Positive,Employer-provided health coverage,Easily accessible,Liberal,Votes consistently in major elections,"Informed, occasionally participates in rallies","As a consumer, I would consider the smartphone to be too expensive if it exceeds £600 in price.","As a consumer with these detailed preferences, I would likely question the quality of the smartphone if it were priced below £200 in GBP.","Given my preferences and financial considerations, I would begin to consider the smartphone as getting expensive if it reaches around £400 in GBP.","Considering the features of the smartphone and my consumer profile, I would perceive the product as a bargain if it were priced at around £300 in GBP."
Female,Female,25,Single,Heterosexual,British,United Kingdom,West Yorkshire,Leeds,Urban,Apartment,2 years,Master,No,Business Administration,Marketing,35500£,Full-time,Renting,White British,English,Agnostic,None,Citizen,"Travel, reading, yoga",Quality and convenience,"Regularly shops for basics, occasionally splurges on hobbies",Primary online,Weekly,No dietary restrictions,Moderate,Daily,International travel once a year,Socially,Never,Highly proficient,"Single, childless",1-person,None,Yes,One cat,Single,None,Good,None,Good,Covered by national health service,Good,Liberal,Always votes,Somewhat engaged,"As a 25-year-old marketing professional with an annual income of £35,500, I would consider the smartphone to be too expensive if it were priced above £600. This is based on my shopping habits and preferences for quality and convenience.","As a 25-year-old marketing professional with an annual income of £35,500, I would consider the smartphone to be priced so low that the quality couldn’t be very good if it were below £200. Considering the features and specifications of the phone, such a low price would likely indicate substandard components or compromises in quality that may not meet my expectations.","As a 25-year-old marketing professional with an annual income of £35,500, I would consider the smartphone to be starting to get expensive, but not entirely out of the question, if it were priced around £400 to £500. At this price range, I would need to weigh the value of the features and specifications against my budget and priorities before making a purchase decision.","As a 25-year-old marketing professional with an annual income of £35,500, I would consider the smartphone to be a bargain if it were priced at around £300 to £350. Within this price range, considering the features, specifications, and my preferences for quality and convenience, I would perceive the product as offering excellent value for money and aligning well with my purchasing criteria."
Male,Male,27,Single,Heterosexual,British,United Kingdom,England,Manchester,Urban,Apartment,2 years,Master,No,Computer Science,Software Development,£35000,Full-time,Renting,White British,English,Agnostic,None,Citizen,"Videogames, Reading, Hiking",Convenience,"Budget-conscious, occasional splurges",Primary online,Once a month,Omnivore,Moderate (exercises weekly),Active on Facebook and Twitter,Domestic vacations once a year,Socially,None,High (multiple devices),Oldest of three siblings,2 (including self),None,Yes,1 (dog),In a relationship,None,Good,None,Good,Covered by NHS,Easy,Liberal/Democrat,Regular voter,"Follows political news, but not actively engaged",350,150,250,200
Female,Female,26,Single,Heterosexual,British,United Kingdom,Greater London,London,Urban,Apartment,2 years,Master's,No,Marketing,Digital Marketing,£32000,Employed,Renting,Caucasian,"English, French",Atheist,None,Native,"Yoga, Reading, Cooking",Quality-focused,Monthly,Primary online,Bi-weekly,No red meat,Moderate (Multiple times per week),"Daily (Instagram, Twitter)","Internationally, once a year",Socially,Non-user,"High (Smartphone, Laptop, Smartwatch)",Eldest of three siblings,1,0,Yes,1 (Cat),In a relationship,None,Good,None,Good,Private,Easily accessible,Liberal/Democratic,Regular voter,Occasionally active,£700,£150,£500,£350
Female,Female,27,Single,Heterosexual,British,United Kingdom,Greater London,London,Urban,Apartment,2 years,Master,Part-time student,Marketing,Digital Marketing,35000£,Employed,Renting,Caucasian,"English, Spanish",Agnostic,None specific,Citizen,"Yoga, Photography, Blogging",Quality and Sustainability,Budget-conscious but values premium products,Primary online,Monthly,Vegetarian,Moderately active,Daily - predominantly Instagram and Twitter,Frequent short breaks in Europe,Social drinker,Non-smoker,High - early adopter of tech,Single with close ties to extended family,1,None,None,None,In a relationship,None,Good,None,Stable,Private health insurance,Easy access to GP and specialist services,Liberal,Regular voter,Occasionally engages in political discussions,"As a budget-conscious shopper who values premium products, I would consider the smartphone to be too expensive if it were priced above £600 GBP.","Given my shopping motivations for quality and sustainability, I would consider the smartphone to have questionable quality if it were priced below £250 GBP.","As a budget-conscious shopper who values quality and sustainability, I would start considering the smartphone to be expensive but still worth considering at around £400 GBP.","Considering my shopping habits and values, I would consider the smartphone to be a bargain if it were priced at £300 GBP or lower, aligning with my desire for quality while being budget-conscious."
Male,Male,25,Single,Heterosexual,British,United Kingdom,Greater London,London,Urban,Apartment,2 years,Bachelor,Non-student,Economics,Finance,40000£,Employed,Renting,White,English,Agnostic,None specified,Citizen,"Running, Reading, Gaming",Quality over price,Research before buying,Primary online,Monthly,No dietary restrictions,Active (3-4 times per week),"Frequent user of Facebook, Twitter and Instagram",Annual international travel,Socially,Non-user,Early adopter of new gadgets,Oldest child with two younger siblings,2-person household,None,None,None,In a relationship,None,Good,None,Generally positive,"Covered by NHS, no private insurance",Easy access to healthcare services,Moderate,Regular voter,Minimally involved,"As a quality-conscious shopper who values the latest technology, I would consider a price point of around £800 to be the upper limit for me. Beyond this price range, I would find the product to be too expensive and would explore alternative options.","Considering my preference for quality over price and my interest in new technology, I would likely perceive the product's quality as questionable if it were priced below £300 in GBP. I believe that at this price point, there may be compromises in terms of the features, build quality, or performance, which are important factors for me when selecting a smartphone.","Given my appreciation for quality tech products and the features offered by the smartphone, I would start to find it expensive but still worthy of consideration around the price range of £500 to £600. At this price point, I would carefully weigh the features, performance, and value the product offers before making a decision to purchase.","Considering the specifications of the smartphone, my shopping habits, and preferences for quality tech products, I would perceive the product as a bargain if it were priced around £400 in GBP. At this price point, I would believe that the features, performance, and overall value of the product align well with my expectations and justify the purchase as a great deal."
Male,Male,27,Single,Heterosexual,British,United Kingdom,Surrey,Guildford,Urban,Apartment,3 years,Master,No,Computer Science,Software Development,£35000,Full-time,Rented,Caucasian,English,Agnostic,None,Citizen,"Programming, Video Gaming, Hiking","Convenience, Price",Prefers Quality Over Quantity,Primary online,Monthly,Omnivore,Moderate,"Daily, mainly Facebook and Twitter","Annual International Travel, Frequent Domestic Trips",Socially,Occasionally,"High, frequently purchases latest gadgets",Oldest of Three Siblings,1 (Living Alone),None,No,0,"In a Relationship, Not Cohabiting",None,Good,None,Generally Good,Covered by NHS,Easy Access to General Practitioner and Healthcare Services,Liberal/Democratic,Votes Regularly in National Elections,Occasionally Participates in Political Discussions Online,£800,£150,£500,£400
Male,Male,26,Single,Straight,British,United Kingdom,Greater London,London,Urban,Apartment,2 years,Master,Non-student,Computer Science,Information Technology,£35000,Employed,Renting,Caucasian,English,Agnostic,None,Citizen,"Gaming, Hiking, Programming","Quality, Convenience","Monthly major purchases, Weekly essentials",Primary online,Weekly,No restrictions,Moderate,Daily,"Annual international travel, frequent local trips",Socially,None,High-tech enthusiast,Oldest sibling,3,None,Yes,1 Dog,Single,None,Good,None,Stable,Privately Insured,Good,Independent,Regular voter,Occasionally reads political news,£600,£150,£400,£300
Female,Female,27,Single,Heterosexual,British,United Kingdom,Greater London,London,Urban,Apartment,2 years,Master,Non-Student,Computer Science,Software Development,£35000,Employed,Renting,White,"English, Spanish",Agnostic,Non-observant,Citizen,"Coding, Yoga, Reading",Convenience,Budget-conscious,Primary online,Monthly,Pescatarian,Moderately active,Daily,Annual international travel,Social drinker,Non-smoker,Heavy user,"Single, no children",1,0,No,0,In a relationship,None,Good,None,Stable,Public health service (NHS),Good,Liberal,Regular voter,Occasionally active,"As a budget-conscious shopper, I would consider the product too expensive if it were priced above £500 GBP.","As a moderately active heavy user of technology with a budget-conscious shopping habit, I would consider the product to have questionable quality if priced below £200 GBP.","As a budget-conscious shopper with a fairly good income and a heavy user of technology, I would start considering the product to be getting expensive if it were priced around £400 GBP.","As a budget-conscious shopper with fairly good income and a heavy user of technology, I would consider the product to be a bargain if it were priced around £300 GBP."
Female,Female,27,Single,Heterosexual,British,United Kingdom,Greater London,London,Urban,Apartment,3 years,Master,No,International Business,Marketing,35000£,Full-time,Renting,Caucasian,"English, Spanish",Agnostic,None,Citizen,"Traveling, reading, blogging","Quality, convenience","Budget-conscious, occasional splurges",Primary online,Monthly,Pescatarian,Moderately active,Daily,"3-4 trips per year, mostly international",Socially,Non-smoker,Highly proficient,"Single, no dependents",2 (includes a flatmate),0,Yes,1 cat,In a relationship,None,Good,None,Stable,Private health insurance,Easy access,Liberal,Always votes,"Moderately engaged, follows news and participates in local elections","Based on the information provided, I would consider the product to be too expensive if it exceeds £600 in price.","Based on the information provided, I would consider the product to be priced so low that the quality couldn’t be very good if it falls below £200 in price.","Based on the information provided, I would consider the product to be starting to get expensive, where I would have to give some thought to buying it, if it is priced around £450-£500.","Based on the information provided, I would consider the product to be a bargain if it is priced around £350-£400."
Male,Cisgender Male,27,Single,Heterosexual,British,United Kingdom,Greater London,London,Urban,Apartment,3 years,Bachelor,Non-student,Computer Science,IT Sector,"£35,000",Employed full-time,Rents,White British,English,Atheist,Non-practising,Citizen,"Gaming, Running, Reading","Convenience, Product reviews","Prefers quality over quantity, Eco-conscious choices",Primary online,Monthly,Omnivorous,Moderately active,Daily,"Annual international travel, occasional domestic trips",Social drinking,Non-user,High – frequent use of gadgets and apps,Single adult household,1,0,None,0,Single,None,Good,None,Stable,Via employer,"Regular, no barriers",Moderate,Votes regularly in major elections,Low involvement,"As an individual earning £35,000 annually and considering my shopping habits which prioritize quality, I would likely find the smartphone too expensive if it exceeded £700 in price.","Given that I prioritize quality in my shopping habits and the specifications of this smartphone, I would likely perceive the product's quality to be questionable if it were priced under £200 in GBP.","Considering my annual income of £35,000, my shopping habits, and the features of the smartphone, I would consider the product starting to get expensive around the £500 mark in GBP. At this price point, I would need to carefully weigh the value of the smartphone against other financial priorities before making a purchase decision.","Considering my income, shopping habits, and the features of this smartphone, I would view the product as a bargain if it were priced around £400 in GBP. At this price point, I would perceive it as offering excellent value for money based on the specifications and my financial circumstances."
Female,Female,26,Single,Heterosexual,British,United Kingdom,Greater London,London,Urban,Apartment,2 years,Master,No,International Relations,Nonprofit Sector,£35000,Full-time,Renter,Caucasian,"English, French",Agnostic,Secular,Citizen,"Reading, Yoga, Painting",Quality Oriented,Buys sustainably when possible,Primary online,Monthly,Vegetarian,Moderate (regular yoga and weekly jogs),Daily,International travel once a year,Social drinker,Non-smoker,High (uses technology for both work and personal life),"Single, no children",1,0,One cat,1,Single,None,Good,None,"Generally good, occasional stress",Covered by National Health Service and a private plan,Good,Liberal,Consistent voter,Moderately active (follow news and attends local community meetings),£700,£150,£500,£300
Male,Male,27,Single,Heterosexual,British,United Kingdom,England,London,Urban,Apartment,2 years,Master,Part-time student,Computer Science,IT,£35000,Employed,Renting,Caucasian,"English, Spanish",Secular,None,Citizen,"Gaming, traveling, reading",Convenience,Prefers quality over quantity,Primary online,Monthly,No dietary restrictions,Moderate,Daily,Internationally once a year,Social drinker,Non-smoker,Highly engaged,Oldest child with younger siblings,3 roommates,None,No pets,0,Single,None,Good,None,Stable,Insured,Good,Liberal,Votes in all major elections,"Moderately active, follows news","As a consumer with an annual income of £35,000 who values quality over quantity and prioritizes convenience, I would consider the product to be too expensive if its price exceeded £500 GBP.","As a consumer who prefers quality over quantity and is aware of the standard price ranges for smartphones with similar features, I would consider the product to have questionable quality if it were priced below £200 GBP.","As a consumer who values quality over quantity and prioritizes convenience, I would consider the product to start getting expensive around £400 GBP. At this price point, I would need to carefully evaluate the product's features and benefits before making a purchase decision.","As a consumer who values quality and features, and considering my annual income of £35,000, I would consider the product to be a bargain if priced at around £300 GBP. At this price, given the specifications and features provided, it would represent good value for the money."
Female,Female,26,Single,Heterosexual,British,United Kingdom,Greater London,London,Urban,Apartment,2 years,Master,Part-time student,Environmental Science,Non-profit sector,£32000,Employed,Renting,White British,English,Agnostic,None specific,Citizen,"Rock climbing, blogging",Ethical and sustainable practices,Prefers small businesses and boutique shops,Primary online,Twice a month,Vegetarian,Highly active,"Moderate usage, primarily Instagram and Twitter","Enjoys solo travel, several short trips a year",Social drinker,Non-smoker,Tech-savvy for personal and professional needs,Youngest of three siblings,2 persons including self,None,One pet,1,In a long-term relationship,None,Excellent,None,Good,NHS coverage,Easy access,Liberal,Regular voter,Occasional activism and signing of petitions,"As a conscious shopper who values ethical and sustainable practices, I would consider the product to be so expensive that I would not consider buying it if it exceeded £650 GBP.","As a consumer who values quality and understands the market, I would consider the product to be priced so low that I would feel the quality couldn’t be very good if it were below £250 GBP.","As a conscious shopper who values ethical and sustainable practices, I would consider the product starting to get expensive at around £550 GBP. While this price point would make me pause and evaluate, the features and specifications of the smartphone would still make it a viable option for consideration.","As a conscious shopper who values quality and ethical practices, I would consider the product to be a bargain if it were priced around £450 GBP. At this price point, considering the features and specifications of the smartphone, it would offer great value for money without compromising on my values."
Female,Female,27,Single,Heterosexual,British,United Kingdom,Greater London,London,Urban,Apartment,2 years,Master,Part-time,Business Administration,Marketing,£34000,Employed,Renting,White British,English,Agnostic,Non-religious customs and celebrations,Citizen,"Jogging, Reading, Traveling",Quality and convenience,"Budget-conscious, prefers discounts",Primary online,Weekly to Monthly,Omnivore with a preference for organic products,Regular (3-4 days per week),"Daily, multiple platforms","Occasional international traveler, several weekend trips in-country",Social drinker,Non-user,Heavily relies on technology for both personal and professional needs,Lives with a roommate,2 adults,None,Does not own pets,0,Single,None,Good,None,Stable,Covered by National Health Service (NHS),Good access to local clinics and health services,Moderate with progressive tendencies,Usually votes in major national elections,Occasionally active on social media about political causes,"As a budget-conscious shopper, I would consider the product to be too expensive if it exceeds £500 in price.","Considering the features of the smartphone and my preference for quality products, I would likely feel the quality couldn't be very good if the price of the product is below £200 in GBP.","Considering my budget-conscious approach and the features of the smartphone, I would start to consider the product expensive if it exceeds £300 in price in GBP.","Considering the features of the smartphone, my budget-conscious shopping habits, and preference for quality products, I would consider the product to be a bargain if it is priced below £400 in GBP."
