Other: Management,51-200,Business Owner,Annually,3,"['Difficulty reaching a representative sample', 'Low response rates']","['Wasted resources', 'Delayed decision-making']","['Email campaigns', 'Third-party survey platforms']",Yes,"As a business owner, I find it challenging to find survey participants who accurately represent a diverse range of demographics. It's important to ensure that the sample is representative of the population we are studying in order to obtain meaningful insights. Additionally, low response rates can sometimes be a hurdle in conducting surveys."
Other: Business,11-50,Business Owner,Bi-annually,7,['Low response rates'],['No significant impact'],"['Email campaigns', 'Social media advertising']",Yes,"As a person with a high-income and upper-middle-class background, I have found it challenging to find survey participants who come from diverse socioeconomic backgrounds. It is important to ensure that survey samples are representative and include individuals from different income levels and social classes."
Other: Consulting,1-10,Business Owner,Quarterly,6,"['Difficulty reaching a representative sample', 'Low response rates', 'Privacy concerns from potential participants']","['Wasted resources', 'Delayed decision-making']","['Email campaigns', 'Social media advertising', 'Third-party survey platforms']",Yes,"As a business owner, one of the biggest challenges I face when trying to find suitable survey participants is ensuring a representative sample. It can be difficult to reach a diverse range of individuals who accurately represent the population I am trying to study. Additionally, low response rates can be a challenge, as it sometimes takes multiple attempts to get enough participants for my surveys. Privacy concerns from potential participants can also impact their willingness to take part in surveys, which may affect the overall quality and representativeness of the data collected. Overall, finding suitable survey participants can be time-consuming and require extra resources to overcome these challenges."
Other:,201-500,Business Owner,Annually,7,"['Difficulty reaching a representative sample', 'Low response rates']","['Wasted resources', 'Delayed decision-making']","['Email campaigns', 'Social media advertising']",Yes,"As a business operating in an industry that does not fall under the provided choices, I have faced challenges in finding suitable survey participants who match our target demographic. Additionally, the cost associated with sourcing participants has been relatively high, impacting our resources. However, despite these challenges, we have been able to reach a representative sample and maintain a decent response rate."
Other: Business Services,11-50,Business Owner,Annually,7,['Low response rates'],['Wasted resources'],"['Email campaigns', 'Social media advertising', 'Third-party survey platforms']",Yes,"As a business owner, one of the challenges I have faced when trying to find suitable survey participants is the need for a representative sample. It can be difficult to ensure that the participants accurately represent the target population. Another challenge is the low response rates, which can lengthen the recruitment process and make it harder to gather enough data. Privacy concerns from potential participants have also been a factor. Finally, the high costs associated with sourcing participants can be a barrier, especially when working with a limited budget."
Technology,51-200,Business Owner,Annually,3,['Low response rates'],['Wasted resources'],"['Email campaigns', 'Social media advertising']",Yes,"One additional challenge I've faced is finding participants who are willing to provide detailed and thoughtful responses. Sometimes, participants may rush through the survey or provide vague answers, which can impact the quality of the data collected."
Other: Manufacturing,11-50,Business Owner,Bi-annually,6,"['Difficulty reaching a representative sample', 'Low response rates']","['Wasted resources', 'Delayed decision-making']","['Email campaigns', 'Third-party survey platforms']",Yes,"One challenge I've faced is ensuring diversity in my survey participants. It can be difficult to reach a representative sample that accurately reflects the demographics I'm targeting. Additionally, low response rates have been a recurring challenge, as it can be hard to motivate participants to take part in surveys. Overall, finding suitable survey participants has been a time-consuming process that requires careful planning and consideration."
Other: Management,51-200,Management,Bi-annually,7,['Low response rates'],['Delayed decision-making'],"['Email campaigns', 'Social media advertising']",Yes,"As a manager in the business industry, I have faced challenges in finding suitable survey participants due to the limited time and resources available. Additionally, reaching a representative sample can be difficult, especially when trying to target specific demographics or niche markets. However, leveraging online platforms and social media advertising has helped in sourcing participants and increasing response rates to some extent. Overall, finding suitable survey participants requires continuous efforts and strategic planning."
Other: Manufacturing,1-10,Business Owner,Annually,6,"['Difficulty reaching a representative sample', 'Low response rates']","['Wasted resources', 'Delayed decision-making']","['Email campaigns', 'Third-party survey platforms']",Yes,"As a business owner in the manufacturing industry with a small company of 1-10 employees, I have faced challenges in finding suitable survey participants due to limited resources and a smaller target population. It can be difficult to reach a representative sample and obtain sufficient response rates. Additionally, privacy concerns from potential participants have also been a factor. Overall, finding suitable survey participants can be a time-consuming and costly process for my business."
Other: Management,11-50,Marketing Manager,Bi-annually,7,"['Difficulty reaching a representative sample', 'Low response rates']","['Wasted resources', 'Delayed decision-making']","['Email campaigns', 'Social media advertising']",Yes,"As a business operating in the management industry with 11-50 employees, I have faced challenges in finding suitable survey participants. One of the main difficulties I've encountered is reaching a representative sample, especially when targeting a specific demographic. Additionally, low response rates have also been a challenge, as it can be difficult to get participants to actively engage with the surveys. These challenges have required additional resources and have occasionally delayed decision-making processes within my business."
Finance,51-200,Business Owner,Annually,7,"['Low response rates', 'Privacy concerns from potential participants']","['Wasted resources', 'Delayed decision-making']","['Email campaigns', 'Social media advertising']",Yes,"I have found that recruiting survey participants with specific characteristics can be challenging, especially when trying to reach a representative sample. It can also be difficult to ensure a high response rate and address privacy concerns from potential participants. Additionally, there can be high costs associated with sourcing participants for surveys."
Other: Business Services,11-50,Business Owner,Bi-annually,5,['Low response rates'],['Wasted resources'],"['Email campaigns', 'Social media advertising']",Yes,"As a business owner, I have faced challenges in finding suitable survey participants due to the limited reach of my marketing campaigns and the difficulty in convincing potential participants to take part in the survey. Additionally, targeting a representative sample has been challenging as I need to ensure diversity in terms of age, gender, and geographical location."
Other: Business,51-200,Other: Management,Annually,5,['Low response rates'],['Wasted resources'],"['Email campaigns', 'Social media advertising', 'Third-party survey platforms']",Yes,I have not faced any specific challenges in finding suitable survey participants.
Other: management consulting,51-200,Business Owner,Annually,5,"['Difficulty reaching a representative sample', 'Low response rates', 'Privacy concerns from potential participants']","['Wasted resources', 'Delayed decision-making']","['Email campaigns', 'Social media advertising', 'Third-party survey platforms']",Yes,"As a market researcher, one of the biggest challenges I have faced is finding survey participants who accurately represent the target population. It can be difficult to reach a diverse and representative sample, especially when dealing with privacy concerns and low response rates. Additionally, sourcing participants through different methods and platforms can be costly. Overall, finding suitable survey participants requires careful planning and consideration of various factors."
Finance,51-200,Other: Management,Annually,7,"['Low response rates', 'High costs associated with sourcing participants']","['Wasted resources', 'Delayed decision-making']","['Email campaigns', 'Third-party survey platforms']",Yes,"I have found that recruiting participants from specific niche demographics can be quite challenging. Sometimes it's difficult to find enough individuals who meet the specific criteria for our research projects. Additionally, reaching out to potential participants and convincing them to take part in the surveys can be time-consuming and require additional resources. However, leveraging online platforms and targeted advertising has helped improve our response rates to some extent."
Other: (Please specify),11-50,Business Owner,Annually,4,"['Difficulty reaching a representative sample', 'Low response rates']","['Wasted resources', 'No significant impact']","['Email campaigns', 'Social media advertising']",Yes,"As a business owner in the technology industry, one challenge I have faced in finding suitable survey participants is reaching a diverse and representative sample. It can be difficult to ensure that the participants accurately reflect the demographics of the target population. Additionally, low response rates have been a challenge, which affects the reliability and validity of the survey results. Privacy concerns from potential participants have also arisen, leading to hesitancy in sharing personal information. Overall, these challenges have required me to explore multiple methods and platforms to source survey participants and invest additional resources in the recruitment process."
Other: Business Services,51-200,Management,Quarterly,5,"['Difficulty reaching a representative sample', 'Low response rates']","['Wasted resources', 'Delayed decision-making']","['Email campaigns', 'Third-party survey platforms']",Yes,"As a business operating in the field of business services, finding suitable survey participants can be challenging at times. One specific challenge we face is the difficulty of reaching a representative sample. It is essential for us to have a diverse range of participants in order to gather accurate insights. Additionally, low response rates can also be a challenge, requiring us to put in extra effort to increase participation. Overall, these challenges have led to wasted resources and delayed decision-making in some cases."
Other: IT Services,11-50,Business Owner,Bi-annually,6,"['Low response rates', 'High costs associated with sourcing participants']","['Wasted resources', 'Delayed decision-making']","['Email campaigns', 'Third-party survey platforms']",Yes,"I have found that recruiting participants with diverse backgrounds and perspectives can be challenging. It is important to ensure that the sample is representative and includes individuals from different demographic groups. Additionally, privacy concerns from potential participants can sometimes limit their willingness to participate in surveys. Overall, finding suitable survey participants requires careful consideration and strategic recruitment methods."
Other: Business Services,51-200,Management,Bi-annually,5,['Low response rates'],['Delayed decision-making'],"['Email campaigns', 'Social media advertising']",Yes,"As an assistant, I don't personally face challenges in finding survey participants. However, some common challenges that businesses may face include limited reach to a representative sample, low response rates, privacy concerns from potential participants, and high costs associated with sourcing participants."
Other: Management,51-200,Management,Annually,5,"['Difficulty reaching a representative sample', 'Low response rates']","['Wasted resources', 'Delayed decision-making']","['Email campaigns', 'Social media advertising']",Yes,I have not faced any additional challenges in finding suitable survey participants.
Other: Marketing,11-50,Business Owner,Annually,5,['Low response rates'],['Wasted resources'],"['Email campaigns', 'Third-party survey platforms']",Yes,I have not faced any additional challenges in finding suitable survey participants.
Other: Business,11-50,Business Owner,Annually,5,"['Difficulty reaching a representative sample', 'Low response rates']","['Wasted resources', 'Delayed decision-making']","['Email campaigns', 'Social media advertising']",Yes,I have not faced any additional challenges in finding suitable survey participants.
Other: Marketing,11-50,Business Owner,Quarterly,5,"['Difficulty reaching a representative sample', 'Low response rates', 'Privacy concerns from potential participants']","['Wasted resources', 'Delayed decision-making']","['Email campaigns', 'Social media advertising']",Yes,"As a business owner, one of the key challenges I have faced in finding suitable survey participants is ensuring a representative sample. It can be difficult to reach a diverse group of individuals that accurately reflects my target audience. Additionally, low response rates have been a challenge as it affects the validity of the data collected. Privacy concerns from potential participants have also raised issues. Overall, finding suitable survey participants requires careful planning and consideration."
Other: Business Consulting,51-200,Management Consultant,Bi-annually,4,"['Difficulty reaching a representative sample', 'Low response rates']","['Wasted resources', 'Delayed decision-making']","['Email campaigns', 'Third-party survey platforms']",Yes,"I have found it challenging to find survey participants who are representative of the population I am targeting. It can be difficult to reach a diverse sample and ensure that all demographic groups are adequately represented. Additionally, low response rates can sometimes make it hard to gather enough data for meaningful analysis. Privacy concerns from potential participants can also be a barrier to recruiting suitable participants. Overall, finding suitable survey participants requires a thoughtful and strategic approach."
Other: Marketing,51-200,Marketing Manager,Bi-annually,5,"['Difficulty reaching a representative sample', 'Other: Limited time availability for participants']","['Wasted resources', 'Delayed decision-making']","['Email campaigns', 'Social media advertising']",Yes,"As a market researcher, one of the challenges I face is ensuring that the survey participants I recruit are representative of the target population. It can be difficult to reach individuals from diverse backgrounds and demographics, which may lead to biased or skewed results. Additionally, low response rates can be a challenge, as it requires additional effort to encourage participation. Privacy concerns from potential participants can also impact the recruitment process. Overall, finding suitable survey participants requires careful planning, targeted recruitment methods, and effective communication to address these challenges."
Other: Manufacturing,1-10,Business Owner,Annually,6,"['Difficulty reaching a representative sample', 'Low response rates']","['Wasted resources', 'Delayed decision-making']","['Email campaigns', 'Third-party survey platforms']",Yes,"As a business owner, one challenge I have faced when trying to find suitable survey participants is ensuring diversity and representation in the sample. It can be difficult to reach individuals from different backgrounds and demographics, especially when it comes to certain niche markets or specific target audiences. Another challenge is obtaining a high response rate, as people are often busy and may not prioritize participation in surveys. Privacy concerns from potential participants also play a role, as people may be hesitant to share personal information or participate in surveys due to privacy and security issues. Overall, finding suitable survey participants can be a complex process that requires careful planning, targeted outreach, and consideration of ethical and privacy concerns."
Other: Management,51-200,Management,Bi-annually,5,"['Difficulty reaching a representative sample', 'Low response rates']","['Wasted resources', 'Delayed decision-making']","['Email campaigns', 'Social media advertising']",Yes,"As an AI assistant, I do not have personal experiences or challenges with finding survey participants. However, some common challenges that businesses may face include reaching a representative sample, low response rates, and privacy concerns from potential participants. Additionally, sourcing participants can be costly. It would be helpful to consider these factors when designing surveys and determining target populations."
Technology,51-200,Business Owner,Annually,7,"['Difficulty reaching a representative sample', 'Low response rates']","['Wasted resources', 'Delayed decision-making']","['Email campaigns', 'Social media advertising']",Yes,"Finding survey participants who are representative of the target population can be challenging, especially when it comes to capturing diverse perspectives. Additionally, ensuring a high response rate from participants can also be a hurdle. Privacy concerns from potential participants are also something to consider. Lastly, the high costs associated with sourcing participants can sometimes be a barrier. Overall, these factors make the process of finding suitable survey participants an ongoing challenge for businesses."
Other: ,51-200,Other:,Annually,6,['Low response rates'],['Wasted resources'],"['Email campaigns', 'Third-party survey platforms']",Yes,"I have found it challenging to find participants who are representative of the broader population, especially when conducting research on niche topics."
Other: Manufacturing,51-200,Business Owner,Annually,7,"['Difficulty reaching a representative sample', 'Low response rates']",['Wasted resources'],"['Email campaigns', 'Social media advertising']",Yes,"Finding suitable survey participants can sometimes be challenging due to specific requirements or criteria that need to be met. It can also be difficult to ensure a representative sample that accurately reflects the target population. Additionally, reaching potential participants and getting a high response rate can be a challenge. Privacy concerns from participants can also impact their willingness to participate in surveys. Overall, finding suitable survey participants requires careful planning and consideration of various factors."
Other:,51-200,Other:,Annually,5,"['Difficulty reaching a representative sample', 'Low response rates']","['Wasted resources', 'Delayed decision-making']","['Email campaigns', 'Social media advertising']",Yes,"One challenge I have faced is finding participants with diverse backgrounds and perspectives. It can be difficult to ensure representation across different demographics, especially when targeting specific populations. Additionally, low response rates can sometimes limit the pool of participants and make it challenging to gather enough data for meaningful analysis."
Other: Management,11-50,Management,Quarterly,6,"['Difficulty reaching a representative sample', 'Low response rates']","['Wasted resources', 'Delayed decision-making']","['Email campaigns', 'Third-party survey platforms']",Yes,"As a market researcher, I have faced challenges in finding suitable survey participants due to the specific demographic requirements of my projects. It can be difficult to reach a representative sample and achieve high response rates, which affects the reliability and validity of the data collected. Privacy concerns from potential participants also limit their willingness to participate in surveys. Additionally, sourcing participants can be costly, especially when using third-party survey platforms. Overall, finding suitable survey participants remains a constant challenge, but I am open to exploring solutions that streamline this process for my business."
Other:,11-50,Business Owner,Monthly,7,"['Difficulty reaching a representative sample', 'Low response rates']","['Wasted resources', 'No significant impact']","['Email campaigns', 'Social media advertising']",Yes,I have not faced any additional challenges in finding suitable survey participants.
Other: Marketing,51-200,Business Owner,Annually,4,"['Difficulty reaching a representative sample', 'Low response rates']","['Wasted resources', 'Delayed decision-making']","['Email campaigns', 'Third-party survey platforms']",Yes,"As a business owner in the marketing industry, I face the challenge of finding survey participants who accurately represent my target audience. It can be difficult to reach a diverse and representative sample, especially when it comes to obtaining a high response rate. Privacy concerns from potential participants also pose a challenge. Additionally, the high costs associated with sourcing participants can be a barrier. Overall, finding suitable survey participants requires careful planning and consideration of various factors."
Other: Business Services,51-200,Business Owner,Bi-annually,6,"['Low response rates', 'Privacy concerns from potential participants']","['Wasted resources', 'No significant impact']","['Email campaigns', 'Third-party survey platforms']",Yes,"As a business operating in the service industry, finding suitable survey participants can be challenging due to the niche nature of our target audience. We often face difficulty in reaching a representative sample and low response rates, which can impact the quality of our research. Privacy concerns from potential participants can also be a barrier. In order to overcome these challenges, we actively use email campaigns and third-party survey platforms to source participants. However, this process can be time-consuming and costly. Overall, finding suitable survey participants remains a constant challenge that requires ongoing efforts to improve our recruitment strategies."
Other: Business,11-50,Business Owner,Bi-annually,4,"['Difficulty reaching a representative sample', 'Low response rates']","['Wasted resources', 'No significant impact']","['Email campaigns', 'Social media advertising']",Yes,"As a business owner, I have faced challenges in finding suitable survey participants due to their limited availability and the need for a representative sample. It can be difficult to reach out to a diverse group of individuals who accurately represent the target population. Additionally, low response rates have been a common issue, which can impact the validity of the survey results. Privacy concerns from potential participants also present a challenge in obtaining their participation. However, I have found that utilizing email campaigns and social media advertising has been helpful in sourcing survey participants."
Other: Manufacturing,11-50,Business Owner,Bi-annually,5,['Low response rates'],['No significant impact'],"['Email campaigns', 'Social media advertising', 'Third-party survey platforms']",Yes,"As a business owner, one challenge I have faced in finding suitable survey participants is ensuring a diverse representation. It can be difficult to reach a representative sample that accurately reflects the demographics of the target population. Additionally, privacy concerns from potential participants have been a factor that needs to be addressed. Overall, finding participants who are willing to provide accurate and valuable insights can be a challenge, but it is crucial for the success of any survey or research project."
Other:,11-50,Business Owner,Quarterly,6,['Low response rates'],['Wasted resources'],"['Email campaigns', 'Social media advertising']",Yes,"I have faced challenges with recruiting participants who meet specific demographic criteria. It can be time-consuming and difficult to find individuals who fit the desired characteristics for a particular research project. Additionally, reaching a representative sample can be challenging, especially when targeting a specific niche audience. Overall, finding suitable survey participants can be a complex task that requires careful planning and strategic recruitment strategies."
Other: Research,51-200,Research Head,Bi-annually,6,['High costs associated with sourcing participants'],['Wasted resources'],"['Email campaigns', 'Third-party survey platforms']",Yes,"As a research head in the technology research industry, one of the challenges I face when trying to find suitable survey participants is the saturation of the market. Many potential participants have been exposed to numerous surveys and are less willing to participate. Additionally, reaching specific niche demographics can be difficult and time-consuming. However, using third-party survey platforms has been helpful in sourcing participants with specific characteristics or interests."
