Other: Business Consulting,51-200,Business Owner,Bi-annually,7,"['Low response rates', 'High costs associated with sourcing participants']","['Wasted resources', 'Delayed decision-making']","['Email campaigns', 'Third-party survey platforms']",Yes,"I have found it challenging to find survey participants who meet specific criteria for my research. It takes a lot of effort and resources to recruit a representative sample, especially when trying to target a niche demographic. Additionally, privacy concerns from potential participants have also posed a challenge. Overall, finding suitable survey participants can be time-consuming and expensive."
Finance,51-200,Business Owner,Annually,7,"['Low response rates', 'Privacy concerns from potential participants']","['Wasted resources', 'No significant impact']","['Email campaigns', 'Third-party survey platforms']",Yes,"As a business operating in the finance industry with 51-200 employees, I have faced challenges in finding suitable survey participants. One of the main challenges is low response rates, which makes it difficult to gather enough data for analysis. Additionally, privacy concerns from potential participants have also been a hurdle. These challenges have led to wasted resources and delayed decision-making. It would be beneficial to have a solution that streamlines the process and improves the efficiency of finding suitable and representative survey participants."
Other:,1-10,Business Owner,Bi-annually,5,"['Low response rates', 'High costs associated with sourcing participants']","['Wasted resources', 'Delayed decision-making']","['Email campaigns', 'Third-party survey platforms']",Yes,"As a business owner in the technology industry, I have faced challenges in finding survey participants who match my target audience. It is often difficult to reach a representative sample and the response rates can be low. Additionally, sourcing participants through certain platforms can be costly. However, I have found that using email campaigns and third-party survey platforms have been effective methods for sourcing participants. Overall, finding suitable survey participants can be time-consuming and resource-intensive, but it is crucial for making informed business decisions."
Finance,51-200,Business Owner,Annually,5,"['Difficulty reaching a representative sample', 'Low response rates']","['Wasted resources', 'Delayed decision-making']","['Email campaigns', 'Social media advertising']",Yes,"I have found it challenging to reach a diverse and representative sample of survey participants, especially when targeting specific demographics. It can be difficult to ensure that the participants who respond to the surveys accurately reflect the larger population. Additionally, low response rates have been a recurring issue, which can affect the reliability and validity of the survey results. Overall, finding suitable survey participants requires careful planning and a comprehensive recruitment strategy."
Other: Manufacturing,11-50,Business Owner,Annually,7,"['Difficulty reaching a representative sample', 'Low response rates']","['Wasted resources', 'No significant impact']","['Email campaigns', 'Social media advertising']",Yes,One challenge I have faced is finding participants from diverse backgrounds. It can be difficult to reach certain demographic groups and ensure a representative sample.
Other: Business consulting,51-200,Management,Annually,5,['Low response rates'],"['Wasted resources', 'Delayed decision-making']","['Email campaigns', 'Social media advertising']",Yes,"Finding suitable survey participants can sometimes be a challenge due to the need for a representative sample. It can also be difficult to generate high response rates and ensure privacy concerns are addressed. Additionally, the cost associated with sourcing participants can be high. Overall, it is an ongoing process that requires careful consideration and strategy."
Other: Marketing,11-50,Marketing Manager,Bi-annually,5,"['Low response rates', 'Privacy concerns from potential participants']",['Delayed decision-making'],"['Email campaigns', 'Social media advertising']",Yes,"As a marketing professional, one of the challenges I face when trying to find suitable survey participants is ensuring a representative sample. It can be difficult to reach individuals from diverse backgrounds and demographics, which can limit the generalizability and reliability of the survey findings. Additionally, low response rates are a common issue, which makes it challenging to gather a sufficient number of participants for meaningful analysis. Privacy concerns from potential participants also play a role in the recruitment process, as some individuals may be hesitant to share personal information or opinions. Lastly, sourcing participants can be costly, especially when using third-party survey platforms or conducting in-person recruitment. Overall, finding suitable survey participants requires careful planning, resource allocation, and consideration of privacy concerns to obtain accurate and valuable insights."
Other: Business Services,1-10,Business Owner,Bi-annually,5,"['Difficulty reaching a representative sample', 'Low response rates']","['Wasted resources', 'Delayed decision-making']","['Email campaigns', 'Third-party survey platforms']",Yes,"I have found it challenging to reach a diverse group of survey participants that accurately represents the population I am targeting. It can also be difficult to motivate participants to respond to surveys, resulting in low response rates. Additionally, privacy concerns from potential participants can sometimes limit their willingness to participate in surveys. Overall, finding suitable survey participants can be time-consuming and costly."
Other: Business,51-200,Business Owner,Quarterly,4,"['Difficulty reaching a representative sample', 'Low response rates']","['Wasted resources', 'Delayed decision-making']","['Email campaigns', 'Third-party survey platforms']",Yes,"As a business owner, I find it challenging to find survey participants who accurately represent my target audience. It is crucial to reach a diverse and representative sample, but it can be difficult to achieve. Low response rates and privacy concerns from potential participants also pose challenges. Additionally, sourcing participants can be costly. Overall, finding suitable survey participants requires careful planning and consideration of various factors."
Finance,51-200,Other: Management,Quarterly,7,"['Low response rates', 'Privacy concerns from potential participants']","['Wasted resources', 'No significant impact']","['Email campaigns', 'Social media advertising']",Yes,"As a business operating in the finance industry with 51-200 employees, one of the challenges I face in finding suitable survey participants is the low response rates. It can be difficult to get a representative sample of participants willing to take part in the surveys. Additionally, privacy concerns from potential participants are also a challenge. Some individuals may be hesitant to share their personal information or opinions, which can impact the effectiveness of the surveys. Overall, finding a solution that streamlines the process of finding suitable and representative survey participants would greatly benefit our business."
Other: Business Services,51-200,Business Owner,Bi-annually,8,"['Difficulty reaching a representative sample', 'Low response rates', 'Privacy concerns from potential participants']",['No significant impact'],"['Email campaigns', 'Social media advertising', 'Third-party survey platforms', 'In-person recruitment']",Yes,"As a business owner, one additional challenge I face when trying to find suitable survey participants is the need for diversity in my sample. It can be difficult to reach a representative sample that encompasses different demographics, backgrounds, and perspectives. This is important to ensure the validity and reliability of the data collected. Additionally, finding participants who are truly engaged and willing to provide thoughtful responses can also be a challenge."
Other:,51-200,Business Owner,Less frequently,5,"['Difficulty reaching a representative sample', 'Low response rates']","['Wasted resources', 'Delayed decision-making']","['Email campaigns', 'Social media advertising']",Yes,"No, I have no additional comments or challenges to share."
Finance,51-200,Business Owner,Bi-annually,6,['Low response rates'],['Wasted resources'],"['Email campaigns', 'Social media advertising']",Yes,"As a person conducting surveys, I have faced challenges in reaching a representative sample and in dealing with low response rates. These challenges have made it difficult to gather a diverse and accurate set of survey participants. Additionally, privacy concerns from potential participants can also be a barrier in obtaining their participation."
Other: Marketing,51-200,Marketing Manager,Annually,5,['Low response rates'],['Wasted resources'],"['Social media advertising', 'Third-party survey platforms']",Yes,"I have found it challenging to find survey participants who are willing to provide detailed feedback and take the time to complete the surveys. It can be difficult to ensure a representative sample, especially when targeting specific demographics or industries."
Other: Management,51-200,Other: Management,Quarterly,5,"['Low response rates', 'Privacy concerns from potential participants']","['Wasted resources', 'Delayed decision-making']","['Email campaigns', 'Third-party survey platforms']",Yes,"I have found that recruiting participants with specific demographics can be quite challenging. It can sometimes be difficult to find a representative sample that accurately represents the population we are targeting. Additionally, low response rates have been a common issue, which can negatively impact the reliability and validity of our survey results. Privacy concerns from potential participants have also posed challenges in recruiting suitable participants. Overall, finding and recruiting suitable survey participants can be a complex and time-consuming process."
Other:,51-200,Research Head,Annually,6,"['Difficulty reaching a representative sample', 'Low response rates']","['Wasted resources', 'Delayed decision-making']","['Email campaigns', 'Third-party survey platforms']",Yes,"As a researcher, I have faced challenges in finding suitable survey participants due to the limited pool of individuals who meet specific criteria. This has sometimes resulted in delays in data collection and analysis. Additionally, privacy concerns from potential participants have affected response rates. Overall, finding representative survey participants can be a time-consuming and resource-intensive process."
Other: Business Services,11-50,Business Owner,Less frequently,5,"['Difficulty reaching a representative sample', 'Low response rates', 'Privacy concerns from potential participants']","['Wasted resources', 'Delayed decision-making']","['Email campaigns', 'Social media advertising', 'Third-party survey platforms']",Yes,"In my experience, one of the main challenges in finding suitable survey participants is ensuring diversity and representation. It can be difficult to reach a truly representative sample, especially when targeting specific demographics or niche populations. Additionally, low response rates can also be a challenge, as it may require implementing various strategies to encourage participation. Overall, finding suitable survey participants requires careful consideration and a multi-faceted approach."
Other: Business,11-50,Business Owner,Annually,7,"['Difficulty reaching a representative sample', 'Low response rates']","['Wasted resources', 'Delayed decision-making']","['Email campaigns', 'Third-party survey platforms']",Yes,"As a business owner, one of the challenges I face when trying to find suitable survey participants is ensuring diversity and representation in my sample. It can be difficult to reach a representative sample that reflects the diversity of the population. Additionally, low response rates can also be a challenge, especially when targeting specific demographics. Privacy concerns from potential participants can also impact the recruitment process. Overall, finding suitable survey participants can be a complex and time-consuming task."
Other:,51-200,Business Owner,Annually,7,"['Low response rates', 'High costs associated with sourcing participants']","['Wasted resources', 'Delayed decision-making']","['Email campaigns', 'Third-party survey platforms']",Yes,"One challenge I face when trying to find suitable survey participants is the need for diversity. It can be difficult to reach a representative sample that includes individuals from different backgrounds, demographics, and perspectives. There is also the challenge of ensuring a high response rate, as not everyone may be willing or available to participate in surveys. Additionally, privacy concerns from potential participants can make it challenging to gather accurate and honest responses. These challenges can sometimes result in high costs associated with sourcing participants, especially when using third-party survey platforms."
Other: Consulting,51-200,Business Owner,Annually,5,"['Difficulty reaching a representative sample', 'Low response rates']","['Wasted resources', 'No significant impact']","['Email campaigns', 'Social media advertising']",Yes,"As a business operating in the consulting industry, one of the challenges we face in finding suitable survey participants is ensuring that we reach individuals with diverse backgrounds and experiences. It can be difficult to capture a representative sample that accurately reflects the diversity of our target audience. Additionally, we sometimes encounter low response rates, which can affect the reliability of our survey results."
Other: Management consulting,51-200,Management Consultant,Annually,6,"['Difficulty reaching a representative sample', 'Low response rates']","['Wasted resources', 'Delayed decision-making']","['Email campaigns', 'Third-party survey platforms']",Yes,"I have found that reaching specific target demographics can be a challenge, especially when trying to find participants within a certain age range or industry. Additionally, ensuring a diverse and representative sample can sometimes be difficult. Overall, finding suitable survey participants requires careful planning and targeting."
