What industry does your business operate in?,How many employees does your company have?,In which role are you currently working?,How often does your business conduct surveys?,"On a scale of 1-10, how challenging do you find recruiting suitable survey participants for your projects?",Which of the following challenges have you faced when trying to find suitable survey participants?,How has the difficulty in finding suitable participants impacted your business decisions?,What methods or platforms does your business primarily use to source survey participants?,Would you be interested in a solution that streamlines the process of finding suitable and representative survey participants for your business?,Any additional comments or challenges you'd like to share regarding finding suitable survey participants?
Other: [My Answer],11-50,Business Owner,Annually,6,['Low response rates'],['Wasted resources'],"['Email campaigns', 'Third-party survey platforms']",Yes,"Sometimes it can be challenging to find survey participants who are willing to provide detailed and thoughtful responses. Additionally, reaching a diverse and representative sample can also be difficult."
Finance,11-50,Other: Management,Annually,5,['Low response rates'],['Wasted resources'],"['Email campaigns', 'Social media advertising']",Yes,I have not faced any significant challenges in finding suitable survey participants for my business.
Finance,1-10,Business Owner,Annually,5,"['Difficulty reaching a representative sample', 'Low response rates']","['Wasted resources', 'Delayed decision-making']","['Email campaigns', 'Third-party survey platforms']",Yes,"One additional challenge I have faced is finding participants who are willing to provide detailed and thoughtful responses. Sometimes, participants lack the motivation to fully engage with the survey, which can impact the quality of the data collected."
Other: Business Services,1-10,Business Owner,Bi-annually,5,"['Difficulty reaching a representative sample', 'Low response rates', 'Privacy concerns from potential participants']","['Wasted resources', 'No significant impact']","['Email campaigns', 'Social media advertising']",Yes,"Finding suitable survey participants can be a challenge, especially when trying to reach a representative sample. Additionally, low response rates can make it difficult to gather sufficient data. Finally, privacy concerns from potential participants can also pose a challenge."
Other: (insert industry here),51-200,Business Owner,Annually,5,"['Difficulty reaching a representative sample', 'Low response rates']","['Wasted resources', 'Delayed decision-making']","['Email campaigns', 'Third-party survey platforms']",Yes,"As an AI assistant, I do not personally face challenges in finding suitable survey participants. However, some common challenges that researchers may face include: finding a representative sample, low response rates, privacy concerns from potential participants, and high costs associated with sourcing participants. Additionally, reaching specific demographic groups and ensuring diversity in the participant pool can also be a challenge."
Finance,51-200,Business Owner,Annually,6,"['Difficulty reaching a representative sample', 'Low response rates']","['Wasted resources', 'Delayed decision-making']","['Email campaigns', 'Third-party survey platforms']",Yes,"I have found that one of the biggest challenges in finding suitable survey participants is ensuring diversity and representation. It can be difficult to reach a truly representative sample, especially when it comes to specific demographics or niche markets. Additionally, privacy concerns from potential participants can also hinder recruitment efforts. Overall, finding the right participants for surveys can require time, effort, and resources."
Finance,51-200,Business Owner,Quarterly,5,"['Difficulty reaching a representative sample', 'Low response rates']","['Wasted resources', 'Delayed decision-making']","['Email campaigns', 'Third-party survey platforms']",Yes,"I have faced challenges in finding survey participants who match the specific demographics I am targeting. It can be difficult to reach a representative sample and sometimes the response rates are low. Additionally, privacy concerns from potential participants can make recruitment challenging. Another challenge is the high costs associated with sourcing participants. Overall, finding suitable survey participants can be a time-consuming and resource-intensive process."
Finance,11-50,Marketing Manager,Bi-annually,7,"['Difficulty reaching a representative sample', 'Low response rates']","['Wasted resources', 'Delayed decision-making']","['Email campaigns', 'Third-party survey platforms']",Yes,"As a participant, I have not faced any challenges in finding suitable survey participants. However, I understand that it can be difficult for businesses to reach a representative sample and obtain high response rates. Privacy concerns from potential participants and high costs associated with sourcing participants can also pose challenges for businesses."
Other:,51-200,Research Head,Annually,7,['Low response rates'],['Wasted resources'],['Email campaigns'],Yes,"I have found that recruiting participants with specific demographic characteristics can be challenging at times, especially when trying to achieve a representative sample. It requires a lot of effort and resources to reach out to diverse groups and ensure their participation. Additionally, privacy concerns from potential participants can also affect the response rates. Overall, it is essential to continuously explore new methods and platforms to improve the recruitment process."
Other: Business Services,1-10,Business Owner,Bi-annually,7,['Low response rates'],['Wasted resources'],"['Email campaigns', 'Social media advertising', 'Third-party survey platforms']",Yes,I have not encountered any additional challenges in finding suitable survey participants.
Other: Marketing,11-50,Business Owner,Annually,5,"['Difficulty reaching a representative sample', 'Low response rates', 'High costs associated with sourcing participants']","['Wasted resources', 'Delayed decision-making']","['Email campaigns', 'Third-party survey platforms']",Yes,"As a business owner in the marketing field, one of the challenges I face when trying to find suitable survey participants is ensuring a representative sample. It can be difficult to reach a diverse range of individuals that accurately reflects the target population. Additionally, low response rates can sometimes hinder the success of my surveys. Another challenge I encounter is the high costs associated with sourcing participants, especially when using third-party survey platforms. Overall, finding suitable survey participants can be a complex and costly process, but it is essential for obtaining valuable insights for my marketing projects."
Technology,51-200,Marketing Manager,Quarterly,7,['Low response rates'],['Wasted resources'],"['Email campaigns', 'Social media advertising']",Yes,"As a researcher, I have found that one of the biggest challenges in finding suitable survey participants is ensuring diversity and representation. It is often difficult to reach a truly representative sample, especially when trying to include underrepresented groups. Additionally, privacy concerns from potential participants can also pose a challenge, as individuals may be hesitant to share personal information. Lastly, there can be high costs associated with sourcing participants, especially when using certain platforms or methods. Overall, these factors can make the process of finding suitable survey participants time-consuming and resource-intensive."
Finance,51-200,Business Owner,Quarterly,7,['Low response rates'],"['Wasted resources', 'Delayed decision-making']","['Email campaigns', 'Third-party survey platforms']",Yes,"As a business operating in the finance industry with a moderate-sized team, I have faced challenges in reaching a representative sample and obtaining a high response rate. Additionally, the high costs associated with sourcing participants have been a constraint. Despite these challenges, I am interested in a solution that streamlines the process of finding suitable and representative survey participants for my business."
Other: Consulting,51-200,Other: Management,Quarterly,5,['Low response rates'],['Wasted resources'],['Third-party survey platforms'],Yes,"One challenge I have faced is finding survey participants who accurately represent the diversity of the population. It can be difficult to reach underrepresented groups and ensure their voices are included in the research. Additionally, recruiting participants with specific characteristics or expertise can also be a challenge, as they may be less willing to participate or harder to find."
Other: Consulting,11-50,Other: Management Consultant,Quarterly,7,"['Difficulty reaching a representative sample', 'Low response rates']","['Wasted resources', 'No significant impact']","['Email campaigns', 'Third-party survey platforms']",Yes,"As a business operating in the consulting industry with a moderate number of employees, finding suitable survey participants can be challenging. The difficulty lies in reaching a representative sample and ensuring a high response rate. Privacy concerns from potential participants can also pose a challenge. Additionally, the high costs associated with sourcing participants can be a barrier. Overall, streamlining the process of finding suitable and representative survey participants would greatly benefit our business."
Technology,51-200,Business Owner,Quarterly,7,['Low response rates'],"['Wasted resources', 'Delayed decision-making']","['Email campaigns', 'Social media advertising']",Yes,"I have found that reaching a diverse and representative sample of survey participants can sometimes be challenging, especially when it comes to specific demographics or hard-to-reach populations. It requires careful planning and utilizing various recruitment methods to ensure the validity and inclusivity of the data collected. Additionally, privacy concerns from potential participants can also impact their willingness to participate in surveys."
Other: Manufacturing,51-200,Business Owner,Annually,8,"['Low response rates', 'Privacy concerns from potential participants']","['Wasted resources', 'Delayed decision-making']","['Email campaigns', 'Third-party survey platforms']",Yes,"I have occasionally faced challenges in finding suitable survey participants who meet specific criteria for my research studies. It can be time-consuming and requires careful screening to ensure the participants are representative of the target population. Additionally, there may be limited availability of participants in certain demographics, which can pose a challenge in obtaining a diverse sample. Overall, finding suitable survey participants can be a crucial aspect of conducting reliable and valid research."
Other:,51-200,Business Owner,Annually,7,"['Difficulty reaching a representative sample', 'Low response rates', 'Privacy concerns from potential participants']","['Wasted resources', 'No significant impact']","['Email campaigns', 'Social media advertising', 'Third-party survey platforms']",Yes,"As a native born American living in an urban area, I have not faced any significant challenges in finding suitable survey participants. However, I can imagine that reaching a representative sample and ensuring privacy concerns could be challenging for researchers in certain contexts."
Other: Food and Beverage,11-50,Business Owner,Annually,5,['Low response rates'],['Wasted resources'],"['Email campaigns', 'Social media advertising', 'Third-party survey platforms']",Yes,I have not faced any additional challenges in finding suitable survey participants at this time.
Other:,11-50,Business Owner,Quarterly,6,"['Difficulty reaching a representative sample', 'Low response rates']","['Wasted resources', 'Delayed decision-making']","['Email campaigns', 'Social media advertising']",Yes,"As a business owner, one of the challenges I have faced when trying to find suitable survey participants is ensuring that I reach a representative sample. It can be difficult to gather a diverse group of participants that accurately represents the target population. Additionally, low response rates have been a challenge, as it can be hard to motivate individuals to participate in surveys. Overall, finding the right participants can be time-consuming and costly, but it is crucial for obtaining accurate and reliable data."
Other:,1-10,Business Owner,Annually,5,"['Difficulty reaching a representative sample', 'Low response rates']","['Wasted resources', 'Delayed decision-making']","['Email campaigns', 'Social media advertising']",Yes,"One challenge I've faced is finding participants that are representative of the general population. It can be difficult to ensure that the sample is diverse and includes people from different backgrounds and demographics. Additionally, low response rates have been another challenge, as it can be challenging to get people to participate in surveys. Overall, finding suitable survey participants can be time-consuming and requires careful planning and outreach strategies."
Management,51-200,Management,Quarterly,5,"['Difficulty reaching a representative sample', 'Low response rates']","['Wasted resources', 'Delayed decision-making']","['Email campaigns', 'Third-party survey platforms']",Yes,"As a market researcher, I sometimes face challenges in finding survey participants who accurately represent the target demographic. It can be difficult to reach a representative sample, especially when targeting niche audiences or specific geographical regions. Additionally, low response rates can also be a challenge, resulting in limited data and potential biases in the results. Privacy concerns from potential participants can also impact recruitment efforts. Lastly, sourcing participants can be costly, especially when using third-party platforms or hiring in-person recruiters. Overall, finding suitable survey participants requires careful planning, targeted recruitment strategies, and a consideration of the associated challenges and costs."
Other: Business Management,11-50,Management,Quarterly,5,"['Difficulty reaching a representative sample', 'Low response rates', 'High costs associated with sourcing participants']","['Wasted resources', 'Delayed decision-making']","['Email campaigns', 'Third-party survey platforms']",Yes,"As a business management professional, I have faced difficulties in finding suitable survey participants due to the specific industry I operate in. The challenge lies in locating participants with the right knowledge and expertise in business management. It requires extra effort to reach out and engage with individuals with the relevant background. Additionally, ensuring a representative sample can be challenging as business management is a specialized field."
Other: Business Consulting,11-50,Business Owner,Bi-annually,5,"['Difficulty reaching a representative sample', 'Low response rates']",['No significant impact'],"['Email campaigns', 'Social media advertising']",Yes,"As a business owner, one challenge I have faced when trying to find suitable survey participants is ensuring diversity and representation. It can be difficult to reach a truly representative sample that reflects the broader population. Additionally, low response rates can also be a challenge, making it harder to gather enough participants for meaningful insights."
Other: Management,51-200,Management,Annually,6,"['Difficulty reaching a representative sample', 'Low response rates']","['Wasted resources', 'Delayed decision-making']","['Email campaigns', 'Social media advertising']",Yes,"As a business, it can be challenging to find suitable survey participants for our projects. One of the main challenges we face is reaching a representative sample. It is also difficult to overcome low response rates from potential participants. These challenges can affect the quality of our research and decision-making process. Additionally, privacy concerns from potential participants can limit our ability to recruit suitable participants. Overall, finding and recruiting suitable survey participants is a continuous challenge that requires creative approaches and strategies."
Other: Management,51-200,Management,Annually,7,"['Difficulty reaching a representative sample', 'Low response rates', 'Privacy concerns from potential participants']","['Wasted resources', 'Delayed decision-making']","['Email campaigns', 'Social media advertising', 'Third-party survey platforms']",Yes,One additional challenge I have faced is finding participants from diverse backgrounds and perspectives. It can be difficult to ensure that the survey sample is representative and includes a wide range of demographics. This is something I strive to improve in my research.
Other: Management Consulting,11-50,Management,Quarterly,6,['Low response rates'],['Wasted resources'],"['Email campaigns', 'Social media advertising']",Yes,"As a business operating in the management consulting industry with around 11-50 employees, we have faced challenges in finding suitable survey participants. Despite using methods like email campaigns and social media advertising, we often encounter low response rates. This could be due to the busy schedules and limited availability of our target audience. Additionally, privacy concerns from potential participants sometimes hinder their willingness to participate in surveys. We have also noticed that the high costs associated with sourcing participants can be a barrier to conducting surveys on a larger scale. Overall, finding representative survey participants can be a time-consuming and resource-intensive process."
Management,51-200,Management,Annually,7,"['Difficulty reaching a representative sample', 'Low response rates']","['Wasted resources', 'No significant impact']","['Email campaigns', 'Social media advertising']",Yes,"I have found that recruiting survey participants with specific demographic characteristics can be challenging, especially when trying to reach a diverse and representative sample. Additionally, low response rates can also pose a challenge in obtaining enough participants for surveys. It's important to ensure privacy concerns are addressed to encourage participation. Finally, the cost associated with sourcing participants can be high, especially when using certain platforms or services."
Other: Management,51-200,Management,Bi-annually,3,"['Difficulty reaching a representative sample', 'Low response rates']",['Wasted resources'],"['Email campaigns', 'Social media advertising']",Yes,"As an AI assistant, I don't face specific challenges related to finding survey participants. However, some common challenges faced by businesses include difficulty reaching a representative sample, low response rates, privacy concerns from potential participants, and high costs associated with sourcing participants."
Other:,51-200,Business Owner,Annually,7,"['Difficulty reaching a representative sample', 'Low response rates']","['Wasted resources', 'Delayed decision-making']","['Email campaigns', 'Social media advertising']",Yes,"As a business owner, I have faced challenges in finding survey participants who are representative of the larger population. It can be difficult to reach a diverse sample and ensure a high response rate. Privacy concerns from potential participants have also been a concern. Additionally, sourcing participants can be costly. Overall, finding suitable survey participants can be a time-consuming and resource-intensive task."
Other: Consulting,11-50,Other: Consultant,Quarterly,7,"['Difficulty reaching a representative sample', 'Low response rates', 'High costs associated with sourcing participants']","['Wasted resources', 'Delayed decision-making']","['Email campaigns', 'Third-party survey platforms']",Yes,"As a research company, we occasionally face challenges in finding suitable survey participants. One of the main challenges is ensuring a representative sample, especially when targeting specific demographics or niche markets. Additionally, low response rates can impact the data collection process and require additional efforts to reach the desired sample size. Finally, the cost associated with sourcing participants can sometimes be high, especially when using specialized platforms or recruiting participants through specific channels."
Other: [Replace with specific industry],1-10,Business Owner,Bi-annually,5,['Low response rates'],['No significant impact'],"['Email campaigns', 'Social media advertising']",Yes,"As a business owner, one of the challenges I face when trying to find suitable survey participants is finding individuals who meet specific criteria. It can be difficult to reach a representative sample and ensure that the participants are truly representative of the target population. Additionally, privacy concerns from potential participants can also impact the response rates. Overall, the process of recruiting suitable survey participants can be time-consuming and costly, but it is essential for gathering accurate and meaningful data."
Other,1-10,Business Owner,Quarterly,5,['Low response rates'],['No significant impact'],"['Email campaigns', 'Social media advertising']",Yes,"As a business owner, one of the challenges I have faced when trying to find suitable survey participants is ensuring a representative sample. It can be difficult to reach a diverse group of individuals that accurately reflect the population I am trying to survey. Additionally, privacy concerns from potential participants have also impacted our response rates. Overall, finding suitable survey participants can be a time-consuming and challenging task."
Other:,11-50,Business Owner,Bi-annually,6,['Low response rates'],"['Wasted resources', 'Delayed decision-making']","['Email campaigns', 'Social media advertising']",Yes,"One additional challenge I have faced when finding suitable survey participants is the need to ensure diversity and representation across different demographic groups. It can be difficult to reach and engage participants from underrepresented communities, which is important for obtaining a comprehensive and unbiased understanding of the population."
Other: Business,51-200,Marketing Manager,Bi-annually,6,"['Difficulty reaching a representative sample', 'Low response rates']","['Wasted resources', 'Delayed decision-making']","['Email campaigns', 'Third-party survey platforms']",Yes,"As a full-time working professional with a busy schedule, one of the main challenges I face in finding suitable survey participants is the time constraint. It can be difficult to find individuals who are willing to take the time to participate in surveys, especially when trying to reach a representative sample. Another challenge I have encountered is ensuring privacy and confidentiality for potential participants, as some individuals may have concerns about sharing personal information. Additionally, sourcing survey participants can be costly, especially when using third-party survey platforms. Overall, finding suitable survey participants requires careful planning and consideration of these challenges."
Other: Business,51-200,Business Owner,Quarterly,6,"['Difficulty reaching a representative sample', 'Low response rates', 'Privacy concerns from potential participants']","['Wasted resources', 'Delayed decision-making']","['Email campaigns', 'Third-party survey platforms']",Yes,I have not encountered any additional challenges in finding suitable survey participants.
Other: Business,51-200,Business Owner,Quarterly,3,"['Low response rates', 'High costs associated with sourcing participants']","['Wasted resources', 'Delayed decision-making']","['Email campaigns', 'Third-party survey platforms']",Yes,"I have found that targeting specific demographics or niche populations can be particularly challenging when trying to find suitable survey participants. Additionally, reaching out to potential participants and getting a high response rate can be difficult, especially when dealing with busy individuals who may not prioritize survey participation. Furthermore, maintaining participant privacy and addressing any concerns they may have is crucial in order to ensure their willingness to participate. Lastly, recruiting participants can be costly, especially when utilizing third-party survey platforms or conducting in-person recruitment."
Other: Manufacturing,51-200,Business Owner,Annually,6,"['Low response rates', 'Privacy concerns from potential participants']","['Wasted resources', 'Delayed decision-making']","['Social media advertising', 'Third-party survey platforms']",Yes,N/A
Other: Business Services,11-50,Business Owner,Annually,7,"['Difficulty reaching a representative sample', 'Low response rates']","['Wasted resources', 'No significant impact']","['Email campaigns', 'Third-party survey platforms']",Yes,"One challenge I have faced is ensuring diversity in my survey participants. It can be difficult to reach a truly representative sample, especially when the target population is diverse. Additionally, low response rates have been a challenge, which affects the reliability of the survey results."
Other:,51-200,Marketing Manager,Bi-annually,7,['Low response rates'],['Wasted resources'],"['Email campaigns', 'Third-party survey platforms']",Yes,No
