Sex at Birth,Gender Identity,Age,Marital Status,Sexual Orientation,Nationality,Country of Residence,State/Province,City,Rural or Urban,Type of Residence,Length of Residence,Level of Education,Student Status,Field of Study,Occupational Area,Annual Income Level,Employment Status,Home Ownership,Ethnicity,Language(s) Spoken,Religion,Cultural Practices,Immigration Status,Hobbies and Interests,Shopping Motivations,Shopping Habits,Shopping Channels,Shopping Frequency,Dietary Preferences,Physical Activity Levels,Social Media Usage,Travel Habits,Alcohol Use,Tobacco and Vape Use,Technology Usage,Family Structure,Household Size,Number of Children,Pet Ownership,Number of Pets,Relationship Status,Caregiving Responsibilities,General Health Status,Disabilities or Chronic Illnesses,Mental Health Status,Health Insurance Status,Access to Healthcare,Political Affiliation,Voting Behavior,Political Engagement,At what price in GBP would you consider the product to be so expensive that you would not consider buying it?,At what price in GBP would you consider the product to be priced so low that you would feel the quality couldn’t be very good?,"At what price in GBP would you consider the product starting to get expensive, so that it is not out of the question, but you would have to give some thought to buying it?",At what price in GBP would you consider the product to be a bargain? 
Female,Female,30 to 44,Married,Heterosexual,British,United Kingdom,Greater London,London,Urban,Apartment,5 years,Master,No,Business Administration,Marketing,"£100,000",Full-time,Renting,Caucasian,"English, Spanish",Agnostic,None,Citizen,"Reading, Yoga, Traveling",Quality and convenience,Planned and budget-conscious,Primary online,Monthly,Vegetarian,Moderate,Daily,International travel 2-3 times a year,Socially,Never,High,Couple with no children,2,0,Yes,1,Married,None,Good,None,Good,Private,Good,Liberal,Regular voter,Moderately engaged,600,200,400,300
Male,Male,30 to 44,Single,Heterosexual,British,United Kingdom,Greater London,London,Urban,Apartment,5 years,Master,No,Business Administration,Finance,£100000,Full-time,Renting,Caucasian,"English, Spanish",None,None,Citizen,"Running, Reading, Travel","Convenience, Quality",Eco-conscious choices,Primary online,Monthly,No restrictions,Active (3-4 times a week),Daily,International travel 2-3 times a year,Socially,None,High (both for personal and professional purposes),Single adult,1,None,Yes,1 (Dog),Single,None,Good,None,Good,Private,Good,Liberal,Regular voter,Moderately engaged (following news and discussions),800,200,500,400
Male,Male,30 to 44,Married,Heterosexual,British,United Kingdom,England,London,Urban,Apartment,5 years,Master,No,Computer Science,Information Technology,"£100,000",Full-time,Renting,Caucasian,English,None,None,Citizen,"Coding, gaming, hiking","Quality over price, convenience","Buys when needed, compares options online",Primary online,Monthly,No specific preferences,Moderately active (hiking on weekends),Daily (primarily Facebook and Twitter),"International travel once a year, several domestic trips",Social (weekends),None,"High (uses smart home devices, latest smartphone, laptop)",Married with no children,2,0,Yes,1 (dog),Married,None,Good,None,Good,Private,Good,Liberal/Democrat,Always votes,"Moderately (follows news, occasionally participates in local political events)",800,200,600,400
Female,Female,30 to 44,Single,Heterosexual,British,United Kingdom,England,London,Urban,Apartment,5 years,Master,No,Business Management,Finance,80000£ to 120000£,Full-time,Renting,Caucasian,English,Agnostic,None specified,Citizen,"Yoga, reading, and travel",Quality and Sustainability,Selective shopper,Primary online,Monthly,Vegetarian,Moderate,Daily,International travel twice a year,Socially,Never,High,"Single, no children",1,0,Yes,1 cat,Single,None,Good,None,Good,Private Healthcare,Good,Liberal/Democrat,Always votes,Moderately engaged,1200,200,800,600
Male,Male,30 to 44,Married,Heterosexual,British,United Kingdom,Greater London,London,Urban,Apartment,5 years,Master,No,Computer Science,Technology,£80000 to £120000,Full-time,Renting,White,"English, Spanish",None,None,Citizen,"Cycling, Cooking, Traveling","Quality, Brand Reputation","Routine, Planned Purchases",Primary online,Monthly,No dietary restrictions,Moderately active,Daily,International Travel 1-2 times a year,Socially,Non-user,High - Early Adopter,"DINK (Double Income, No Kids)",2,0,Yes,1 Dog,Married,None,Good,None,Stable,Private,Good,Liberal,Always Votes,"Moderately engaged (follows political news, occasionally attends local political events)",1000,150,700,500
Male,Male,35,Married,Heterosexual,British,United Kingdom,England,London,Urban,House,5 years,Master,Non-Student,Computer Science,IT,£100000,Full-time,Own,Caucasian,English,Atheist,Western,Citizen,"Programming, Cycling, Traveling","Convenience, Quality","Research driven, Brand loyal",Primarily online,Monthly,Omnivore,Moderate,Regular,Annual international travel,Socially,Non-user,High,Nuclear,4,2,Yes,1 dog,Married,Parental,Good,None,Good,Private,Excellent,Liberal,Regular voter,Moderately engaged,1000,200,500,300
Female,Female,30 to 44,Married,Heterosexual,British,United Kingdom,Greater Manchester,Manchester,Urban,House,5 to 10 years,Master,Part-time,Business Management,Financial Services,80000£ to 120000£,Full-time,Owned,White British,English,Atheist,None,Citizen,"Reading, traveling, cooking, hiking","Quality over quantity, sustainability",Makes lists and researches before buying,Primary online,Monthly,No specific restrictions,Active (exercises 3-4 times a week),Moderate (2-3 hours a day),Travels internationally 2-3 times a year,Social drinker,Non-user,High (uses for work and personal life),"Nuclear (Self, spouse, children)",4,2,Yes,1 dog,Married,Children,Good,None,"Generally good, occasional stress",Private healthcare,Good,Liberal,Regular voter,"Somewhat engaged (follows news, discussions)",1200,200,800,500
Male,Male,30 to 44,Married,Heterosexual,British,United Kingdom,England,London,Urban,Apartment,5 years,Master,Non-student,Computer Science,Information Technology,£80000 to £120000,Full-time,Rented,Caucasian,English,Agnostic,None,Citizen,"Coding, Hiking, Reading Science Fiction","Convenience, Quality","Monthly big purchases, regular small purchases",Primary online,Weekly,No specific diet,Moderately active,Daily,International travel once a year,Socially,Never,High (as part of profession and personal interest),Nuclear family,3,1,Yes,1 (Dog),Married,Child,Good,None,Stable,Private insurance,Easy access,Liberal,Always votes,"Moderately engaged (follows politics, occasionally contributes to discussions)",1000,200,700,500
Male,Male,30 to 44,Married,Heterosexual,British,United Kingdom,Greater London,London,Urban,Apartment,5 years,Master,Non-student,Computer Science,Technology,£80000 to £120000,Full-time,Own,Caucasian,English,Atheist,N/A,Citizen,"Technology, travel, cooking","Convenience, quality","Regular online shopper, occasional in-store",Primary online,Weekly,No specific preferences,Moderate (exercises 2-3 times per week),"Daily, diverse platforms",International travel 2-3 times/year,Socially,None,"High (frequent use of computer, smartphone, and smart home devices)",Married with children,4 people,2,Yes,1 dog,Married,Children and pet,Good,None,Good,Private,Good,Liberal,Regular voter,Moderately engaged,1000,150,700,400
Female,Female,30 to 44,Married,Heterosexual,British,United Kingdom,Greater London,London,Urban,Apartment,5 years,Master,Non-student,Software Engineering,Technology,£80000 to £120000,Full-time employed,Renting,Caucasian,English,None,Non-religious festivals and gatherings,Citizen,"Coding, hiking, reading science fiction",Quality and convenience,Planned purchases with occasional impulse buys,Primary online,Bi-weekly,No specific preferences,Moderately active,"Daily, mainly for keeping up with friends and family",One short domestic trip and one long international trip per year,Occasionally,Never,"High, professional and personal use",Nuclear family,3,1,Yes,1 dog,Married,Child and pet,Good,None,Generally stable,Covered by employer,Easy access,Centrist,Votes in major elections,"Moderately informed, low activism",1200,200,800,600
Female,Female,34,Married,Heterosexual,British,United Kingdom,England,Manchester,Urban,House,5 years,Master,No,Business Management,Marketing,90000£,Full-time,Mortgage,Caucasian,English,Atheist,None,Citizen,"Yoga, reading, traveling","Convenience, quality",Budget-conscious,Primary online,Monthly,Vegetarian,Moderately active,"Daily, Instagram and LinkedIn","Two international trips per year, frequent domestic trips",Socially,Never,High,Couple with no children,2 adults,0,Yes,1 dog,Married,None,Good,None,Good,Private,Excellent,Liberal,Consistently votes,"Moderate (follows news, votes in major elections)",1200,200,800,500
Male,Male,30 to 44,Single,Heterosexual,British,United Kingdom,Greater London,London,Urban,Apartment,5 years,Master,No,Information Technology,IT Sector,£100000,Full-time,Rents,Caucasian,English,Atheist,None,Citizen,"Technology, Running, Gaming","Convenience, Quality","Prefers quality over price, shops monthly",Primary online,Monthly,No specific diet,Moderate,Daily,Enjoys bi-annual international travel,Socially,Never,High,"Single, no children",1,0,No,0,Single,None,Good,None,Good,Private,Good,Liberal,Regular voter,Occasionally,2000,100,700,500
Female,Female,30 to 44,Single,Heterosexual,British,United Kingdom,London,London,Urban,Apartment,5 years,Master,No,Computer Science,Information Technology,£100000,Full-time,Owner,Caucasian,"English, Spanish",None,Non-practicing,Citizen,"Coding, Hiking, Reading","Quality, Sustainability",Planned purchases,Primary online,Monthly,Vegetarian,Moderate,Daily,Once a year internationally,Socially,None,High,"Single, no children",1,0,Yes,1 cat,Single,None,Good,None,"Generally good, occasional anxiety",Private insurance,Good,Liberal,Always votes,Moderately engaged,600,150,400,300
Female,Female,30 to 44,Married,Heterosexual,British,United Kingdom,Greater London,London,Urban,Apartment,5 years,Master,Non-Student,Business Administration,Finance,80000£ to 120000£,Full-time,Rents,White,English,Atheist,Non-specific,Citizen,"Reading, Yoga, Travel","Quality over price, Sustainability",Plans purchases,Primary online,Monthly,Vegetarian,Moderate,Daily,Internationally 2-3 times a year,Socially,None,Highly tech-savvy,Couple with no children,2,0,Yes,1 Dog,Married,None,Excellent,None,Good,Private,Good,Liberal,Regular voter,Moderately engaged,1200,300,800,600
Male,Male,30 to 44,Married,Heterosexual,British,United Kingdom,West Yorkshire,Leeds,Urban,Detached house,2 to 5 years,Master,No,Computer Science,Information Technology,80000£ to 120000£,Full-time,Own,White,English,None,None,Citizen,"Programming, cycling, reading","Convenience, quality, technology",Research extensively before purchasing,Online,Monthly,No special diet,Moderate,"Regular, primarily LinkedIn and Twitter",Once a year internationally; multiple short breaks nationally,Socially,None,"High, heavily integrated into both professional and personal life",Nuclear,4,2,Yes,1 dog,Married,Children,Good,None,Good,"Private, through employment",Good,Liberal,Regular voter,"Moderately engaged, primarily through information gathering and discussions",1000,150,600,400
Male,Male,30 to 44,Single,Heterosexual,British,United Kingdom,Greater London,London,Urban,Apartment,5 years,Master,No,Computer Science,Technology,£80000 to £120000,Full-time,Rent,White,English,Agnostic,None,Citizen,"Gaming, hiking, travel",Quality over price,Buys when necessary,Primary online,Monthly,No specific diet,2-3 times a week,Moderately engaged,International travel once a year,Socially,Non-user,High - enthusiast and early adopter,Lives alone,1,0,Yes,1 dog,Single,None,Good,None,Stable,Private,Good,Liberal,Votes in major national elections,Moderately engaged,1000,200,700,500
Male,Male,30 to 44,Single,Heterosexual,British,United Kingdom,England,London,Urban,Apartment,2-5 years,Master,No,Information Technology,Technology,£80000 to £120000,Full-time,Rent,Caucasian,English,Agnostic,None,Citizen,"Coding, hiking, reading science fiction","Quality over price, technological advancements","Research-intensive, brand loyal",Primary online,Monthly,Omnivore with a preference for organic foods,Moderate (3-4 times a week),Moderate (up to 1 hour a day),"Enjoys yearly international travel, prefers adventure tourism",Socially,None,Heavy (Uses a wide range of devices and is always on the lookout for the next technological advancement),"Single, no children",1,0,Yes,1 (dog),Single,None,Good,None,"Good, with regular mindfulness practice",Covered by employer,Good,Liberal,Always votes,Low (keeps informed but not actively involved),1000,200,700,500
Female,Female,30 to 44,Married,Heterosexual,Canadian,United Kingdom,Greater London,London,Urban,Apartment,5 years,Master,No,Business Administration,Management,90000£,Full-time,Rented,Caucasian,"English, French",Atheist,None,Permanent Resident,"Reading, Traveling, Yoga",Quality over Price,Eco-friendly and Sustainable products,Primary online,Monthly,Vegetarian,Moderate,High,Multiple times a year,Socially,Never,High,Nuclear,3,1,Yes,1,Married,Child,Good,None,Good,Private,Good,Liberal,Always votes,Moderate,1000,200,800,500
Male,Male,30 to 44,Married,Heterosexual,British,United Kingdom,Essex,Chelmsford,Urban,House,5 to 10 years,Master,No,Software Engineering,Information Technology,£80000 to £120000,Full-time,Owner,Caucasian,English,None,N/A,Citizen,"Programming, Cycling, Reading",Quality and Durability,Research-intensive & value-driven,Primary online,Monthly,No specific diet,Moderate (Cycling weekly),Low (Less than an hour daily),"Annual international vacation, occasional local trips",Socially (Weekends),Never,High (Both for work and personal use),Nuclear family,3,1,No,N/A,Married,Child,Good,None,Good,Private insurance,Good,Liberal,Regular voter,"Occasional (Follows political news, votes in major elections)",1500,150,800,500
Female,Female,30 to 44,Married,Straight,British,United Kingdom,England,London,Urban,Apartment,5 years,Master,No,Business Administration,Finance,£80000 to £120000,Employed full-time,Owned,White,English,Atheist,Secular,Citizen,"Yoga, Reading, Traveling","Quality, Sustainability","Planned purchases, Minimalist",Primary online,Monthly,Vegetarian,High,Moderate,International travel 2-3 times a year,Occasional,Never,High,Nuclear,3,1,Yes,2,Married,Primary caregiver to child,Good,None,Good,Private insurance,High,Liberal,Regular voter,Moderately engaged,£800,£150,£500,£300
Female,Female,30 to 44,Single,Heterosexual,British,United Kingdom,Greater London,London,Urban,Apartment,5-10 years,Master,No,Marketing,Digital Marketing,£80000 to £120000,Full-time,Renting,Caucasian,English,None,None,Citizen,"Traveling, reading, cooking",Quality and brand reputation,Primarily planned purchases,Primary online,Bi-weekly,Vegetarian,Moderate,"Daily, multiple platforms",International travel 2-3 times per year,Socially,Never,High,"Single, no children",1,0,Yes,1,Single,None,Good,None,Good,Private,Good,Liberal,Always votes,Somewhat engaged,1200,200,800,600
Female,Female,30 to 44,Married,Heterosexual,British,United Kingdom,Greater London,London,Urban,Apartment,5 years,Master,No,Business Management,Marketing,100000£,Full-time,Rents,Caucasian,English,None,None,Citizen,"Running, Reading, Traveling","Quality, Convenience","Planned purchases, Occasional impulse buys",Primary online,Weekly,No dietary restrictions,High,Daily,2-3 international trips a year,Socially,Never,High,Married without children,2,0,Yes,1 cat,Married,None,Good,None,Good,Private,Good,Liberal,Active voter,Occasionally engaged in political discussions,800,200,600,400
Male,Male,30 to 44,Married,Heterosexual,British,United Kingdom,Greater London,London,Urban,Apartment,5 years,Master,No,Computer Science,Information Technology,90000£ to 110000£,Full-time,Rents,White,"English, French",Agnostic,None,Citizen,"Programming, Biking, Reading Sci-Fi",Quality over Price,Bargain Hunter,Primary online,Monthly,No restrictions,Moderately active,Daily for professional networking,International once a year,Socially,Never,Heavy user for work and personal life,Nuclear Family,3,1,Yes,1 dog,Married,Child,Good,None,Good,Private,Good,Liberal,Regular voter,Occasionally participates in local politics,1500,200,800,600
Male,Male,30 to 44,Married,Heterosexual,British,United Kingdom,Greater London,London,Urban,Apartment,5 years,Master,No,Computer Science,Technology,100000£,Full-time,Renting,Caucasian,English,Agnostic,None,Citizen,"Tech gadgets, programming, cycling",Quality and convenience,Researches products extensively before purchasing,Primary online,Monthly,No specific diet,Moderately active,"Moderate, primarily LinkedIn and Twitter",Enjoys 2 international trips per year,Socially,Non-smoker,"High, early adopter of new technologies",Nuclear,3,1,Yes,1 dog,Married,Childcare,Good,None,Good,Covered by employer,Good,Liberal,Regular voter,Occasionally participates in local political events,800,200,500,400
Male,Male,35,Single,Heterosexual,British,United Kingdom,Greater London,London,Urban,Apartment,5 years,Master,Non-student,Data Science,Technology,100000£,Full-time employed,Rents,Caucasian,English,Agnostic,None,Citizen,"Tech, gaming, hiking","Convenience, quality",Regular online shopper,Primary online,Monthly,Omnivore,Moderately active,Daily,Annually,Socially,Non-user,Heavy,"Single, no children",1,0,No,0,Single,None,Good,None,Stable,Private,Good,Liberal,Regular voter,Moderately engaged,800,200,500,400
Male,Male,35,Married,Heterosexual,British,United Kingdom,Greater London,London,Urban,Apartment,5 years,Master,No,Computer Science,Software Development,£95000,Full-time,Own,Caucasian,"English, French",None,N/A,Citizen,"Coding, Cycling, Traveling","Quality over price, technology enthusiast",Researches extensively before purchase,Online,Monthly,No dietary restrictions,Active (3-4 times a week),Moderate (uses primarily for news and staying in touch with family/friends),"Twice a year, international and domestic",Occasional (social settings),Non-user,Highly proficient and uses up-to-date technology,Couple with no children,2,0,Yes,1 (dog),Married,None,Very Good,None,Good,Private,Good,Liberal,Votes in major elections,Somewhat engaged (follows news and occasionally attends events),1200,250,800,600
Male,Male,30 to 44,Married,Heterosexual,British,United Kingdom,West Yorkshire,Leeds,Urban,House,5 to 10 years,Master,Non-Student,Computer Science,Technology,£80000 to £120000,Employed Full-time,Owner,White British,English,Agnostic,None,Citizen,"Technology, Gaming, Traveling","Convenience, Quality","Research before buying, Prefers eco-friendly products",Primary online,Monthly,No restrictions,Moderate (2 to 3 times a week),Daily (Primarily LinkedIn and Twitter for professional networking),"2-3 trips a year, ideally international",Socially,Never,"Highly adept, frequent user of latest tech",Married with children,4,2,Yes,1 Dog,Married,Spouse and children,Good,None,Generally good,Private healthcare through employment,Good,Liberal,Regular voter,Somewhat engaged,300,150,400,250
Female,Female,35,Married,Heterosexual,British,United Kingdom,Greater London,London,Urban,Apartment,5 years,Master,Non-Student,Business Administration,Finance,"£100,000",Full-time,Rented,Caucasian,"English, French",None,None,Citizen,"Travel, reading, yoga",Quality and sustainability,"Planned purchases, occasional impulse buys",Primarily online,Bi-monthly,Pescetarian,Moderate (3-4 times a week),"Daily (Instagram, LinkedIn)",Internationally 2-3 times a year,Socially,None,"High (smartphone, laptop, smart home devices)",Nuclear (spouse and 1 child),3,1,Yes,1 dog,Married,Child and pet,Good,None,Stable,Private,Good,Moderate,Regular voter,Moderately engaged,£700,£200,£500,£400
Male,Male,30 to 44,Married,Heterosexual,British,United Kingdom,Greater London,London,Urban,Apartment,5 years,Master,No,Computer Science,Information Technology,£100000,Full-time,Rented,Caucasian,English,Agnostic,None,Citizen,"Gaming, Hiking, Traveling","Convenience, Quality","Buys premium brands, environmentally conscious",Primary online,Monthly,Omnivore,Moderate,High,International travel twice a year,Socially,None,High,Nuclear,3,1,Yes,1 (Dog),Married,Childcare,Good,None,Good,Private,Easy,Moderate,Regular voter,Moderately active,800,250,500,400
Male,Male,30 to 44,Married,Heterosexual,British,United Kingdom,Greater London,London,Urban,Apartment,5 years,Master,No,Business Administration,Financial Services,£80000 to £120000,Full-time,Own,Caucasian,English,Agnostic,None,Citizen,"Cycling, investing, and cooking",Quality and convenience,"Research-driven, planned purchases",Primary online,Monthly,No special diet,3 times a week,Minimal,"1 international trip per year, several domestic trips",Socially,Never,High for personal finance and entertainment,Nuclear family,3,1,Yes,1 dog,Married,Child,Good,None,Stable,Private insurance,Good,Centrist,Regular voter,Moderate,500,150,350,250
Female,Female,30 to 44,Married,Heterosexual,British,United Kingdom,England,London,Urban,Apartment,5 years,Master,No,Business Administration,Management,£100000,Full-time,Renting,Caucasian,"English, French",Christianity,Traditional Holidays,Citizen,"Traveling, reading, yoga","Quality, Brand Loyalty","Monthly big purchases, weekly essentials",Primary online,"Weekly for essentials, monthly for others",Vegetarian,Moderate (3 times a week),Daily,International travel 2-3 times a year,Socially,Never,"High (constant use of smartphone, laptop for work and personal use)","Nuclear (self, spouse, children)",4,2,Yes,1 dog,Married,Children,Good,None,Good,Private,Good,Liberal,Regular voter,"Moderately engaged (follows political news, occasionally attends local events)",1200,200,800,500
Male,Male,30 to 44,Married,Heterosexual,British,United Kingdom,Not Applicable,Cambridge,Urban,House,5 years,Master,Non-student,Computer Science,Information Technology,100000£,Full-Time Employed,Owns,Caucasian,English,Atheist,None,Citizen by Birth,"Hiking, Programming, Reading Science Fiction",Quality over quantity,"Regular, but prefers quality items",Primary online,Monthly,Omnivore,Moderately Active,Daily,Enjoys international travel once a year,Social Drinker,Never,"High, both professionally and personally",Partner with no children,2,0,Yes,2,Married,None,Good,None,Good,Private Health Insurance,Unrestricted,Centrist,Regular Voter,Occasionally contributes to public discussions,800,200,500,400
Male,Male,30 to 44,Married,Heterosexual,British,United Kingdom,Greater London,London,Urban,Apartment,5 years,Master,No,Finance,Banking,£100000,Full-time employed,Renting,Caucasian,"English, French",Atheist,N/A,Citizen,"Hiking, reading, travel",Quality over quantity,Researches extensively before purchasing,Primary online,Monthly,No restrictions,Moderately active (3-4 times a week),"Regular user (daily), mainly LinkedIn and Twitter for professional and news updates","Frequent traveler, 3-4 trips a year, mix of business and pleasure",Social drinker,Non-smoker,"Highly proficient, early adopter",Married without children,2 adults,0,Yes,1 dog,Married,None,Excellent,None,Good,Privately insured,Easy access,Moderate,Always votes,Following issues but not actively involved,1500,200,800,500
Male,Male,30 to 44,Single,Heterosexual,British,United Kingdom,Greater London,London,Urban,Apartment,5 years,Master,No,Computer Science,Information Technology,£80000 to £120000,Employed,Rented,White British,English,Agnostic,None,Citizen,"Programming, reading, video gaming","Convenience, quality","Research heavy, value driven",Primary online,Weekly,No specific preferences,Moderate,"Daily, primarily for news and content consumption",Enjoys yearly international travel for leisure,Socially,Never,Heavy user of both mainstream and niche technology,Oldest sibling of two,1,0,Yes,1 cat,Single,None,Good,None,"Good, with occasional stress managed through hobbies",Private health insurance,Easy access,Liberal,Regular voter,Follows political news and occasionally participates in discussions online,1500,200,900,600
Male,Male,30 to 44,Married,Heterosexual,British,United Kingdom,Greater London,London,Urban,Apartment,5 years,Master,No,Computer Science,Information Technology,£100000,Full-time,Renting,Caucasian,English,None,N/A,Citizen,"Cycling, Programming, Traveling","Convenience, Quality",Focused on electronics and IT gadgets,Primarily online,Monthly,No specific diet,Moderate,Regularly (Daily),2-3 international trips a year,Socially,None,High (daily for work and personal use),Nuclear,2,None,Yes,1 (dog),Married,None,Good,None,Good,Private,Good,Liberal/Democrat,Regular voter,Moderately engaged,2000,100,800,400
Male,Male,30 to 44,Married,Heterosexual,British,United Kingdom,Greater London,London,Urban,Flat,5 years,Master,Non-student,Business Management,Finance,100000£ to 120000£,Employed full-time,Owns with a mortgage,White British,English,Christian,Celebrates traditional British holidays,Citizen,"Cycling, Wine tasting, Stock market investing",Quality and brand reputation,"Bi-weekly, mainly weekends",Primary online,Several times a month,No specific restrictions,Active (exercises 3-4 times a week),"Daily, mainly Twitter and LinkedIn for professional networking and news",International travel 2-3 times a year for vacations,Socially,Non-smoker,High (utilizes both professional and smart home technologies),Nuclear family,3,1,Yes,1 dog,Married,Parenting,Excellent,None,Good,Private insurance,Good,Moderately conservative,Votes regularly in national elections,"Mildly engaged, follows political news",900,250,600,450
