Female,Female,30 to 44,Married,Heterosexual,British,United Kingdom,Greater London,London,Urban,Apartment,5 years,Master,No,Finance,Finance,90000£,Full-time employed,Renter,Caucasian,"English, French",Agnostic,None,Citizen,"Travel, reading, yoga","Quality over price, ethical sourcing",Monthly planned purchases,Primary online,Monthly,Omnivore with preference for organic foods,Active (3-4 times a week),Moderate (2 hours/day),International travel 2-3 times a year,Social drinker,Non-user,High (both for personal and professional use),Nuclear family,3,1,Yes,1 dog,Married,Child,Excellent,None,"Good, with occasional stress",Privately insured,Excellent access,Liberal,Regular voter,"Somewhat engaged (follows news, occasional discussions)",1000,200,700,500
Male,Male,30 to 44,Married,Heterosexual,British,United Kingdom,Greater London,London,Urban,Apartment,5 years,Master,No,Computer Science,Technology,£100000,Employed,Renting,Caucasian,English,Atheist,None,Citizen,"Coding, hiking, reading science fiction","Convenience, quality",Research before purchase,Primary online,Monthly,No dietary restrictions,Moderate,Regularly,Annual international travel,Socially,Never,Highly proficient,Married without children,Two,None,Yes,One dog,Married,None,Good,None,Good,Private,Easy,Liberal,Always votes,Moderately engaged,800,150,500,350
Male,Male,30 to 44,Married,Heterosexual,British,United Kingdom,Greater London,London,Urban,Apartment,5 years,Master,No,Business Administration,Finance,90000£ to 110000£,Full-time,Renting,White,English,Atheist,None,Citizen,"Cycling, Reading, Technology gadgets",Quality and Brand reputation,Research extensively before purchasing,Primarily online,Monthly,No restrictions,Moderately active,Daily,International travel once a year,Social drinking,Never,High,Married without children,2,0,No,0,Married,None,Good,None,Good,Private insurance,Good,Liberal,Regular voter,Moderately engaged,1200,200,800,500
Female,Female,30 to 44,Married,Heterosexual,British,United Kingdom,Sussex,Brighton,Urban,House,5 years,Master,No,Environmental Science,Environmental Consultancy,"£100,000",Full-time,Mortgage,White,"English, Spanish",Agnostic,Meditation and Yoga,Citizen,"Hiking, Reading, Sustainable Living","Quality over price, Environmental Sustainability",Prefers buying local and eco-friendly products,Primary online,Monthly,Vegetarian,High,Daily,Enjoys eco-tourism and cultural experiences,Socially,Never,Highly engaged with new eco-friendly technologies,Couple with no children,2 adults,0,Yes,"2 (1 dog, 1 cat)",Married,None,Excellent,None,Good,Private,Easy,Green Party,Always votes,Active in local environmental groups,1200,250,800,500
Male,Male,30 to 44,Married,Heterosexual,British,United Kingdom,Greater London,London,Urban,Apartment,5 years,Master,No,Business Management,Finance,£100000,Full-time,Renting,White British,English,Non-religious,None,Citizen,"Running, Reading, Traveling","Convenience, Quality",Research before purchasing,Primary online,Monthly,No specific preferences,High,"Regularly, mainly LinkedIn and Facebook",International travel 2-3 times a year,Socially,Non-smoker,High,Married with no children,2,0,Yes,1 dog,Married,None,Very good,None,Good,Privately insured,"Good, with private healthcare access","Moderate, with no strong affiliation",Votes regularly in major elections,Moderately informed but not actively involved,int,200,800,500
Female,Female,30 to 44,Married,Heterosexual,British,United Kingdom,Greater London,London,Urban,Apartment,6 years,Master,No,Economics,Finance,£90000 to £110000,Full-time,Owned,Caucasian,"English, French",Atheist,None,Non-immigrant,"Cycling, Reading, Traveling",Quality over price,Planned purchases,Primary Online,Monthly,Vegetarian,High,Moderate,International trips twice a year,Social drinker,None,High,Nuclear,3,1,Yes,1 dog,Married,Parenting,Good,No,Stable,Private,Excellent,Liberal,Regular voter,Low,800,300,600,500
Male,Male,30 to 44,Married,Heterosexual,British,United Kingdom,Greater London,London,Urban,Apartment,5 years,Master,No,Computer Science,Information Technology,"£100,000",Full-time,Rented,White,"English, French",Agnostic,None,Citizen,"Coding, Cycling, Podcasts","Convenience, Quality","Research-driven, Brand loyal",Primary online,Monthly,No restrictions,Moderately active,Daily,Internationally 2x a year,Socially,Never,Heavy user for both work and leisure,Nuclear family,3,1,Yes,1 dog,Married,Children,Good,None,Good,Private,Easy,Centrist,Regular voter,Moderately engaged,750,200,500,400
Male,Male,30 to 44,Married,Heterosexual,British,United Kingdom,Greater London,London,Urban,Apartment,5 years,Master,No,Computer Science,Technology,"£100,000",Full-time,Renting,Caucasian,English,Agnostic,None,Citizen,"Coding, Gaming, Reading Science Fiction","Convenience, Quality","Brand loyal, Values discounts",Primary online,Monthly,No restrictions,Moderately active,Daily,Internationally once a year,Socially,Never,Heavy,Nuclear,3,1,Yes,1,Cohabiting,Child,Good,None,Stable,Public,Good,Liberal,Regular voter,Occasionally active,800,150,500,250
Male,Male,30 to 44,Married,Heterosexual,British,United Kingdom,Not Applicable,London,Urban,Apartment,5 years,Master,No,Computer Science,Information Technology,80000£ to 120000£,Full-time,Rents,Caucasian,English,Agnostic,None,Citizen,"Coding, Gaming, Reading Science Fiction","Convenience, Quality","Regular Online Purchaser, Occasional In-Store",Primary online,Weekly,No Restrictions,Moderately active,Daily,International travel twice a year,Socially,Never,High,Nuclear Family,3,1,Yes,1 Dog,Married,Child,Good,None,Good,Private,Easily accessible,Liberal,Regular voter,Occasionally participates in local community discussions,1000,200,600,400
Male,Male,30 to 44,Single,Heterosexual,British,United Kingdom,England,London,Urban,Apartment,5 years,Master,No,Information Technology,IT Management,£80000 to £120000,Full-time,Rented,White,English,Atheist,None,Citizen,"Travel, technology, gaming","Convenience, quality",Checks reviews online before purchasing,Primary online,Monthly,No specific preference,Moderately active,Daily,Travels internationally 2-3 times a year,Socially,None,High,"Single, no children",1,0,No,0,Single,None,Good,None,Good,Private Insurance,High,Liberal,Regular Voter,Moderate,850,250,600,500
Female,Female,30 to 44,Married,Heterosexual,British,United Kingdom,Greater London,London,Urban,Apartment,5 to 10 years,Master,No,Business Administration,Marketing,£80000 to £120000,Full-time,Renting,White,English,Atheist,None specified,Citizen,"Literature, Hiking, Visual Arts","Quality over price, Ethical considerations, Local brands",Moderate shopper,Primary online,Weekly,No dietary restrictions,Moderately active,Daily,Internationally 1 to 2 times a year,Socially,Never,"High interest in new technologies, active user of smart home devices",Married with no children,2 adults,0,Yes,1 dog,Married,Parental care,Good,No,Generally good with occasional anxiety,Private insurance,Good,Liberal,Regular voter,Moderately engaged,700,250,500,400
Male,Male,30 to 44,Married,Heterosexual,British,United Kingdom,Greater London,London,Urban,Apartment,5 years,Master,Not a student,Business Administration,Finance,100000£ to 120000£,Full-time employed,Owned with a mortgage,Caucasian,English,Agnostic,None,Citizen,"Travel, Reading, Cycling",Quality and convenience,Prefers branded goods,Primary online,Weekly,"Non-vegetarian, minimal processed foods",Moderately active,"Daily, mainly LinkedIn and Twitter",International travel 2-3 times a year,Socially,None,"High, both for work and personal life",Nuclear,3,1,Yes,1 Dog,Married,Childcare,Good,None,Good,Private health insurance,Easy access,Moderate,Votes in every major election,Occasional discussion and reading,800,200,500,400
Male,Male,30 to 44,Single,Heterosexual,British,United Kingdom,Greater London,London,Urban,Apartment,2 years,Master,No,Computer Science,Information Technology,£100000,Full-time,Rents,Caucasian,English,Atheist,None,Citizen,"Programming, Video Games, Gym","Convenience, Quality","Buys premium tech products, Occasionally splurges on hobbies",Primary online,Monthly,No specific diet,Moderate (exercises 3-4 times a week),Daily (primarily LinkedIn and Reddit),Domestic and international travel 1-2 times a year,Socially,Non-smoker,High (uses the latest gadgets and keeps up-to-date with technology trends),"Single, No children",1,0,No,0,Single,None,Good,None,Stable,Private coverage,Easy access to healthcare services,Liberal,Regular,"Somewhat engaged (follows political news, occasionally participates in votes and discussions)",1000,150,600,450
Male,Male,30 to 44,Married,Heterosexual,British,United Kingdom,Greater London,London,Urban,Apartment,5 years,Master,No,Computer Science,Information Technology,£80000 to £120000,Full-time,Renting,White,English,Agnostic,None,Citizen,"Programming, Video Gaming, Cycling","Convenience, Quality","Research before purchasing, Prefers tech gadgets","Online primarily, occasionally physical stores",Monthly,No special preferences,Moderate (cycling and occasional gym),Regular (mainly LinkedIn and Twitter),Occasional international travel,Socially,Non-user,High (both professional and personal use),Nuclear family,3,1,Yes,1 Dog,Married,Parental duties,Good,None,Good,Private insurance,Good,Liberal,Regular voter,"Occasionally engaged, mostly online",1000,200,700,500
Male,Male,30 to 44,Married,Heterosexual,British,United Kingdom,Greater London,London,Urban,Flat,5 years,Master,No,Computer Science,Technology,100000£,Full-time,Renting,Caucasian,English,Atheist,Non-religious,Citizen,"Programming, Photography, Gaming","Convenience, Quality, Technology trends","Research before purchase, Discounts seeker",Primary online,Monthly,No specific diet,Moderate (Gym twice a week),"Daily (Reddit, Twitter)","2 to 3 times a year, mostly international",Socially,Non-smoker,High (Profession and personal interest),Spouse without children,2 persons,0,Yes,1 (Dog),Married,None,Good,None,Stable,Private,Good,Liberal,Votes in major elections,Minimally (Follows news),800,200,500,450
Female,Female,30 to 44,Single,Heterosexual,British,United Kingdom,Greater Manchester,Manchester,Urban,Apartment,5 years,Master,Not a student,Business Management,Finance,£80000 to £120000,Full-time,Renting,Caucasian,"English, French",Atheist,None specified,Citizen,"Yoga, reading, e-sports","Convenience, quality of products",Buys organic and eco-friendly products,Primary online,Weekly,Vegetarian,Moderately active,"Daily, primarily Instagram and LinkedIn",Internationally 2-3 times per year for leisure,Socially,Never,"High, particularly for home automation and finance apps",Single no kids,1,0,Yes,1 cat,Single,None,Very good,None,"Good, with occasional stress management",Private Healthcare,Good,Liberal,Always votes,Moderately engaged in discussions and follows politics regularly,1000,200,700,400
Male,Male,30 to 44,Single,Heterosexual,British,United Kingdom,Greater London,London,Urban,Apartment,5 years,Master,No,Computer Science,Information Technology,£80000 to £120000,Full-time,Rents,Caucasian,English,Atheist,None,Citizen,"Programming, Hiking, Reading","Convenience, Quality","Research before buying, Brand conscious",Primary online,Monthly,No specific diet,Moderate (3-5 times a week),"Daily, primarily LinkedIn and Twitter",International travel once a year,Socially,Never,High (Uses technology for both work and leisure),"Single, no children",1,0,No,0,Single,None,Good,None,Stable,Private healthcare,Good,Liberal,Always votes,"Moderately engaged (discusses politics, votes in major elections)",500,100,300,400
Male,Male,35,Married,Heterosexual,British,United Kingdom,West Midlands,Birmingham,Urban,Detached House,5 years,Master,No,Computer Science,Information Technology,95000£,Full-time,Owner,Caucasian,English,Atheist,None,Native,"Hiking, technology gadgets, cooking",Quality and convenience,"Buys brand names for technology, generic for groceries",Primary online,Weekly,No specific diet,Moderate,Daily,Domestic and international travel 2-3 times a year,Occasional,Never,High,Nuclear,4,2,Yes,1 dog,Married,Children,Good,None,Stable,Private,Good,Centrist,Regular voter,Moderately informed,1200,150,800,500
Male,Male,30 to 44,Married,Heterosexual,British,United Kingdom,Greater London,London,Urban,Apartment,5 years,Master,No,Computer Science,Information Technology,100000£,Full-time,Rented,Caucasian,English,Agnostic,Moderate,Citizen,"Technology, Cycling, Reading Science Fiction","Convenience, Quality, Technology Interest",Research extensively before purchase,Primary online,Monthly,"Omnivore, Health-conscious",Moderately active,Daily,"Annual international vacations, frequent domestic trips",Socially,Never,Heavy,Nuclear,3,1,No,0,Married,Child care,Good,None,Good,Through employer,Good,Liberal,Regular voter,Moderately interested,800,200,500,300
Male,Male,35,Single,Heterosexual,British,United Kingdom,Greater London,London,Urban,Apartment,5 years,Master,No,Computer Science,Information Technology,£95000,Full-time,Rents,Caucasian,English,Agnostic,None,Citizen,"Coding, Video Gaming, Hiking","Convenience, Quality over price",Research-intensive before purchase,Primary online,Monthly,"Omnivorous, tries to eat healthily",Moderate (exercises 2-3 times a week),"Daily (mainly LinkedIn, Reddit)","Internationally once a year, domestically several times a year",Socially,Non-user,Heavy user (both for personal and professional purposes),Oldest child with two younger siblings,1,None,No,0,Single,None,Good,None,"Generally good, occasional stress",Covered by employer,Good,Liberal,Votes in major national elections,"Moderately informed, not actively involved",£1200,£200,£800,£600
Male,Male,30 to 44,Single,Heterosexual,British,United Kingdom,Greater London,London,Urban,Apartment,5 to 10 years,Master,No,Computer Science,Technology,90000£ to 100000£,Full-Time,Renting,Caucasian,"English, Spanish",Atheist,None,Citizen,"Traveling, Programming, Hiking","Quality over price, Brand loyalty","Planned purchases, Occasionally impulsive",Primary online,Monthly,No dietary restrictions,Moderately active,Moderate,International travel 2-3 times a year,Social drinker,Never,Highly engaged,"Single, no children",1,0,No,0,Single,None,Good,None,Stable,Private insurance,Easy access,Liberal,Regular voter,Somewhat engaged,1000,200,600,400
Male,Male,30 to 44,Married,Heterosexual,British,United Kingdom,Greater London,London,Urban,Apartment,5-10 years,Master,No,Computer Science,Information Technology,80000£ to 120000£,Full-time,Renting,Caucasian,English,Atheist,Not Applicable,Citizen,"Programming, Videogames, Cycling",Quality over price,Budget-conscious for non-essentials,Primary online,Weekly,No special diet,Moderately active,"Daily, primarily Facebook and Twitter","Annual international trips, monthly domestic trips",Social drinking,Non-user,High - early adopter of new technologies,Couples with children,4,2,Yes,1 dog,Married,To children,Good,None,Stable,Covered by employer,Good access,Liberal,Always votes,Moderately engaged,1500,150,800,500
Female,Female,30 to 44,Married,Heterosexual,British,United Kingdom,Greater London,London,Urban,Apartment,5 years,Master,No,Business Administration,Marketing,90000£ to 110000£,Full-time employed,Rented,Caucasian,"English, French",Agnostic,Not Applicable,Citizen by birth,"Travel, reading, yoga","Quality over price, eco-conscious choices","Prefers ethical brands, monthly splurges on luxury items",Primary online,Bi-weekly,Vegetarian,Moderate (3-4 times a week),Active (3-5 hours a day on various platforms),International travel 2-3 times a year,Social drinker (weekends only),Non-user,"High (Uses smart home devices, streaming services, and stays updated with latest tech)",Married with no children,2,0,Yes,1 (Dog),Married,None,Very Good,None,"Generally good, occasional anxiety",Private healthcare,Easy access to healthcare services,Liberal,Regular voter,"Moderately engaged (follows news, participates in discussions, occasional activism)",1200,200,800,550
Female,Female,30 to 44,Married,Heterosexual,British,United Kingdom,Greater London,London,Urban,Flat,5 years,Master,No,Computer Science,Information Technology,90000£,Full-time,Renting,White British,"English, Spanish",None,None,Citizen,"Yoga, reading, travel","Quality over price, ethical and sustainable products","Plans purchases in advance, sporadic indulgences",Primary online,Monthly,Vegetarian,Active (exercises 3-4 times a week),Moderate (2 hours a day),Enjoys travelling abroad 2-3 times a year,Social drinking,None,High (uses technology for both work and leisure),Partnered with children,3,1,Yes,1 dog,Married,Primary caregiver to child,Good,None,"Generally well, occasional stress",Private Coverage,Good (easy access to healthcare facilities),Liberal,Regular voter,Occasionally participates in local politics meetings,1000,200,700,500
Male,Male,30 to 44,Married,Heterosexual,British,United Kingdom,Greater London,London,Urban,Apartment,5 years,Master,No,Computer Science,Information Technology,100000£,Full-time,Rents,Caucasian,English,Atheist,None,Citizen,"Technology, Reading, Hiking","Convenience, Quality",Research extensively before purchasing,Primary online,Monthly,No specific diet,Moderate (exercises 3-4 times a week),"Daily, mainly LinkedIn and Twitter","International travel once a year, domestic travel multiple times a year",Socially,Non-user,High (frequent usage of latest technology and gadgets),Nuclear family,4,2,No,0,Married,Children,Good,None,Good,Private Insurance,Easy access,Liberal,Regular voter,Occasionally participates in local community discussions,800,200,500,400
Male,Male,30 to 44,Married,Heterosexual,British,United Kingdom,Essex,Chelmsford,Urban,House,5 years,Master,No,Computer Science,Information Technology,90000£ to 110000£,Full-time,Mortgaged,White British,English,Atheist,None,Citizen,"Programming, Gaming, Hiking","Convenience, Quality",Prefers high-quality items,Primarily online,Monthly,No specific restrictions,Moderate,"Daily (Instagram, Twitter)",Preferably twice a year internationally,Social drinker,None,High,Couple with no children,2 adults,0,Yes,1 dog,Married,No regular responsibilities,Good,None,Stable,Private health insurance,Good,Liberal,Always votes,"Moderately engaged (follows news, occasionally participates in local politics)",1200,150,800,600
Male,Male,30 to 44,Married,Heterosexual,British,United Kingdom,Greater London,London,Urban,Apartment,5 years,Master,No,Computer Science,Tech,"90,000£ to 120,000£",Full-time employed,Renting,Caucasian,English,Atheist,Not applicable,Citizen,"Computing, Gaming, Hiking","Convenience, Quality, Technology","Research-centric, Brand conscious",Primary online,Monthly,No restrictions,Moderately active,Daily,Annual international travel,Socially,Never,High,Married with children,3,1,Yes,1 dog,Married,Parent,Good,None,Stable,Private,Good,Centre-left,Regular voter,Occasionally active,1000,200,700,500
Female,Female,30 to 44,Married,Heterosexual,British,United Kingdom,Greater London,London,Urban,Apartment,5 years,Master,No,Business Administration,Finance,"£80,000 to £120,000",Full-time employed,Rented,Caucasian,"English, French",Christian,Christmas and Easter celebrations,Citizen,"Travel, reading, wine tasting",Quality over price,"Brand loyal, planned purchases",Primary online,Weekly,No specific diet,Moderately active,"Daily (Instagram, LinkedIn)",International travel 2-3 times a year,Socially,Non-user,"High (smart home devices, smartphone, laptop)","Nuclear (spouse, one child)",3,1,Yes,1 dog,Married,Childcare,Good,None,Positive well-being,Private health insurance,Good,Moderate,Regular voter,"Some interest, occasional participation in local causes",£800,£150,£450,£600
Male,Male,30 to 44,Single,Heterosexual,British,United Kingdom,Greater London,London,Urban,Apartment,5 years,Master,No,Computer Science,Information Technology,£100000,Full-time,Rents,Caucasian,"English, French",Atheist,None,Citizen,"Hiking, Coding, Reading",Quality over quantity,"Buys occasionally, seeks deals",Primary online,Monthly,No restrictions,Moderately active,"Regularly on LinkedIn, occasionally on Twitter",2 international trips a year,Socially,None,"Heavy user, enthusiast","Single, no children",1 person,0,Yes,1 (dog),Single,None,Good,None,Good,Private,Good,Liberal,Always votes,Moderately engaged,800,150,500,350
Male,Male,30 to 44,Married,Heterosexual,British,United Kingdom,England,London,Urban,Apartment,5 years,Master,No,Computer Science,Information Technology,90000£ to 110000£,Full-time,Renting,Caucasian,English,None,None,Citizen,"Programming, Cycling, Gaming","Convenience, Quality",Research extensively before purchasing,Primary online,Monthly,Omnivore,Moderately active,Daily,"International travel once a year, domestic travel several times a year",Socially,None,High (frequent user of latest technologies),Nuclear (spouse and children),4,2,Yes,1 dog,Married,Children,Good,None,Good,Private insurance,Easy access,"Moderate, no strong affiliation",Votes in major elections,Somewhat interested in politics,1500,150,800,500
Female,Female,30 to 44,Married,Heterosexual,British,United Kingdom,Greater London,London,Urban,Apartment,5 years,Master,No,Business Administration,Finance,£100000,Full-time,Owner,White British,English,Agnostic,None,Citizen,"Travel, running, reading","Quality, Convenience","Weekend shopping, research before buying",Primary online,Monthly,No dietary restrictions,Moderately active,Daily,International travel 2-3 times a year,Socially,Never,High,Partner and children,4,2,Yes,1,Married,Children,Good,None,Good,Private,Easy,Liberal,Regular voter,Moderate,1000,200,500,400
Male,Male,30 to 44,Married,Heterosexual,British,United Kingdom,Greater London,London,Urban,House,5 years,Master,No,Computer Science,Information Technology,£100000,Full-time,Mortgage,White,English,Agnostic,British traditions,Citizen,"Programming, hiking, reading",Quality and convenience,Compares prices online,Primary online,Monthly,Omnivore,Moderate,"Daily, mainly LinkedIn and Twitter",Domestic and international travel once a quarter,Social drinking,Non-smoker,"High, early adopter",Married with children,4,2,Yes,1 dog,Married,Children,Good,None,Good,Private,Good,Moderate,Regular voter,Occasionally attending local community meetings,800,150,500,300
Female,Female,30 to 44,Married,Heterosexual,British,United Kingdom,Greater London,London,Urban,Apartment,5 years,Master,No,Business Administration,Finance,£80000 to £120000,Full-time,Rented,White,"English, French",Agnostic,Not specified,Citizen,"Travel, reading, yoga",Quality and necessity,Regular but mindful,Primary online,Monthly,Pescatarian,Moderate,Daily,International travel 2-3 times a year,Socially,No,High,Nuclear,3,1,Yes,1,Married,Children,Good,None,Stable,Private,Easy,Liberal,Regular voter,Moderately engaged,1500,200,800,600
Male,Male,30 to 44,Single,Heterosexual,British,United Kingdom,Greater London,London,Urban,Apartment,5 years,Master,No,Computer Science,Technology,£80000 to £120000,Full-time,Renting,White,English,Agnostic,None,Citizen,"Traveling, technology, and fitness",Quality and necessity,Environmentally conscious,Primary online,Monthly,Omnivore,Active,Daily,International trips once a year,Socially,Never,High,Single,1,0,No,0,Single,None,Good,None,Good,Private,Easy,Liberal,Regular,Moderately interested,1200,200,800,500
Male,Male,30 to 44,Married,Heterosexual,British,United Kingdom,Greater London,London,Urban,Flat,5 years,Master,No,Computer Science,Technology,£100000,Full-time,Renting,Caucasian,English,Atheist,None,Citizen,"Coding, Hiking, Gaming","Quality, Technology advancement",Research before purchase,Primary online,Monthly,Omnivore,Moderate,Daily,International once a year,Socially,Never,High,Nuclear,3,1,Yes,1 Dog,Married,Child,Good,None,Stable,Private,Good,Liberal,Regular voter,Moderately engaged,800,150,500,350
Male,Male,30 to 44,Married,Heterosexual,British,United Kingdom,Greater London,London,Urban,Apartment,2 years,Master,No,Marketing,Digital Marketing,90000£ to 110000£,Full-time,Rents,Caucasian,"English, Spanish",None,None,Citizen,"Running, Blogging, Culinary Arts",Quality and convenience,Preference for quality over quantity,Primary online,Weekly,No dietary restrictions,Highly active,Highly engaged on platforms like Twitter and Instagram,Domestic and international travel several times a year,Moderate,Non-smoker,"Highly proficient, utilizes smart home devices",Living with spouse,2 adults,None,Yes,1 dog,"Strong, committed relationship",None,Good,None,"Good, practices mindfulness and meditation",Privately insured,Good access to healthcare services,Liberal,Regularly votes in national elections,"Somewhat engaged, follows political news",1500,200,800,500
Male,Male,30 to 44,Married,Straight,British,United Kingdom,Greater London,London,Urban,Flat,2-5 years,Master,No,Computer Science,Information Technology,£80000 to £120000,Full-time employed,Rented,Caucasian,English,Agnostic,None,Citizen,"Coding, Gaming, Traveling","Convenience, Quality",Regular spender,Primary online,Monthly,No restrictions,Moderate,Daily,International travel 1-2 times a year,Socially,Never,Heavy user,Nuclear,3,1,Yes,1 (Dog),Married,Child only,Good,None,Good,Private,Good access,Moderate,Votes regularly,Somewhat engaged,1500,200,1000,700
Male,Male,30 to 44,Single,Heterosexual,British,United Kingdom,Greater London,London,Urban,Apartment,2 years,Master,No,Computer Science,Information Technology,£100000,Full-time,Rents,Caucasian,English,Atheist,None,Citizen,"Programming, Video Games, Travel","Convenience, Quality","Research-intensive, brand loyal",Primary online,Monthly,Omnivore,Moderate,Daily,Internationally 2 times a year,Socially,Never,Heavy,Single without children,1,0,No,0,Single,None,Very Good,None,Good,Covered by employment,Easy,Liberal,Regular voter,Moderate,800,200,500,400
