Male,Male,30 to 44,Single,Heterosexual,British,United Kingdom,Greater London,London,Urban,Apartment,3 years,Master,No,Computer Science,Information Technology,90000£ to 100000£,Full-time,Renter,Caucasian,English,Atheist,Not specified,Citizen,"Programming, Cycling, Reading","Convenience, Quality, Price",Prefers eco-friendly products,Primary online,Once a week,No specific diet,Moderately active,"Daily, mainly LinkedIn and Twitter",Enjoy short city breaks 2-3 times a year,Socially,Non-smoker,High,"Single, no children",1 adult,0,No,0,Single,None,Good,None,Good,Private,Good,Liberal,Regular voter,"Moderately engaged, mostly online discussions",1000,200,700,500
Male,Male,30 to 44,Married,Heterosexual,British,United Kingdom,Greater London,London,Urban,Apartment,5 years,Master,Non-Student,Computer Science,Technology,£100000,Full-time,Owns,Caucasian,English,Agnostic,None,Citizen,"Programming, running, reading science fiction","Convenience, quality, technology","Brand loyal, researches extensively before purchase",Primary online,Monthly,No specific preferences,Moderately active,"Daily, mainly for professional networking and news","Annual international travel, frequent domestic travel for work",Socially,None,"High, frequently tries new gadgets and software",Living with spouse and a child,3,1,Yes,1 dog,Married,Childcare,Very Good,None,"Generally good, occasional stress",Private health insurance through employment,Excellent,Liberal,Always votes,"Moderately engaged, follows news and debates policy but does not actively campaign",500,150,300,400
Male,Male,30 to 44,Married,Heterosexual,British,United Kingdom,Greater London,London,Urban,Apartment,5 years,Master,No,Computer Science,Information Technology,£80000 to £120000,Full-time,Renting,White,English,None,None,Citizen,"Programming, Gaming, Cycling","Convenience, Quality","Budget-conscious, Brand-loyal",Primary online,Monthly,No restrictions,"Moderate (e.g., cycling weekly)",Daily,Holiday abroad once a year,Socially,Never,Heavy (personal and professional),"Spouse, no children",2 adults,0,Yes,1 dog,Married,None,Good,None,Good,Through employer,Good,Liberal,Votes in major elections,"Moderately (e.g., follows news, occasional discussions)",1000,200,700,500
Male,Male,30 to 44,Married,Heterosexual,British,United Kingdom,Greater London,London,Urban,Apartment,5 to 10 years,Master,No,Computer Science,Information Technology,£90000 to £110000,Full-time,Renting,Caucasian,"English, French",Atheist,Non-religious,Citizen,"Programming, Cycling, Reading science fiction","Convenience, Quality","Bargain hunting, Rarely impulsive",Primary online,Bi-weekly,Omnivore with a preference for organic foods,Moderately active,"Daily, mainly LinkedIn and Twitter for professional purposes","International travel 1-2 times a year, mostly for leisure",Social drinker,Non-user,"High, includes work and leisure activities","DINK (Dual Income, No Kids)",2,0,Yes,1 dog,Married,None,Good,None,Stable,Private insurance,Good,Liberal,Votes regularly in national elections,"Moderately engaged, mostly through voting and discussing politics with friends",2000,150,800,500
Male,Male,30 to 44,Married,Heterosexual,British,United Kingdom,Greater London,London,Urban,Apartment,5 years,Masters,No,Computer Science,Software Development,90000£ to 110000£,Full-time,Renting,White British,English,Atheist,None,Citizen,"Programming, Hiking, Reading","Convenience, Quality",Research extensively before purchasing,Primarily online,Monthly,No restrictions,Moderate,Less than 1 hour/day,Annually for holidays,Socially,No,High,Nuclear,3,1,Yes,1,Married,Children,Good,None,Stable,Private,Good,Liberal,Regular,Moderate,1000,200,600,400
Male,Male,30 to 44,Married,Heterosexual,British,United Kingdom,Greater London,London,Urban,Apartment,5 years,Master,No,Business Administration,Finance,80000£ to 120000£,Full-time employed,Owned,Caucasian,English,Non-religious,None,Citizen,"Traveling, Running, Reading",Quality and convenience,Budget-conscious,Primary online,Monthly,No restrictions,High,Moderate,International trips 2-3 times a year,Socially,Never,"High, especially for work and personal finance management",Spouse without children,2,0,Yes,1 dog,Married,None,Excellent,None,Good,Private,Good,Liberal,Regular voter,Moderately engaged,1000,200,600,400
Female,Female,30 to 44,Married,Heterosexual,British,United Kingdom,West Yorkshire,Leeds,Urban,House,5 years,Master,Non-student,Business Administration,Finance,£80000 to £120000,Full-time employed,Owned,White British,English,Agnostic,None,Citizen,"Hiking, Reading, Yoga",Quality and Durability,Planned purchases,Primary online,Monthly,No dietary restrictions,Moderate,Daily,Bi-annual international travel,Socially,Non-user,High,Nuclear family,4,2,Yes,1 Dog,Married,Children,Good,None,Stable,Private,Good,Liberal,Regular voter,Low,1500,200,800,500
Male,Male,34,Single,Straight,German,United Kingdom,Greater London,London,Urban,Apartment,5 years,Master,No,Computer Science,Technology,100000£,Full-time,Rents,Caucasian,"German, English",Agnostic,None,Work Visa,"Coding, Hiking, Reading Science Fiction","Convenience, Quality","Buys high-tech gadgets, environmentally friendly products",Primary online,Monthly,Omnivore,Moderately active,Daily,International travel 2-3 times a year,Socially,Non-user,High,"Single, no dependents",1,0,No,0,Single,None,Good,None,Good,Private,Easy,Liberal,Votes in all major elections,Occasionally involved,800,150,600,400
Male,Male,30 to 44,Married,Heterosexual,British,United Kingdom,England,Manchester,Urban,House,5 to 10 years,Master,No,Computer Science,Information Technology,100000£ to 120000£,Full-time,Mortgage,White,English,Agnostic,None,Citizen,"Technology, Gaming, Hiking",Quality and Convenience,"Research-driven, brand loyal",Primary online,Weekly,No dietary restrictions,Moderate,Daily,International travel once a year,Occasional,Never,High,Nuclear,3,1,Yes,1 dog,Married,Child and pet,Good,None,Good,Private Insurance,Easily accessible,Moderate,Regular voter,Moderately engaged,1500,100,800,500
Male,Male,30 to 44,Married,Heterosexual,British,United Kingdom,Greater London,London,Urban,Apartment,5 years,Master,No,Business and Management,Finance,80000£ to 120000£,Employed Full-Time,Renting,Caucasian,English,Agnostic,None,Citizen,"Traveling, Reading, Cooking","Quality over price, Convenience",Research extensively before purchasing,Primary online,Monthly,Omnivorous,Moderate,Daily on major platforms,"Several trips a year, both domestic and international",Socially,Non-user,"High, involved in both personal and professional life",Married without children,2 persons,None,Yes,1 dog,Married,None,Good,None,Stable,Private,Good,Liberal,Always votes,Moderately engaged,1200,200,800,600
Female,Female,30 to 44,Married,Heterosexual,British,United Kingdom,Greater London,London,Urban,Apartment,5 years,Master,Non-student,Business Administration,Finance,£100000,Full-time employed,Renter,White,English,Agnostic,None,Citizen,"Traveling, Reading, Cooking",Quality and Sustainability,Prefers premium brands,Primary online,Monthly,Vegetarian,Moderately active,Frequent,Travels internationally 2-3 times a year,Socially,None,High,Married with no children,2,0,Yes,1,Married,None,Excellent,None,Good,Private,Good,Liberal,Regular voter,Moderately engaged,700,150,400,300
Female,Female,30 to 44,Married,Heterosexual,British,United Kingdom,Greater London,London,Urban,Apartment,5 years,Master,Non-student,Business Management,Finance,£80000 to £120000,Full-time,Renting,Caucasian,"English, French",Christian,Christmas and Easter celebrations,Citizen,"Traveling, Reading, Yoga","Quality over price, Sustainable products","Prefers branded goods, Seasonal shopper",Primary online,Monthly,Vegetarian,Moderately active,"Daily, primarily Instagram and LinkedIn","At least twice a year internationally, enjoys cultural exploration",Socially,Non-smoker,High-tech enthusiast,Nuclear family,3 members,1,Yes,1 dog,Married,Primary caregiver to child,Excellent,None,"Good, practices mindfulness",Private insurance,Excellent,Liberal,Always votes,Occasionally attends rallies and signs petitions,1000,200,600,400
Male,Male,30 to 44,Married,Heterosexual,British,United Kingdom,Greater London,London,Urban,Apartment,5 years,Master,Non-student,Computer Science,Technology,90000£ to 110000£,Full-time,Renting,Caucasian,"English, Spanish",Atheist,None,Citizen,"Technology, Travel, Reading, Cooking","Convenience, Quality","Research-driven, brand-conscious",Primary online,Monthly,Omnivore,Moderate (Gym twice a week),"Daily (Instagram, Twitter)",International travel annually,Socially,Never,Heavy (Professionally and personally),"Nuclear (Self, partner, children)",3,1,Yes,1,Married,Childcare primarily,Good,None,Good,Private,Good,Liberal,Regular voter,"Occasionally active (following news, occasional protests)",1500,150,800,500
Female,Female,30 to 44,Married,Heterosexual,British,United Kingdom,Greater London,London,Urban,Apartment,5 to 10 years,Master,No,Marketing,Marketing and Advertising,80000£ to 120000£,Full-time employed,Rents,White,English,Atheist,None,Citizen,"Traveling, reading, and photography","Convenience, quality, and discounts",Prefers brands that are ethical and sustainable,Primarily online,A few times a month,Vegetarian,Moderate,Regular on Instagram and LinkedIn,Travels internationally 2-3 times per year,Social drinker,None,"High - frequently uses smartphone, laptop and smart home devices",Living with spouse,2,None,Yes,1 cat,Married,None,Good,None,Good,Private health insurance,Good,Liberal,Regular voter,Moderately interested,1500,200,900,600
Female,Female,30 to 44,Married,Heterosexual,British,United Kingdom,Greater London,London,Urban,Apartment,5 years,Master,No,Business Administration,Marketing,£90000,Full-time,Renting,Caucasian,"English, French",Agnostic,None,Citizen,"Travel, reading, yoga","Convenience, quality","Monthly big purchases, weekly essentials",Primary online,Weekly,Vegetarian,Moderate,High,"Domestic trips quarterly, international annually",Socially,Never,High,"Spouse, no children",2,0,Yes,1 cat,Married,None,Good,None,Good,Private,Good,Liberal,Votes regularly in major elections,Moderate,1000,200,600,400
Male,Male,30 to 44,Single,Heterosexual,British,United Kingdom,N/A,London,Urban,Apartment,5 years,Master,No,Computer Science,Technology,100000£,Employed,Rents,White,English,Agnostic,None,Citizen,"Coding, Hiking, Travel, Gaming","Convenience, Quality",Research before purchasing,Primary online,Monthly,No dietary restrictions,Moderate,Daily,International travel twice a year,Socially,None,High,"Single, No dependents",1,0,No,0,Single,None,Good,None,Stable,Private,Good,Liberal,Always votes,Moderately engaged,800,200,600,400
Female,Female,30 to 44,Married,Heterosexual,British,United Kingdom,Greater London,London,Urban,Apartment,5 years,Master,No,Marketing,Marketing and Sales,£80000 to £120000,Full-time employed,Renter,Caucasian,English,Agnostic,None regularly practiced,Citizen,"Photography, Blogging","Quality over quantity, environmentally friendly","Planned, occasionally impulsive",Primary online,Monthly,Vegetarian,Moderate (3-4 times a week),"Daily, Variety of Platforms","Frequent, both for leisure and work",Socially,Non-user,"Highly proficient, multiple devices",Married with no children,2 adults,0,Yes,1 (Dog),Married,None,Good,None,"Generally well, with occasional stress",Privately insured,"Good, no barriers","Moderate, leans liberal",Always votes,"Somewhat active, mainly through awareness and donations",1500,200,800,500
Male,Male,35,Married,Heterosexual,British,United Kingdom,Greater London,London,Urban,Apartment,5 years,Master,No,Computer Science,Information Technology,£95000,Full-time employed,Renting,Caucasian,"English, French",Agnostic,None,Citizen,"Tech gadgets, running, cooking","Quality over price, convenience","Monthly bulk buying, prefers eco-friendly and sustainable brands",Primary online,Weekly,Omnivore with a preference for organic foods,Moderately active (exercises 3-4 times a week),Moderate (1-3 hours a day),"2 international trips a year, enjoys culturally immersive experiences",Social drinker,Non-smoker,Heavy user (both for professional and personal purposes),Couple with no children,2 adults,0,Yes,1 dog,Married,None,Very good,None,Stable,Privately insured,Easily accessible,Liberal,Regular voter,Occasionally participates in local political discussions and events,1500,100,800,500
Male,Male,30 to 44,Married,Heterosexual,British,United Kingdom,Greater London,London,Urban,Apartment,5 years,Master,No,Computer Science,Information Technology,100000£,Employed full-time,Renting,Caucasian,English,Atheist,None,Citizen,"Programming, Hiking, Reading, Traveling","Quality over price, Convenience, Brand loyalty",Researches products before purchase,Primary online,Monthly,No specific diet,Moderately active,"Moderate, mostly LinkedIn and Twitter for professional networking","2 international trips per year, plus several domestic trips",Socially,Non-smoker,"High, early adopter of new technologies",Nuclear family,3,1,Yes,1 dog,Married,Children,Excellent,None,Good,Private insurance,Easy access,Liberal,Regular voter,Moderately engaged,800,200,500,400
Male,Male,30 to 44,Married,Heterosexual,British,United Kingdom,Surrey,Guildford,Urban,House,5 years,Master,No,Computer Science,Information Technology,90000£,Full-time,Own,Caucasian,English,Atheist,None specific,Citizen,"Hiking, programming, and reading",Quality and durability,Planned and budgeted,Primary online,Monthly,No specific preferences,Moderately active,Daily,International travel 2 times a year,Socially,Never,High,Nuclear family,4,2,Yes,1 dog,Married,Partner and children,Good,None,Stable,Private insurance,Easy,Moderate,Regular voter,Low,1000,200,800,500
Male,Male,30 to 44,Married,Heterosexual,British,United Kingdom,Greater London,London,Urban,Apartment,5 years,Master,No,Computer Science,Technology,"£100,000",Full-time,Rents,Caucasian,English,Atheist,N/A,Citizen,"Coding, Gaming, Running","Convenience, Quality, Technology Access","Prefers quality over quantity; likely to invest in expensive, long-lasting items",Primary online,Monthly,No dietary restrictions,Active (3-4 times a week),Low,International travel once a year,Socially,Never,"High (involved in tech industry, early adopter of new technology)","Spouse, no children",2 adults,0,Yes,1 dog,Married,None,Good,None,Good,Private,Good,Liberal,Votes regularly,Moderately engaged,£800,£200,£500,£600
Female,Female,30 to 44,Married,Heterosexual,British,United Kingdom,West Yorkshire,Leeds,Urban,House,5 to 10 years,Master,No,Marketing,Marketing and Communications,90000£ to 110000£,Full-time,Owner,White,English,Agnostic,None,Citizen,"Reading, yoga, cooking",Quality and sustainability,Buys ethically sourced products,Primary online,Weekly,Vegetarian,Active (exercises 3-4 times a week),Moderate (2-3 hours daily),Enjoys 1-2 international trips per year,Social drinker,Non-user,High (uses technology for both work and personal life),Married with no children,2 adults,0,Yes,1 dog,Married,None,Good,None,Good,Insured,Has regular access,Liberal/Democrat,Always votes,"Somewhat engaged (follows news, occasionally attends local meetings)",1200,250,800,550
Male,Male,30 to 44,Married,Heterosexual,British,United Kingdom,Greater London,London,Urban,Apartment,5 years,Master,No,Computer Science,Information Technology,80000£ to 120000£,Full-time,Renting,White British,English,Agnostic,None,Citizen,"Programming, Cycling, Reading","Convenience, Quality",Research extensively before purchasing,Primary online,Monthly,No dietary restrictions,Moderate,Limited to professional networks,1-2 international trips per year,Social drinker,None,High,Nuclear family,3,1,No,0,Married,Childcare,Good,None,Stable,Private,Good,Liberal,Active,Moderate,1000,150,600,400
Female,Female,30 to 44,Married,Heterosexual,British,United Kingdom,Scotland,Edinburgh,Urban,Apartment,5 years,Master,No,Finance,Finance,£80000 to £120000,Full-time,Own,White British,English,Agnostic,None,Citizen,"Hiking, Reading, Cooking","Quality, Convenience","Buys sustainable products, occasionally splurges",Primary online,Weekly,No dietary restrictions,Moderately active,"Daily, mostly Instagram and LinkedIn",International travel once a year,Social drinking,Non-smoker,High,Married with one child,3,1,Yes,1 dog,Married,Parenting,Good,None,Generally good,Covered by employer,Good access,Liberal,Always votes,"Moderately engaged, mostly through voting and occasional online advocacy",600,200,400,450
Female,Female,30 to 44,Married,Heterosexual,British,United Kingdom,Greater London,London,Urban,Apartment,5 years,Master,Non-student,Finance,Finance,80000£ to 120000£,Full-time employed,Rented,Caucasian,English,Agnostic,None specific,Native-born,"Travel, Reading, Running","Convenience, Quality","Budget-conscious for everyday items, willing to splurge on quality for durable goods",Primary online,Weekly,No specific restrictions,Active (exercises 3-4 times a week),Daily (primarily Instagram and LinkedIn),"Leisure travel 2-3 times a year, mostly international",Socially,Non-smoker,"High (regular use of smartphone, laptop, and smart home devices)",Couple with no children,2 adults,None,No,0,In a long-term relationship,None,Good,None,"Generally well, occasional stress",Private,Good,Centrist,Regular voter,Moderately informed and intermittently discusses politics,1500,150,800,500
Female,Female,30 to 44,Single,Heterosexual,British,United Kingdom,Greater London,London,Urban,Apartment,2 years,Master,No,Marketing,Digital Marketing,100000£,Employed full-time,Renting,Caucasian,"English, French",None,None,Citizen,"Traveling, Yoga, Gardening","Convenience, Quality",Prefers eco-friendly and sustainable brands,Primary online,Weekly,Vegetarian,Moderate (3-4 times a week),Frequently (multiple times daily),International travel 2-3 times a year,Socially,Never,Heavy user (both personal and professional),"Single, no children",1,0,Yes,1 (cat),Single,None,Good,None,Stable,Private insurance,Easily accessible,Liberal,Votes in major elections,Somewhat engaged (follows political news),800,150,450,300
Male,Male,30 to 44,Single,Heterosexual,British,United Kingdom,Greater London,London,Urban,Flat,2 years,Master,No,Computer Science,Technology - Software Development,£100000,Full-time,Renter,White British,English,Atheist,None,Citizen,"Programming, Video Gaming, Hiking",Quality over Price,Prefers brand loyalty and eco-friendly products,Primary online,Monthly,Omnivore,Moderately Active,High - daily,2 international trips per year,Socially,None,Heavy user for both personal and professional life,Single without children,1,0,No,0,Single,None,Good,None,Good,Private insurance,Easy,Liberal,Regular voter,Occasionally participates in local political events,800,200,500,300
Male,Male,30 to 44,Married,Heterosexual,British,United Kingdom,Greater London,London,Urban,Apartment,5 years,Master,N/A,Computer Science,Information Technology,£100000,Full-time,Rents,Caucasian,English,Atheist,None,Citizen,"Hiking, Reading, Coding","Convenience, Quality",Environmentally conscious,Primary online,Monthly,No dietary restrictions,Moderate,Daily,International travel 2x per year,Social drinker,Never,High; early adopter,Nuclear,3,1,Yes,1 cat,Married,Childcare,Good,None,Stable,Covered by national health service,Good,Liberal,Regular voter,Occasionally participates in local elections and discussions,800,150,500,350
Female,Female,30 to 44,Single,Heterosexual,British,United Kingdom,Greater London,London,Urban,Apartment,5 years,Master,Part-time,Marketing,Advertising,90000£ to 110000£,Employed,Renting,White British,English,Agnostic,None,Citizen,"Photography, Travel, Cooking","Quality, Sustainability",Prefers boutique stores but largely shops online,Primary online,Monthly,Vegetarian,Moderate (3 times a week),"Daily (Instagram, LinkedIn)",International travel 2-3 times a year,Socially (Weekends),None,High (Uses technology for both work and leisure),Living Alone,1,0,Yes,1 (Dog),Single,None,Good,None,Stable,Private Healthcare,Good,Liberal,Votes in major elections,Moderately engaged (follows news but not active in politics),1200,200,800,600
Male,Male,30 to 44,Married,Heterosexual,British,United Kingdom,Greater London,London,Urban,Apartment,5 years,Master,No,Computer Science,Information Technology,£100000,Full-time,Rents,White,English,Atheist,None,Citizen,"Tech, Gaming, Hiking","Convenience, Quality",Prefers branded items,Primary online,Monthly,No restrictions,Moderately active,Daily,International travel yearly,Socially,Never,Heavy user,"Spouse, no children",2,0,Yes,1 cat,Married,None,Good,None,Good,Private,Good,Liberal,Regular voter,Occasionally engaged in discussions,850,200,500,400
Female,Female,35,Married,Heterosexual,British,United Kingdom,East Sussex,Brighton,Urban,House,5 years,Master,No,Environmental Science,Science and Research,"£95,000",Employed,Owns with mortgage,White British,"English, French",Agnostic,Sustainable living,Citizen,"Hiking, Reading, Organic gardening","Quality of products, Environmental impact",Buys organic and eco-friendly products,Primary online,Weekly,Vegetarian,High,Moderate,"Prefer eco-tourism destinations, travels 2-3 times a year",Socially,Never,Highly engaged with new technologies,Partner and one child,3,1,Yes,2 cats,Married,Primary caregiver to child,Very good,None,Generally stable,Private health insurance,Good,Liberal,Always votes,Active in local environmental causes,800,150,500,300
Male,Male,30 to 44,Single,Heterosexual,British,United Kingdom,Greater London,London,Urban,Flat,5 years,Master,No,Business Administration,Finance,£80000 to £120000,Full-time,Rents,Caucasian,English,Agnostic,None specified,Citizen,"Cycling, Gaming, Traveling","Quality over price, Convenience",Makes list but buys extra items seen,Primary online,"Weekly for essentials, monthly for extras",No restrictions,Moderately active,Frequent user,At least one international trip per year,Social drinker,Non-user,High - Both for personal use and work,Single,1,0,No,0,Single,None,Good,None,Generally well,Private,Good,Liberal,Regular voter,Moderately interested,2000,150,800,500
Male,Male,30 to 44,Single,Heterosexual,British,United Kingdom,Greater London,London,Urban,Apartment,5 years,Master,No,Computer Science,Technology,80000£ to 120000£,Full-time,Rents,Caucasian,English,Agnostic,None,Citizen,"Programming, Hiking, Reading","Convenience, Quality",Research heavily before purchase,Primary online,Monthly,No restrictions,High - regular engagement in physical activities,Moderate - daily but limited hours,Leisure travel abroad once a year,Socially,None,High - for both work and personal use,"Single, no children",1,0,No,0,Single,None,Very Good,None,Good - no reported conditions,Private health insurance,Good - access to both public and private health facilities,Moderate,Votes in major elections,Moderate - keeps informed but not actively involved,2000,150,800,450
Male,Male,30 to 44,Married,Heterosexual,British,United Kingdom,Greater London,London,Urban,Apartment,5 years,Master,No,Business Administration,Finance,£80000 to £120000,Full-time,Rented,White British,English,Agnostic,Non-practicing,Citizen,"Running, Reading, and Fine Dining",Quality and Convenience,"Budget-Conscious for Routine Items, Luxury for Personal Treats",Primary online,"Weekly for necessities, Monthly for luxuries","No Special Diet, Enjoys Variety",Active (Exercises 3-4 times a week),Moderate (Uses social media for news and staying in touch with family and friends),Frequent Domestic and International Traveler (3-4 trips per year),Social (Drinks Socially),Non-Smoker,High (Uses technology extensively for work and personal life),Joint (Lives with spouse and two children),4,2,Yes,1 (Dog),Happily Married,Children,Good,None,Stable,Covered through employment,Good (Lives close to medical facilities and has easy access to healthcare services),Moderate,Regular Voter,Moderately Engaged (Follows politics but does not actively participate in political activities),1200,300,800,550
Female,Female,30 to 44,Married,Heterosexual,British,United Kingdom,Greater London,London,Urban,Flat,5 to 10 years,Master,Non-student,Business Administration,Finance,£80000 to £120000,Full-time,Rented,Caucasian,"English, French",Agnostic,None,Citizen,"Reading, Traveling, Yoga","Quality over price, Brand loyalty",Eco-conscious provider preferences,Primary online,Monthly,Vegetarian,Moderately active,Highly active,International travel 2-3 times per year,Socially,Non-smoker,Highly proficient,Married with children,3,1,Yes,1 dog,Married,Children,Good,None,Good,Private,Good,Liberal,Regular voter,Moderately active,1000,200,600,400
Male,Male,30 to 44,Married,Heterosexual,British,United Kingdom,Greater London,London,Urban,Apartment,5 years,Master,Non-Student,Business Administration,Finance,80000£ to 120000£,Full-time Employed,Renter,White,English,Agnostic,None,Citizen,"Cycling, Reading, Traveling","Quality, Convenience","Research-intensive, Brand loyal",Primary online,Monthly,No restrictions,Moderate (3-4 times a week),Daily,International travel 2-3 times a year,Socially,Never,Highly engaged,Nuclear,3,1,Yes,1 dog,Married,Children,Good,None,Good,Private,Good,Liberal,Regular voter,Somewhat engaged,1000,200,600,400
Female,Female,30 to 44,Married,Heterosexual,British,United Kingdom,Greater London,London,Urban,Flat/Apartment,5 to 10 years,Master,No,Business Administration,Finance,£80000 to £120000,Full-Time,Owned,Caucasian,English,Agnostic,None,Citizen,"Running, Reading, Traveling","Quality, Convenience",Buys eco-friendly products,Primary online,Monthly,Vegetarian,High,Daily,International travel 2-3 times a year,Socially,Never,High,Couple with no children,2,0,Yes,1 dog,Married,None,Excellent,None,Good,Private,Easy,Liberal/Democratic,Always votes,Moderately engaged,1300,200,900,600
