Male,Male,30 to 44,Married,Heterosexual,British,United Kingdom,England,London,Urban,Apartment,5 years,Master,No,Computer Science,IT Consultant,£80000 to £120000,Full-time,Renting,Caucasian,English,Agnostic,None,Citizen,"Video games, Programming, Cycling",Quality and convenience,Research extensively before buying,Primary online,Monthly,Omnivore,Moderate,Daily,Annual international vacations,Socially,Non-user,Heavily dependent,Single-family home,3,1,Yes,1 Dog,Married,Children only,Good,None,Stable,Private insurance,Easy access,Liberal,Regular voter,Somewhat engaged,1000,150,700,500
Male,Male,30 to 44,Married,Heterosexual,British,United Kingdom,Greater London,London,Urban,Apartment,5 years,Master,No,Business Administration,Finance,90000£ to 110000£,Full-time,Rented,Caucasian,"English, Spanish",Atheist,None,Citizen,"Running, Chess, Coding","Quality, Convenience","Monthly major purchases, weekly necessities",Primary online,Weekly,No dietary restrictions,High,Less than 2 hours a day,2 international trips a year,Social drinker,Non-user,High,Nuclear,3 persons,1,Yes,1 dog,Married,Child rearing,Good,None,Stable,Private insurance,Easily accessible,Moderate,Active voter,Occasionally involved in local issues,1000,200,700,500
Female,Female,30 to 44,Married,Heterosexual,British,United Kingdom,England,London,Urban,Apartment,5 to 10 years,Master,No,Business Administration,Finance,£80000 to £120000,Full-time,Renting,Caucasian,English,None,Western,Citizen,"Yoga, Reading, Cooking","Quality, Convenience","Regular online shopper, occasional high street visits",Primary online,Weekly,Vegetarian,Moderate,Daily,2-3 international trips a year,Socially,Never,High,Nuclear,3,1,Yes,1,Married,Child,Good,None,Stable,Private,Good,Liberal,Regular voter,Moderately engaged,1000,200,500,400
Male,Male,30 to 44,Single,Heterosexual,British,United Kingdom,Greater London,London,Urban,Apartment,5 years,Master,No,Computer Science,Information Technology,£100000,Full-time,Rents,Caucasian,English,Atheist,None,Citizen,"Programming, Gaming, Hiking","Convenience, Quality",Research extensively before purchasing,Primary online,Monthly,No restrictions,Moderate (2-3 times a week),"Daily, primarily for news and entertainment",International travel 1-2 times a year for vacation,Socially,Non-smoker,"Heavy user, both for work and personal life","Single, no children",1,0,No,0,Single,None,Good,None,Good,Covered by employer,Easy access,Liberal,Regular voter,Occasionally engages in political discussions online,800,200,500,400
Male,Male,30 to 44,Married,Heterosexual,British,United Kingdom,England,London,Urban,Apartment,5 years,Master,No,Business Administration,Finance,80000£ to 120000£,Full-time,Owned,Caucasian,English,None,None,Citizen,"Reading, Exercise, Technology","Convenience, Quality","Research-driven, Brand-conscious",Primary online,Monthly,No dietary restrictions,Moderate,Daily,"2-3 times a year, international",Moderate,None,High,Nuclear,3,1,Yes,1,Married,Child,Good,None,Good,Private,Good,Liberal,Regular voter,Moderately engaged,1200,150,800,600
Male,Male,30 to 44,Married,Heterosexual,British,United Kingdom,England,London,Urban,Flat,5 to 10 years,Master,No,Computer Science,Information Technology,"£80,000 to £120,000",Full-time,Rented,White,English,Agnostic,None,Citizen,"Tech, cycling, and travel",Convenience and quality,"Careful researcher, occasional splurge",Primary online,Monthly,No special diet,Moderate,Daily,Couple of times a year internationally,Occasionally,Never,High,Nuclear family,4,2,Yes,1 dog,Married,Children,Good,None,Generally well,Private,Good,Liberal,Regular voter,Mild interest,1500,200,800,500
Male,Male,30 to 44,Married,Heterosexual,British,United Kingdom,Greater London,London,Urban,Apartment,5 years,Bachelor,No,Computer Science,Information Technology,£100000,Full-time,Renting,Caucasian,English,Atheist,None specific,Citizen,"Gaming, hiking, programming","Convenience, quality",Research online before buying,Primary online,Monthly,No restrictions,Moderately active,Daily,2-4 times a year,Socially,Never,Highly engaged,Nuclear,3,1,Yes,1 dog,Married,Child,Good,None,Good,Yes,Good,Liberal,Regular voter,Moderately engaged,1200,150,800,450
Male,Male,30 to 44,Married,Heterosexual,British,United Kingdom,England,London,Urban,Apartment,3 years,Master,No,Computer Science,Information Technology,£100000,Full-time,Renting,White,English,Agnostic,None,Citizen,"Gaming, Programming, Hiking","Convenience, Quality",Research extensively before purchasing,Primary online,Monthly,No restrictions,Moderate,Daily,"Annual international travel, frequent domestic trips",Occasionally,Never,Heavy,Couple with no children,2,0,Yes,1 dog,Married,None,Good,None,Good,Private,Good,Liberal,Always vote,Moderately engaged,500,150,300,250
Male,Male,30 to 44,Married,Heterosexual,British,United Kingdom,England,Manchester,Urban,Apartment,5 years,Master,No,Computer Science,Information Technology,"£100,000",Full-time,Renting,Caucasian,English,Atheist,None,Citizen,"Programming, Videogames, Hiking","Convenience, Quality",Prefers eco-friendly and high-quality products,Primary online,Monthly,Omnivore,Moderately active,Daily,"2 holidays per year, mostly domestic with occasional international travel",Socially,Non-user,High,Nuclear,3,1,Yes,1 dog,Married,Childcare,Good,None,Good,Employer Provided,Easy,Liberal,Regular voter,Occasionally participates in local events,700,250,500,350
Male,Male,30 to 44,Single,Heterosexual,British,United Kingdom,England,London,Urban,Apartment,5 years,Master,No,Computer Science,Information Technology,"£100,000",Full-time,Renter,Caucasian,English,Agnostic,None,Citizen,"Coding, hiking, reading science fiction",Quality over price,Planned purchases with occasional indulgences,Primary online,Monthly,No specific diet,Moderate (exercises 3-4 days a week),Regularly uses LinkedIn and Reddit,Enjoys annual international travel,Social drinker,Non-user,High (including smart home devices),Single,1,0,Yes,1 (cat),Single,None,Good,None,Stable,Private,Good access,Liberal,Votes regularly in national elections,Moderately engaged (reads about and discusses politics regularly),800,200,550,400
Male,Male,30 to 44,Married,Heterosexual,British,United Kingdom,Greater London,London,Urban,Apartment,5 to 10 years,Master,No,Business Administration,Finance,£80000 to £120000,Full-time,Rents,White,English,Atheist,None,Citizen,"Cycling, Cooking, Reading","Quality, Efficiency",Research before purchasing,Primary online,Monthly,No special diet,High,Moderate,"2-3 times a year, international and domestic",Socially,Never,High,Nuclear family,3,1,Yes,1 dog,Married,Childcare,Good,None,Good,Privately insured,Good,Liberal,Votes regularly,Occasionally engaged,500,150,300,250
Female,Female,30 to 44,Married,Heterosexual,British,United Kingdom,Greater London,London,Urban,Apartment,5 to 10 years,Master,No,Business Administration,Marketing,£90000 to £100000,Full-time,Renting,White,English,Christian,Christmas and Easter celebrations,Citizen,"Cooking, Reading, Yoga","Quality, Convenience, Sustainability","Plans purchases, Budget-conscious",Primary online,Monthly,Gluten-free,Moderate (3-4 times a week),Daily - Primarily Instagram and LinkedIn,"Annual international vacations, Frequent domestic weekend getaways",Social drinking,Never,"High - uses smartphone, laptop, and smart home devices",Couple with children,4,2,Yes,1 (dog),Committed,Primary caregiver to children,Good,None,"Good, with occasional anxiety",Private insurance,Good,Liberal,"Votes in all national elections, occasionally in local elections",Moderate - keeps informed and occasionally participates in local politics,1500,150,700,500
Male,Male,30 to 44,Married,Heterosexual,British,United Kingdom,Greater London,London,Urban,Apartment,5 to 10 years,Master,No,Computer Science,Information Technology,80000£ to 120000£,Full-time,Own,Caucasian,English,Agnostic,None specific,Citizen,"Coding, Gaming, Cycling","Quality over price, Technology, Environmentally friendly","Researches products meticulously before buying, Prefers quality goods",Primary online,Monthly,No specific requirements,Moderate,"Daily, primarily LinkedIn and Twitter","2-3 vacations a year, mostly within Europe",Social drinker,Non-smoker,Heavy user for both personal and professional purposes,Nuclear family,3,1,Yes,1 dog,Married,Child,Good,None,Stable,Private,Excellent,Centrist,Regular voter,"Moderately active, follows news and debates",1200,300,800,600
Female,Female,30 to 44,Single,Heterosexual,British,United Kingdom,England,London,Urban,Flat,5 years,Master,Non-student,Computer Science,IT and Services,£80000 to £120000,Full-time employed,Rents,White British,English,Atheist,None,Citizen,"Coding, Gaming, Yoga","Convenience, Quality, Sustainability",Researches products thoroughly before purchase,Primary online,Bi-weekly,Vegetarian,Moderately active,Daily,Travels abroad 2-3 times a year,Socially,Never,High,"Single, no dependents",1,None,Yes,1 cat,Single,None,Good,None,"Generally good, occasional anxiety",Has private health insurance,Easy,Liberal,Regular voter,"Moderately engaged, follows news and votes",1200,200,800,400
Male,Male,30 to 44,Married,Heterosexual,British,United Kingdom,Greater London,London,Urban,Apartment,5 years,Master,No,Computer Science,Information Technology,90000£ to 110000£,Full-time,Renting,Caucasian,English,Atheist,None,Citizen,"Coding, Biking, Reading","Convenience, Quality",Prefers branded items; shops monthly for essentials,Primary online,Monthly,Omnivore,Moderate,Daily,Bi-annually,Socially,No,High,Nuclear,3,1,No,0,Married,Parenting,Good,No,Stable,Private,Good,Liberal,Regular voter,Moderately engaged,1200,200,800,500
Male,Male,30 to 44,Married,Heterosexual,British,United Kingdom,Greater London,London,Urban,Detached house,3 years,Master,Not a student,Computer Science,Information Technology,£80000 to £120000,Full-time employed,Own with mortgage,Caucasian,English,Atheist,None,Citizen,"Technology, Travel, Reading","Quality, Convenience",Researches extensively before purchasing,Primary online,Monthly,No restrictions,Moderate (exercises 2-3 times a week),Daily (personal and professional use),International travel 2 times a year,Moderate (social drinking),None,High,Nuclear,3,1,Yes,1 dog,Married,Children,Good,None,Good,Private,Excellent,Liberal,Votes in all national elections,Moderately active (follows political news),int,int,int,300
Female,Female,30 to 44,Married,Heterosexual,British,United Kingdom,England,London,Urban,Apartment,5 years,Master,No,Business Administration,Marketing,"£80,000 to £120,000",Full-time,Rented,White,English,Christian,Western,Citizen,"Reading, Traveling, Photography","Quality, Convenience","Makes lists, budget-aware but makes occasional splurges",Primary online,Weekly,"Omnivore, occasional vegetarian meals",Moderate - exercises 3 times a week,Daily - especially platforms like Instagram and Facebook,"International travel 2-3 times a year, mostly for leisure",Socially,Non-user,High - uses smart devices and is active on multiple social media platforms,Nuclear family,3,1,Yes,1 dog,Married,Children,Good,None,"Generally good, with occasional stress",Private,Good - lives in a city with access to various healthcare services,Liberal,Always votes,"Moderately engaged - follows politics and votes, but is not actively involved in campaigning or activism",1200,250,800,600
Male,Male,30 to 44,Single,Straight,British,United Kingdom,Greater London,London,Urban,Apartment,5+ years,Master,Non-student,Computer Science,Technology,90000£ to 100000£,Full-time,Renting,Caucasian,English,Atheist,None,Citizen,"Software development, hiking, reading sci-fi","Convenience, quality","Research before purchase, price-conscious, prefers high-quality products",Primary online,Monthly,"Omnivorous, focuses on healthy eating",Moderate (exercises 2-3 times a week),"Daily, primarily Reddit and Twitter","Enjoys traveling 1-2 times a year, mostly for leisure and adventure","Occasional (1-2 times a week, socially)",Never,High (uses technology extensively both for work and personal use),Single,1,None,Yes,1 (dog),Single,None,Good,None,"Good, with occasional stress",Private insurance,Easy access,Liberal,Regular voter,Moderately informed and occasionally engages in discussions,1000,200,700,500
Male,Male,30 to 44,Married,Heterosexual,British,United Kingdom,Greater London,London,Urban,Apartment,5 years,Master,No,Computer Science,Information Technology,£100000,Full-time,Renting,White British,English,Atheist,None,Citizen,"Programming, video gaming, hiking, travel","Convenience, Technology, Quality","Prefers quality over price, brand conscious",Primary online,Monthly,No specific preference,Moderately active,"Daily - primarily LinkedIn, Reddit, and Twitter",1-2 international trips per year,Socially,Never,Heavy - uses technology for both personal and professional life,Nuclear family,3,1,Yes,1 dog,Married,Children,Good,None,Good,Private insurance,Good,Liberal,Regular voter,Somewhat engaged - follows news and participates in discussions,700,200,500,400
Male,Male,35,Married,Heterosexual,British,United Kingdom,Greater London,London,Urban,Apartment,5 years,Master,No,Computer Science,Information Technology,"£100,000",Full-time,Rented,White British,English,Atheist,None,Citizen,"Cycling, Tech Gadgets, Travel, Reading",Quality and Innovation,Researches extensively before purchase,Primary online,Monthly,Omnivorous,Active,Daily,International Travel twice a year,Societal,None,Heavy User,Spouse without children,2,0,Yes,1 (Dog),Married,None,Good,None,Good,Private,Good,Liberal,Always votes,Occasionally participates in local political discussions and events,600,200,400,500
Female,Female,30 to 44,Single,Heterosexual,British,United Kingdom,Greater London,London,Urban,Apartment,5 years,Master,No,Computer Science,Information Technology,£100000,Employed,Rents,Caucasian,"English, Spanish",Atheist,None,Citizen,"Programming, Hiking, Reading Sci-Fi","Quality over quantity, environmentally friendly products","Monthly bulk shopping, avoids plastic, prefers local produce",Primary online,Monthly,Vegetarian,Active (exercises 3-4 times a week),Moderate (2-3 hours daily),"Enjoys solo travel, 2-3 international trips a year",Social drinker (once a week),Never,"High (uses tech for work and personal life, early adopter)","Oldest sibling, has younger brother",2 (self and a roommate),None,Yes,1 cat,Single,None,Excellent,None,Good,Insured through employer,Easy access,Liberal/Democratic,Regular voter,"Somewhat engaged (follows politics, but not actively involved)",800,100,500,350
Male,Male,35,Single,Heterosexual,British,United Kingdom,Greater London,London,Urban,Apartment,5 years,Master,No,Computer Science,Technology,£95000,Employed,Renting,Caucasian,"English, French",Agnostic,None,Citizen,"Coding, Camping, Photography",Quality over quantity,Ethical and sustainable brands,Primary online,Monthly,Omnivore,Active,"Daily, primarily LinkedIn and Reddit","Annual international travel, frequent domestic trips",Social drinker,Non-smoker,"Highly proficient, uses technology for work and personal life",Single,1,0,No,0,Single,None,Excellent,None,Good,Private,Easy access,Liberal,Regular voter,Occasionally engages in political discussions and activism,2000,150,800,400
Male,Male,30 to 44,Single,Heterosexual,British,United Kingdom,Greater London,London,Urban,Apartment,5 years,Master,No,Computer Science,Technology,£80000 to £120000,Full-time,Renting,Caucasian,English,Agnostic,None,Citizen,"Programming, Video games, Travel","Convenience, Quality",Regular online shopping for tech and fashion,Primary online,Monthly,No specific diet,Moderately active,"Daily, primarily LinkedIn and Reddit",Internationally 1-2 times a year,Socially,None,"Heavy, both professionally and personally","Single, no children",1,None,No,None,Single,None,Good,None,Good,Private health insurance,Good,Liberal,Regularly votes,Low,1500,150,800,500
Male,Male,30 to 44,Married,Heterosexual,British,United Kingdom,Greater London,London,Urban,Apartment,5 years,Master,No,Business Management,Finance,£100000,Full-time,Renting,Caucasian,English,Atheist,None,Citizen,"Cycling, Reading, Traveling","Convenience, Quality",Buys eco-friendly products when possible,Primary online,Weekly,"No strict preferences, tends to eat balanced meals",Regular - 3 times a week,Moderate - uses for both personal and professional purposes,"Enjoys traveling, at least 2 international trips per year",Socially,No,"High - tech-savvy, uses smart devices for convenience",Nuclear,3,1,Yes,1 dog,Married,Children,Good,None,Stable,Private insurance,"Regular check-ups, easy access",Liberal,Always votes,Moderately informed and occasionally debates,1200,200,800,600
Male,Male,30 to 44,Single,Heterosexual,British,United Kingdom,Greater London,London,Urban,Apartment,5 years,Master,No,Information Technology,Technology - Software Development,80000£ to 120000£,Full-time,Renting,White,English,Atheist,None,Citizen,"Programming, Video Gaming, Traveling, Reading Science Fiction","Convenience, Quality, Technology","Budget-conscious, Research-oriented",Primary online,Monthly,No specific diet,Moderately active,"Daily, primarily Twitter and Reddit",Internationally 2-3 times a year,Socially,None,"High, early adopter",Oldest of three siblings,1,0,No,0,Single,None,Good,None,Stable,Through Employer,Good,Liberal,Votes regularly in major elections,"Moderate - follows news, occasionally participates in discussions",1000,200,500,400
Male,Male,30 to 44,Married,Heterosexual,British,United Kingdom,Greater London,London,Urban,Apartment,5 to 10 years,Master,No,Computer Science,Technology,90000£ to 110000£,Full-time,Renting,White,English,Agnostic,None,Citizen,"Programming, Cycling, Reading","Convenience, Quality","Budget-Conscious, Planner",Primary online,Monthly,Omnivorous,Active,Daily,Internationally once a year,Socially,Never,High,Nuclear family,2 adults,None,No,None,Married,None,Good,None,Stable,Covered by employment,Good,Liberal,Regular voter,Moderately engaged,1300,200,850,600
Female,Female,30 to 44,Single,Heterosexual,British,United Kingdom,England,London,Urban,Apartment,5 years,Master,No,Business Management,Marketing,£80000 to £120000,Full-time,Rents,White,"English, Spanish",Agnostic,Western,Citizen,"Traveling, Yoga, Reading",Quality and Brand Reputation,Buys eco-friendly and sustainable products,Primary online,Monthly,No dietary restrictions,Moderate - exercises weekly,High - engages daily,International travel 2-3 times a year,Socially,Never used,High - utilizes technology for both work and personal life,"Single, No children",One-person household,None,Yes,One - a cat,Single,None,Good,None,"Generally positive, occasional stress",Privately insured,Easily accessible healthcare,Liberal,Always votes,Moderately engaged - follows politics and participates in elections,1000,200,700,500
Male,Male,30 to 44,Married,Heterosexual,British,United Kingdom,Greater London,London,Urban,Apartment,5 years,Master,No,Computer Science,Information Technology,£80000 to £120000,Full-time,Renting,White,English,Agnostic,None,Citizen,"Programming, Cycling, Reading Science Fiction","Convenience, Quality, Technology",Researches extensively before buying,Primary online,Once a month,Omnivore,Moderate (3 days a week),Moderate (up to 2 hours/day),Domestic and international travel 2 times a year,Socially,Never,High,Nuclear,3 persons,1,Yes,1 (Dog),Married,Child,Good,None,Good,Private,Good,Centrist,Votes in major elections,Somewhat engaged,1500,200,1000,600
Female,Female,35,Married,Heterosexual,British,United Kingdom,Greater London,London,Urban,Apartment,5 years,Master,No,Business Management,Finance,£100000,Full-time,Renting,White British,"English, French",Atheist,None,Citizen,"Running, Reading, Traveling","Convenience, Quality",Regular online shopping for convenience,Primary online,Weekly,Pescatarian,Highly active,"Daily, predominately Instagram and LinkedIn",Frequent international travel for leisure,Socially,None,"High, proficient in latest technologies and platforms for both personal and professional use",Nuclear family with spouse,2,None,Yes,1 dog,Married,None,Excellent,None,Good,Private policy,Good - private healthcare,"Moderate, leans towards Liberal Democrats",Regular voter in major elections,Moderately engaged through social media and discussions with friends/family,1000,150,500,400
Male,Male,30 to 44,Married,Heterosexual,British,United Kingdom,England,London,Urban,Apartment,5 years,Master,No,Computer Science,Technology,£100000 to £120000,Employed,Renting,Caucasian,English,Agnostic,None,Citizen,"Coding, Gaming, Hiking","Convenience, Quality","Buys premium products, plans purchases",Primary online,Monthly,Omnivore,Moderate,Moderate,2-3 trips a year,Socially,Never,High,Couple with children,3,1,Yes,1 dog,Married,To children,Good,None,Good,Private,Good,Liberal,Regular voter,Somewhat active,1500,150,800,400
Male,Male,30 to 44,Single,Heterosexual,British,United Kingdom,England,London,Urban,Apartment,5 years,Master,No,Business Administration,Project Management,90000£ to 120000£,Full-time,Rents,Caucasian,"English, French",Atheist,Non-specific,Citizen,"Hiking, Reading, Gaming",Quality and convenience,Researches thoroughly before buying,Primary online,Monthly,No specific diet,Moderate,Daily,"2-3 times a year internationally, frequently domestically",Social drinker,Non-smoker,Highly proficient,"Single, no dependents",1 Adult,0,Yes,1 - Cat,Single,None,Good,None,"Generally positive, occasional stress",Private insurance through employer,Regular access to all necessary healthcare services,Liberal,Regular voter,Occasionally attends local political events and signs petitions,1000,200,800,600
Female,Female,30 to 44,Married,Heterosexual,British,United Kingdom,Greater London,London,Urban,Apartment,5 years,Master,No,Business Management,Financial Services,£80000 to £120000,Full-time,Rented,White British,English,Agnostic,None,Citizen,"Yoga, reading, traveling","Quality, sustainability",Researches extensively before purchasing,Primary online,Monthly,Vegetarian,Active (3-4 times a week),Daily,International travel 2-3 times a year,Socially,Never,High (uses technology for both work and personal life),Couple with no children,2 adults,None,Yes,1 (Dog),In a relationship,None,Excellent,None,Good,Privately insured,Good,Liberal,Always votes,"Moderately engaged (follows political news, sometimes participates in discussions)",1200,400,800,600
Female,Female,30 to 44,Married,Heterosexual,British,United Kingdom,Greater London,London,Urban,Apartment,5-10 years,Master,Non-student,Business Administration,Finance,80000£ to 120000£,Full-time,Renting,Asian,"English, Mandarin",Buddhist,Participates in traditional festivals,Permanent Resident,"Yoga, reading, cooking","Quality over price, sustainability",Monthly big purchases with frequent small purchases,Primary online,Weekly,Vegetarian,Moderately active,Daily,2-3 times a year internationally,Socially,Never,High,Nuclear family,3,1,Yes,1 dog,Married,Child and pet,Good,None,Stable,Private,Good access,Liberal,Always votes,Moderately engaged,1100,350,900,750
Female,Female,30 to 44,Married,Heterosexual,British,United Kingdom,Greater London,London,Urban,House,5 years,Master,Non-student,Business Administration,Finance,£80000 to £120000,Full-time employed,Owned,Caucasian,"English, Spanish",Agnostic,None specific,Citizen,"Yoga, reading, travel","Quality over quantity, sustainability",Prefers brands with ethical practices,Primarily online,Monthly,Pescatarian,Active,"Daily, primarily Instagram and LinkedIn",International travel 2-3 times a year,Socially,None,"High, for both professional and personal use",Nuclear,3,1,Yes,1 dog,Married,Child,Good,None,Stable,Private,Good,Liberal,Regular voter,Occasionally engaged in discussions and follows news,1500,150,800,500
Male,Male,30 to 44,Married,Heterosexual,British,United Kingdom,Greater London,London,Urban,Apartment,5 years,Master,No,Computer Science,Technology,£80000 to £120000,Full-time,Rent,Caucasian,English,Atheist,None,Citizen,"Tech, Gaming, Reading","Convenience, Quality","Monthly big purchases, regular minor purchases",Primary online,Weekly,No dietary restrictions,Moderate,Daily,2-3 times a year,Socially,None,Very high,Nuclear,3,1,Yes,1,Married,Child,Good,None,Good,Private,Easy,Liberal,Regular,Moderately engaged,500,150,300,400
Male,Male,30 to 44,Single,Heterosexual,British,United Kingdom,Greater London,London,Urban,Apartment,5 to 10 years,Master,No,Computer Science,Information Technology,£80000 to £120000,Full-time,Renting,Caucasian,English,Agnostic,None,Citizen,"Technology, Reading, Fitness","Quality, Convenience","Budget-conscious, Brand-loyal",Primary online,Monthly,No dietary restrictions,High,Daily,"2-3 times a year, mostly international",Socially,Never,High,"Single, no children",1,0,Yes,1,Single,None,Good,None,Good,Covered by employer,Good,Liberal,Regular voter,Somewhat engaged,1000,200,800,600
Female,Female,30 to 44,Married,Heterosexual,British,United Kingdom,England,London,Urban,Apartment,5 to 10 years,Master,No,Economics,Finance,£80000 to £120000,Full-time,Rents,White,"English, French",Agnostic,Primarily Western.,Citizen,"Gardening, Reading, Travel","Convenience, Quality",Researches extensively before buying,Primary online,Monthly,No specific diet,Moderate,Daily,International travel 2-3 times a year,Social drinker,Non-user,Highly proficient,Married with children,4,2,Yes,1 dog,Married,Children,Good,None,Generally well,Private insurance,Good,Liberal,Active voter,Moderately engaged,1000,200,600,400
